restaurant_code,rating,feeling,customerId,commentText
p5wjme,10,HAPPY,6122993,آقا نوشابه نذاشتین، دو دفعه داره پیش میاد، لطفن دقت کنین. بازم ممنون
p5wjme,4,SAD,1042272,برگر بي كيفيت بود، نان له شده و مانده 
p5wjme,0,HAPPY,11399867,نمیدونم چه جوری کیفیت وطعم فوق العاده غذا رو توصیف کنم واقعا عالی بود گرم و به موقع رسید دستم ممنون از احترامی که به مشتری میذارید
p5wjme,8,HAPPY,8573385,شعبه دولت بهتر بود غذاش شاید چون دیروقت سفارش دادم غذاها کمی مونده بود مخصوصا سیب زمینی و طعم روغن مونده در سادویچ دونر استیک 
p5wjme,10,HAPPY,442417,واقعا عالی ، با کیفیت ، گرم و لذیذ 
p5wjme,10,HAPPY,234811,خوب بود. فقط سس کف پیتزا کم زده شده بود
p5wjme,10,HAPPY,10393392,کلا تا حالا نشده از شیلا چیزی سفارش بدم و بد باشه ولی این سری یه مقدار دیر رسید به دستم ولی غذا عالی بود
p5wjme,6,HAPPY,12412431,مرغ و بادمجان رو جهت سالمتر بودن غذا انتخاب ميكنيم اما بقدري پنير پيتزا داشت كه متوجه طعم ديگري نميشدي
p5wjme,10,HAPPY,3697576,دونر عالی بیست
p5wjme,10,HAPPY,11280458,خیلی عالی با برگر و بقیه مواد خیلی فرش و تازه آماده شده بود و واقعا کیفیت عالی داشت ،پربرکت باشن.
p5wjme,10,HAPPY,2476948,خیلی خوشمزه و خوب بود، مرسی. تازه و گرم. نونش هم مثل سمبوسه حالت سرخ شده یا گریل شده داشت.
p5wjme,10,HAPPY,331317,عالی بود 
p5wjme,10,HAPPY,314045,سالاد خوب و با کیفیت و البته خوش قیمت ، هات داگ مث همیشه نبود و نون مونده داشت ، دونر استیک عالی بود پر از گوشت و خوشمزه 
p5wjme,10,HAPPY,2957518,خیلی خوب بود ممنونم
p5wjme,10,HAPPY,651887,زود و گرم رسید ،عالی بود ممنون
p5wjme,10,HAPPY,483325,خیلی خوشمزه بود
p5wjme,10,HAPPY,1816314,"پيتزاش عالي بود و كراكف هم مثل هميشه با كيفيت و سوخازي هم خوب 
كلا من هميشه از شيلا راضي هستم "
p5wjme,10,HAPPY,3410374,گرم رسید و طعم خوبی داشت، ممنون از شیلا
p5wjme,8,HAPPY,1489269,بسیار سریع ارسال شد.در حد خودش خوب و خوشمزه هست ولی میتونه کمی پر ملات تر باشه.
p5wjme,8,HAPPY,3834455,چیکن استریپس کمی خشک بود. سس سالاد گاردن ارسال نشده بود. پیتزا سبزیجات خوب بود.... 
p5wjme,10,HAPPY,2836393,همه چی عالی
p5wjme,8,HAPPY,1066686,نون ساندویچ خوب نبود
p5wjme,10,HAPPY,3074108,بی نظیر بود مثل همیشه 
p5wjme,0,SAD,317804,اصلا ربطی به پیتزای گوشت و قارچی که میگرفتم همیشه نداشت، افت کیفیت زیاد !
p5wjme,10,HAPPY,176992,"به معنای واقعی احترام به مشتری توی این سفارش مشهود بودچون درخواست دادم عجله دارم خیلی زودتر از عُرف بدستم رسیدغذا بشدت لذیذ و خوشمزه بود
ممنون از همه چیز 
دیگه مشتری استرامبولی هاتون شدم رفت"
p5wjme,6,HAPPY,230003,کیفیت غذا چندان مطلوب نبود
p5wjme,10,HAPPY,7849140, عالی بود ممنون 
p5wjme,10,HAPPY,11988052,سس رو داخل ساندویچ بریزید نه لبه ی ساندویچ بقیش عالی بود ممنون
p5wjme,8,HAPPY,9572513,خيلي چرب بود
p5wjme,10,HAPPY,168577,عالى بود ممنونم 
p5wjme,8,HAPPY,7591142,استامبولی خیلی کوچیک بود و کلا ۷تا سیب زمینی کنارش بود که نسبت به قیمتش ارزش نداره پیتزا هم معمولی بود و قیمتش بالا
p5wjme,10,HAPPY,3053993,"اولین‌بار نیست که از شیلا خرید می‌کنم 
مثل همیشه عالی، باکیفیت و خوش‌مزه..."
p5wjme,10,HAPPY,293138,طعم پیتزا عالی بود، فقط یادشون رفته بود، سس بگذارند 
p5wjme,4,SAD,1777130,من انتظارم خیلی بیشتر از این بود. بادمجون کبابی نبود و نون ش به شدت خمیر بود. 
p5wjme,8,HAPPY,12143856,"به موقع و گرم رسید 
حجم‌سیب زمینی کم‌بود
مزه ش خوب‌بود
در کل خوب بود ولی عالی‌ نه"
p5wjme,4,SAD,3379375,افتضاح بود پیتزاش 
p5wjme,10,HAPPY,1157113,"هر دو ساندویچ عالی و خوشمزه بود... خیلی هم به موقع رسید
شیلا همیشه درجه یک هست."
p5wjme,8,HAPPY,1004649,پیتزا یه مقدار تر بود خمیر شده بود
p5wjme,10,HAPPY,5615587,خیلی خوشمزه اس واقعا
p5wjme,10,HAPPY,11760060,بسیار عالی فقط لطفا به توضیحات توجه فرمایید متشکرم
p5wjme,2,SAD,529156,کیفیت پایین، توصیه نمی‌کنم
p5wjme,10,HAPPY,6944152,کیفیت خوب است، ولی نسبتا قیمتها بالاست.
p5wjme,10,HAPPY,3813114,خوش طعم و با کیفیت، بسته‌بندی بهداشتی، حجم مناسب، آماده سازی و ارسال سریع 
p5wjme,10,HAPPY,3074108,بی نظیر مثل همیشه 
p5wjme,10,HAPPY,291964,همه چیز خیلی عالی بود امیدوارم این کیفیت حفظ بشه
p5wjme,2,SAD,180629,پیتزا جوری بود که انگار یه سری مواد رو همینطوری ریختن رو نون و کاملا نپخته و خام، ساندویچ هات داگ هم همینطور، برگر برخلاف اینا درحد سوخته بود
p5wjme,10,HAPPY,5941025,همه چیز خیلی خوب بود. غذا به موقع و سریع حاضر شد. پیتزا طعم همیشگیش رو داشت. سالاد کاملا تازه بود و آب ننداخته بود و با اینکه کنار پیتزا بود گرم نشده بود. دلستر خنک بود. در کل همه چی عالی بود مرسی
p5wjme,10,HAPPY,366944,بسیار عالی و سریع رسید
p5wjme,10,HAPPY,5628330,شيلا طي اين چند سال كه ازشون غذا مي گيرم معمولا كيفيت خودش رو خفظ كرده و تقريبا هميشه از سفارشم راضي بودم
p5wjme,10,HAPPY,10416200,عالی بود، فوق العاده خوشمزه بود تاحالا امتحان نکرده بودم . ممنونم از مدیریت رستوران با کیفیت عالی که دارید 
p5wjme,10,HAPPY,776640,عالییی عالییی عالیییی
p5wjme,4,SAD,3868068,پیتزا مرغ خیلی بی مزه.اصلا طعم نداشت.به خدا ادویه و سس برای مزه سازی هست.استفاده کنید.پیتزا کویین باتوجه به قیمت و سایز کوچیک کنارش یه هات داگ داشت که فکر کنم ۵۰درصد بود.یابا این همه پول میگیرین جنس خوب بزارین
p5wjme,10,HAPPY,4082571,بي نظيررررر بود
p5wjme,10,HAPPY,776640,عالیییی بی نظیر اصن خیلی خوبه این سیب زمینییی 
p5wjme,10,HAPPY,7606740,"مانند همیشه این بار نیز کیفیت غذا بسیار عالی بود 
"
p5wjme,10,HAPPY,3584212,عالی مثل همیشه
p5wjme,10,HAPPY,3383985,عالی
p5wjme,0,HAPPY,5021963,دونر استیک پنیری سفارش دادم، استرامبولی ژامبون پنیری فرستادین
p5wjme,2,SAD,3360766,چرب و بي محتوا
p5wjme,10,HAPPY,12397247,مرسی همه چی عالی
p5wjme,8,HAPPY,182541,شیلا همیشه خوب بوده ولی اینبار استرامبولی مرغ و اسفناج قابل خوردن نبود به دلیل موندگی و طعم بد اسفناج.حتما که اتفاقی بوده
p5wjme,8,HAPPY,1483241,غذا خیلی خوشمزه بود اما به نسبت قیمت، حجم غذا خیلی کم بود
p5wjme,10,HAPPY,3675926,خیلی خوشمزه بود مرسییی
p5wjme,2,SAD,3915763,واقعا بد بود از هرنظر
p5wjme,10,HAPPY,5073708,"فوق العاده بود ، فوق الللللعاده .. طعم خاصي داشت حتما سري هاي بعد طعم هاي ديگه رو هم امتحان ميكنم:)
لطفا كيفيت رو همينجوري نگه داريد"
p5wjme,4,SAD,1014267,اصلا انتظار طعم یا مزه خاصی نداشته باشید. 
p5wjme,8,HAPPY,375258,لطفا نانهای ساندویچ ها را تغییر بدهید 
p5wjme,10,HAPPY,493198,چیکن استریپ خوشمزه و خوش طعم‌ بود
p5wjme,4,SAD,3049665,پنیر و سس قارچ ان بسیارررر کم و چیکن برگر هم مثل سابق ترد و تازه نبودش
p5wjme,10,HAPPY,151657,سریع، تازه و داغ تحویل گرفتم
p5wjme,8,HAPPY,8888121,حجم مواد داخلش کم شده بود
p5wjme,10,HAPPY,9686953,خیلی خوب بود، واقعا خوشمزه بود،، من ۵ سال هست مشتری شیلا هستم از افتتاح این شعبه خیلی خوشحال شدم،، نامبر وانتون پیتزا کویین هست البته دونر هم بسیار لذید بود. ممنون
p5wjme,10,HAPPY,5272957,خوشمزه و عالی
p5wjme,10,HAPPY,6107371,عالی بود
p5wjme,10,HAPPY,3630039,خیلی خوشمزه بود و گرم و سریع رسید، ممنون
p5wjme,10,HAPPY,3031576,"واقعا خوشمزه و لذیذ بود 
فقط قبلا سیب زمینی ش خیلی بیشتر بود ..کم شده "
p5wjme,8,HAPPY,3991494,بزرگوار در بسته‌ی چنگال و چاقو یک نی هست، لازم نیست برای نوشیدنی نی اضافی بگذارید. ممنون.
p5wjme,10,HAPPY,7018912,مثل شعبه هاى ديگه عالى
p5wjme,8,HAPPY,3741830,کیفیت خوب بود ولی دیر آوردن یکم سرد شده بود 
p5wjme,10,HAPPY,154756,عالیییییییی بود طعمش به سرعت هم رسید دستم ممنون
p5wjme,10,HAPPY,5210348,عالی بود . فوق العاده 
p5wjme,10,HAPPY,2614270,"عاااااالی بود
بسیار خوشمزه، با کیفیت
"
p5wjme,10,HAPPY,3074108,مثب همیشه بی نظیر 
p5wjme,8,HAPPY,4556485,دونر استیک عالی 
p5wjme,10,HAPPY,4840806,خیلی خوب و خوشمزه
p5wjme,2,SAD,4388881,"سالاد خوب بود مثل قبل ولی مناسفانه فیله ها سوخته و مونده بودن برعکس دفعه ی قبل 
خیلی حیف که کیفیت و‌‌نمیتونن ثابت نگه دارن"
p5wjme,6,HAPPY,1679580,سالاد اصلا تازه نبود
p5wjme,10,HAPPY,9057484,علییی بود 
p5wjme,0,HAPPY,504288,عالی
p5wjme,8,HAPPY,2925832,روى پيتزا سوخته بود
p5wjme,10,HAPPY,1535861,عالی بود
p5wjme,4,SAD,3476401,گوشت بسیار کم بود و قیمتش نسب به حجم بالاست و اصلا طعم خوشمزه نداشت
p5wjme,10,HAPPY,8797820,مرسی عالی بود
p5wjme,2,SAD,3125176,واقعا همش نون و کاهو بود اصلا به حد استانداردم داخلش مرغ و گوشت نبود 
p5wjme,10,HAPPY,2748601,منکه لذت برم بسیار ازشون سپاس گذارم
p5wjme,10,HAPPY,881202,بسیار عالی و خوشمزه بود 
p5wjme,8,HAPPY,5727320,خیلی به موقع سفارش ها آماده میشه و طعم عالی‌، فقط نان سیر زیاد برشته شده بود.
p5wjme,6,HAPPY,306643,استرامبولی حجم زیادی از سس سفید و پنیر داشت و به شدت چرب بود. 
p5wjme,10,HAPPY,11592344,بسیار خوش طعمو عالی پسرم عااااشق است آمبولی بینظیرتون شد و پیتزای با کیفیت
p5wjme,10,HAPPY,9393492,عالی بود دمتون گرم
p5wjme,4,SAD,4553833,ساندویچ پر از پنیر و ناسالم
p5wjme,10,HAPPY,7594105,"بسیار عالی و داغ بود
حظ بردم آفرین به شیلا"
p5wjme,2,SAD,6959790,در پیتزامرغ به هیچ وجه اثری از مرغ یافت نمیشد. بی کیفیت. 
p5wjme,8,HAPPY,4081842,خوب و خوشمزه
p5wjme,10,HAPPY,7354387,همه چی عالی بود سریع رسید بسته بندی بسیار خوب طمع و بوی غذا هم عالی تجربه خوبی بود 
p5wjme,10,HAPPY,9279402,خوشمزه بود و نون اش هم تازه بود
p5wjme,8,HAPPY,185332,سایز پیتزا کم است. 
p5wjme,8,HAPPY,448290,کیفیت بسیار عالی، حجم مناسب و معمولی، قیمت بالا. کلا شیلا همیشه اینطوره ((:
p5wjme,8,HAPPY,2473511,قبلا بهتر  بود ،گوشت کمی سفت و بی طعم بود
p5wjme,2,SAD,4785663,این سفارشو از شعبه های دیگ گرفته بودم عالی بود و لی این شعبه متاسفانه از کیفیت قابل قبول بر خوردار نبود
p5wjme,6,HAPPY,173342,طعم اسفناج و مرغ به تلخی میزد
p5wjme,8,HAPPY,720446,استرامبولی ژامبون پنیرشون دربرابر استرامبولی استیک و پنیرشون حرفی واسه گفتن نداره
p5wjme,4,SAD,2173756,"سالاد سزار ک اصن خوب نبودد 
پیتزا مخلوط هم معمولی بود"
p5wjme,4,SAD,2046516,"گوشت بسیار کمی داشت و شور بود با توجه به قیمت
اولین و اخرین سفارش"
p5wjme,8,HAPPY,10416200,عکس نان سیر با خود نان سیر تفاوت دارد ، قیمت به نسبت حجم بالاست اما خوشمزه می‌باشد . 
p5wjme,8,HAPPY,825027,روی نون یکم سوخته بود اما طعمش خوب بود 
p5wjme,4,SAD,180629,سیب زمینی کاملا بیات و از دهن افتاده بود
p5wjme,10,HAPPY,3651255,تازه و با کیفیت و داغ .خیلی گوشتش خوشمزه و با کیفیت بود.دستتون درد نکنه بعد از مدتها برگر با کیفیت خوردم
p5wjme,8,HAPPY,4129622,پیتزاش خیلی چرب بود ولی طعمش خوب بود
p5wjme,8,HAPPY,3651255,استرامبولی مرغ و بادمجان خوشمزه بود ولی مرغ و اسفناج رو نتونستیم بخوریم چون اسفناجش خیلی تلخ بود.
p5wjme,10,HAPPY,3045799,عالی بود
p5wjme,10,HAPPY,4018785,پيتزا كويين واقعاً خوشمزه بود مخصوصا تو اين شعبه
p5wjme,10,HAPPY,3259957,"هم خوشمزه بود هم سریع ارسال شد 
برخورد پرسنل هم بسیار عالی بود
البته به نظر من خمیرش نازک بود اگه ضخیمتر بود حس بهتری میداد 
"
p5wjme,10,HAPPY,291964,خیلی خوشمزه بود فقط من نان پیتزای قدیم رو ترجیح میدادم 
p5wjme,10,HAPPY,3675926,خوشمزه و تازه و جدید.ممنون
p5wjme,10,HAPPY,147583,ممنونم خوب بود 
p5wjme,10,HAPPY,4161308,عالی بود ممنون 
p5wjme,10,HAPPY,3814118,با کیفیت و خوب
p5wjme,10,HAPPY,6404454,سریع رسید و پیتزا هنوز گرم بود.ممنونم
p5wjme,10,HAPPY,3697031,خیلی گرم و خوشمزه بود 
p5wjme,10,HAPPY,13411994,ممنون
p5wjme,4,SAD,8779635,از همه لحاظ خوب بود فقط تندیش به تلخی میزد
p5wjme,10,HAPPY,3729641,غذا مثل هميشه عالى بود... ارسال به موقع و آقاى پيك هم خيلى مودب بودند.
p5wjme,10,HAPPY,10100938,everything was perfect! the food.... soooo delicious  thanks a lot Shila
p5wjme,10,HAPPY,4704046,خوب
p5wjme,10,HAPPY,8249001,کیفیت و بسته بندی خیلی عالی داشتن. همه چیز عالی بود
p5wjme,8,HAPPY,12280658,خوب
p5wjme,10,HAPPY,9065349,بسیار خوشمزه ......رفتار پرسنل هم بسیار محترمانه
p5wjme,10,HAPPY,6162451,عالی
p5wjme,10,HAPPY,8091697,"عالی بود. غذای گرم و لذیذ. 
اسنپ فود هم خیلی سریع غذارو تحویل داد"
p5wjme,10,HAPPY,3676874,دونر استیک پنیری فوق‌العاده بود و تجربه‌ی جدیدی برای من بود. سس های دست‌ساز خوش‌طعم بود، اما سس روی سیب‌زمینی اصلا طعم سس آلفردو نمیداد.
p5wjme,10,HAPPY,1470627,درجه يك و بينظير
p5wjme,10,HAPPY,11799995,عالی عالی عالی گرم خوشمزه تازه خوش کیفیت همه چی عالی عالی عالی
p5wjme,0,HAPPY,1507849,خیلی خوب طبخ شده بود... دمتون گرم
p5wjme,10,HAPPY,3865778,مثل همیشه عالی 
p5wjme,10,HAPPY,7456750,از برخورد مشتری مدار و غذای خوبتان بسیار سپاسگزارم
p5wjme,10,HAPPY,3672260,مثل همیشه عالی بود
p5wjme,10,HAPPY,1460281,عالی و خوشمزه مثل همیشه
p5wjme,8,HAPPY,2875237,با اينكه قيمت از يكماه قبل بيشتر شده ولي گوشت رست بيف به نسبت دفعات قبل كم تر شده بود.
p5wjme,6,HAPPY,8630820,"من تا الان ۳ بار سفارش دادم از شیلا بار اول خیلی خوب بود و دقیقا هرچه که در کامنت نوشتم برای اجرا شد و‌کیفیت پیتزا هم عالی بود بار‌دوم کیفیت پیتزا پایین اومده بود ولی چیزهای که خواسته بودم را انجام دادن. ولی بار سوم واقعا کیفیت نسبت به بار‌اول خیلی پایین تر بود ، پیتزا سرد بود ، نوشیدنی دلستر ساده سفارش داده بودم ولی با طعم هلو برام فرستادن، حتی سس سیر که در کامنت بیشتر خواسته بودم حتی یکی هم نذاشته بودن 
ولی از نوش جانی که روی فاکتور نوشته بودن خیلی خوشم میاد "
p5wjme,10,HAPPY,153030,"- سرعت ارسال عالی ، کیفیت خوب ، طعم خوب
- بسته بندی جدید سیب زمینی ها و گذاشتن درب باعث شده بود بسته بندی هم بهداشتی تر باشه و هم سس داخل پاکت نریزه
- همچنین ارسال پک چنگال و دستمال کنار غذا"
p5wjme,10,HAPPY,12482816,ممنون عالی بود 
p5wjme,10,HAPPY,11051240,همه چیز فوق العاده بود
p5wjme,10,HAPPY,316584,خوب بود و خیلی پر حجم نبود که دل آدم رو بزنه.  فقط شاید اگر یکم از کالباس بهری همراه با یکم ادویه های طعم دهنده بیشتری استفاده میشد، می تونست خوشمزه تر بشه. تشکر
p5wjme,10,HAPPY,8049829,بسیار گرم و خوشمزه، ممنون از شیلا
p5wjme,10,HAPPY,6953800,خوشمزه و تازه و کیفیت خوبشون بینظیره. ممنونم از صاحب و مدیریت و کارکنانه خوبه این مجموعه
p5wjme,10,HAPPY,3074108,عالی بی نظیر مثل همیشه 
p5wjme,10,HAPPY,3074108,واقعا خوش مزه بود و بی نظیر من شخصاً شیفته پیگریشون شدم به شخص واقعا کار قشنگی که بعد از ارسال جویا میشن از وضعیت غذا با تشکر از کادر شیلا 
p5wjme,10,HAPPY,147825,غذاهاتون بسیار عالی، تازه و خوشمزه است مخصوصا پیتزا که منو میبره به زمان گذشته دستتون درد نکنه و امیدوارم این روند را حفظ کنید
p5wjme,10,HAPPY,9777695,عالیییی
p5wjme,10,HAPPY,476497,طعم غذا عالییییی بود ممنون از شیلا
p5wjme,10,HAPPY,1980262,عالی
p5wjme,10,HAPPY,5616256,خیلی خوش طعم بود .با بسته بندی بهداشتی و عالی ممنونم از رستوران شیلا
p5wjme,10,HAPPY,5589955,عالی بود زودتر از زمان مقرر هم رسید گرم و خوشمزه 
p5wjme,10,HAPPY,7799640,با کیفیت بود
p5wjme,10,HAPPY,3974659,خیلی ممنون به موقع و گرم رسید خیلی هم خوشمزه بود
p5wjme,10,HAPPY,9068109,غذاهای شیلا فوق العاده عالی 
p5wjme,10,HAPPY,9016430,خیلی خوب بود
p5wjme,10,HAPPY,4181822,خوشمزه بود 
p5wjme,8,HAPPY,222903,خوب بود ممنون
p5wjme,10,HAPPY,6496936,از هر نظر عالیو خوشمزه 
p5wjme,10,HAPPY,411580,عالی و سریع 
p5wjme,10,HAPPY,154328,مثل همیشه عالی 
p5wjme,10,HAPPY,1816314,شيلا هميشه بهترينه و همه دوسش داريم
p5wjme,10,HAPPY,2705278,تحویل به موقع و غذاخوشمزه،تنها ایرادش زیاد بودن خمیر خالی دورش هست.
p5wjme,10,HAPPY,5615587,برگر عالیییی بود سیب زمی‌هم مثل همیشه عالی 
p5wjme,10,HAPPY,5237825,بي نظير عالي مگه هست بهتر از اين رستوران
p5wjme,10,HAPPY,4673658,"خوب و عالى 
ممنون"
p5wjme,10,HAPPY,9907799,انصافا عالی بود
p5wjme,10,HAPPY,4138296,مثل همیشه با کیفیت و سریع.سپاس
p5wjme,10,HAPPY,5916477,بسیار خوشمزه و به موقع
p5wjme,10,HAPPY,8655807,قارچ برگر فوق العاده خوش مزه و پر ملات بود واقعا خسته نباشید 
p5wjme,10,HAPPY,1343119,عالی عالی عالی
p5wjme,0,HAPPY,5786514,مثل همیشه عالی..
p5wjme,10,HAPPY,9941469,مثل هميشه عالي
p5wjme,10,HAPPY,3986311,مثل همیشه عالی و خوشمزه 
p5wjme,10,HAPPY,4384485,عالی بود ممنونم 
p5wjme,10,HAPPY,2609083,سریع و خوشمزه بوستمان رسید احسنت
p5wjme,10,HAPPY,1933924,با کیفیت و بموقع ، طبق معمول 
p5wjme,10,HAPPY,6154944,مثل هميشه عااالي
p5wjme,2,SAD,1434975,بسیار سرد و یخ زده
p5wjme,10,HAPPY,10776442,عالی
p5wjme,10,HAPPY,258466,کیفیت خوب و عالی
p5wjme,10,HAPPY,704242,عالی
p5wjme,10,HAPPY,2748601,"بسیار از اینکه بعد از تحویل سفارش تماس میگیرند و جویای نظر مشتری هستند متشکرم
کمتر رستورانی به نظر مشتری اهمیت میده
طعم غذا هم عالی بود موفق باشید"
p5wjme,10,HAPPY,3868283,لطفا سس قرمز بیشتر بزارید و چنگال لااقل ۲ تا
p5wjme,10,HAPPY,8569049,ممنون عالی بود
p5wjme,8,HAPPY,3949493,سالاد گاردن قبلا خیلی بهتر بود .فقط کاهو تکه‌های بزرگ در شاخه روکولا
p5wjme,10,HAPPY,1359033,عالی بود، مرسی
p5wjme,10,HAPPY,5251145,ساندویچ دونر و سیب زمینی عالی بود و کلی لذت بردم چیکن استریپس تند بود و باب میل من نبود 
p5wjme,10,HAPPY,3849267,مثل هميشه عااالي 
p5wjme,10,HAPPY,4111805,"استرامبولی مرغ و اسفناج یکی از خوشمزه‌ترین ترکیب‌هاست و واقعا خوشمزه‌است 
فقط یه پیشنهادی دارم اینه که معمولا یه کمی طعم شوری داره که اگز نمکش هم کم بشه فوق‌العاده میشه "
p5wjme,4,SAD,492729,کیفیت خیلی پایین.مرغ و کاهو قدیمی بود و اینکه حجم خیلی کم و سالاد گوجه نداشت.مگه میشه سالاد بدون گوجه فرنگی!!!
p5wjme,10,HAPPY,3675926,مرسی خوشمزه بود
p5wjme,10,HAPPY,8752493,سبك و خوشمزه بود ، 
p5wjme,10,HAPPY,3074108,برای بار اول که امتحان کردم خیلی خیلی خیلی سریع و گرم به دستم رسید واقعا بهتری غذایی بود که تو این چند وقت خوردم و بیش از حد انتظارم خوب بود 
p5wjme,8,HAPPY,629860,"دفعه اول بود خرید میکردم
فقط حجم سس قرمز کم بود 
بسته بندی خوب بود 
عذا هم گرم بود 
کیفیت غذا هم خوب بود "
p5wjme,10,HAPPY,3957264,خيلي خوب و خوشمزه 
p5wjme,8,HAPPY,3705506,مرغ سوخاری طعمش مثل دفعه های قبل نبود
p5wjme,8,HAPPY,6288190,سس قارچی که‌ در منو ذکر کردید اصلا داخل ساندویچ  نبود 
p5wjme,8,HAPPY,204664,استرامبولی مرغو اسفناج خیلی معمولی رو ب ضعیف.جا داره مرغ حداقل مزه دار بشود.دوستش نداشتم. استیکشون همیشه خوبه.ولی امشب به نسبت قبل ملات گوشت بیشتر جاشو به قارچ داده بود
p5wjme,10,HAPPY,3611280,عالی
p5wjme,8,HAPPY,7784858,نان تازه و سس خیلی خوشمزه ای داشت
p5wjme,4,SAD,6028099,نسبت به قیمت حجم کم و کیفیت پایین
p5wjme,10,HAPPY,8221840,من اولین بار‌ بود که از پیتزا شیلا غذا گرفتم، استرامبولی استیک با پنیر. هم کیفیتش خوب بود،هم خوشمزه بود، هم داغ و سریع رسید، . پیشنهاد می کنم حتما امتحان کنین
p5wjme,8,HAPPY,1276327,طعم غذا خوب بود ولی نان تقریبا بیات بود و قیمت برای این  هات داگ بالا بود 
p5wjme,10,HAPPY,11895011,کیفیت غذا عالی بود.سرعت عمل بالا و بسته بندی عالیممنون از شیلا
