restaurant_code,rating,feeling,commentText,customerId
p5d5v0,10,HAPPY,بسیار عالی و خوش طعم,7756425
p5d5v0,10,HAPPY,پیتزا خوشمزه بوده ، اما از سس سالاد راضی نبودم میتونست بهتر باشه ، سیب زمینی ها هم خوشمزه بودن . غذا گرم خیلی زودتر از اون چیزی که فکرشو میکردم ب دستم رسیده,7647044
p5d5v0,2,SAD,نصف خمیر بود,9161349
p5d5v0,8,HAPPY,کیفیت غذاها خوب بود ولی میتونه بهتر هم باشه، غذاها سریع دستم رسید و ممنون از پیک که محترم و مودب بودند,7286479
p5d5v0,10,HAPPY,بسیار عالی ,7145611
p5d5v0,10,HAPPY,"برای بار هزارم پیتزای مرغ و اسفناج عالی بود.
مرغ هم برای تست بد نبود ولی طرفدارش نمیشم.",1146647
p5d5v0,10,HAPPY,تشکر ویژه از تیم زحمت کش شیلا شعبه میدان ولیعصر.      غذا بسیار با کیفیت خوش پخت و لذیذ بود.  ,6698958
p5d5v0,10,HAPPY,عالی بود ,4923300
p5d5v0,10,HAPPY,"بسیار خوش طعم 
ارسال سریع
بسته‌بندی بهداشتی",4486908
p5d5v0,10,HAPPY,"مثل هميشه عالى و به موقع
ممنون از اسنپ فود و ممنون بابت يادداشت قشنگى كه شيلا روى قبض نوشته بود  :)",6365519
p5d5v0,10,HAPPY,با اینکه مزه پیتزا خیلی پپرونی همیشگی نبود ولی خوشمزه بود و خیلی داغ و به موقع رسید. ممنونم ، کاملا راضی ام,1182521
p5d5v0,10,HAPPY,مثل همیشه خوب بود تشکر,3998757
p5d5v0,10,HAPPY,کیفیت عالی,7318332
p5d5v0,10,HAPPY,مثل همیشه با کیفیت و لذیذ بود. ,5306445
p5d5v0,4,SAD,هیچکدوم خوش‌مزه نبودن,9571996
p5d5v0,10,HAPPY,عالی عالی,8955891
p5d5v0,10,HAPPY,مگه از پتزاهای شیلا بهتر هم هست تو تهران,1197185
p5d5v0,10,HAPPY,بسیار خوشمزه و عالی.ممنونم از رستوران شیلا,3328804
p5d5v0,10,HAPPY,عالی,6081560
p5d5v0,10,HAPPY,"کیفیتش عالی بود عالی
خیلی خوشمزه بود و روغنش هم کم بود عالی مرسی",9451955
p5d5v0,8,HAPPY,مثل شعبات دیگه نبود،به نظرم شعبات دیگه که قبلا امتحان شده بود کیفیت بهتری داشت,8092909
p5d5v0,0,HAPPY,عالی بود,1045881
p5d5v0,2,SAD,واقعا بد بود,12059551
p5d5v0,10,HAPPY,شیلا همیشه خوب و عالیه همه غذاهاش مرسی که هستی,1124181
p5d5v0,8,HAPPY,کیفیت غذا مثل همیشه عالی بود ولی به جای استرامبولی مرغ و بادمجون، مرغ و اسفناج بود,1113449
p5d5v0,8,HAPPY,همبرگر تازه و‌ خوشمزه بود.,7169257
p5d5v0,8,HAPPY,"هات‌داگ خیلی عالی، برگر بد نبود ولی مزه‌ی گوشت نمیداد خیلی!
ساندویچ گریل چیکن خوشمزه بود، مرغ می‌تونست بیشتر طعم‌دار بشه. 
اگه بشه توی ساندویچ گریل چیکن اضافه کردن پنیر یه آپشن اختیاری باشه خیلی خوب میشه! شاید کسی گریل چیکن بدون پنیر بخواد!",653802
p5d5v0,10,HAPPY,خیلی عالی و تازه بود من راضی بودم واقعا ,4698114
p5d5v0,10,HAPPY,"همیشه خوب و به‌موقع و‌خوشمزه
ممنون شیلا جون",200132
p5d5v0,10,HAPPY,خیلی زود و تازه بود ,983967
p5d5v0,2,SAD,غذای بسیار یخ بود جوری که پنیرش آب نشده بود و تعجب من از شیلا هست که همیشه کیفت و غذا خوبی رو ارائه میده ایندفعه چرا اینجوری بود متوجه نیستم، خلاصه خیلی غذا سرد بود ,2907367
p5d5v0,10,HAPPY,عالی و بی نظیر از کیفیت غذا تا رفتار مودبانه پیک ,6623660
p5d5v0,10,HAPPY,دونر عالی و خوشمزه,2128777
p5d5v0,2,SAD,هات داگ خیلی شور بود،غیر قابل خوردن.مرغ داخل سالاد سزار شور،سس شور.خواهشن اینقدر نمک نزنید.,1151413
p5d5v0,10,HAPPY,خوشمزه و جذاب,228253
p5d5v0,10,HAPPY,غذا فوق العاده با کیفیت و گرم به دستم رسید،پیشنهاد میکنم حتما یک بار امتحان کنید,8321349
p5d5v0,10,HAPPY,عالی بود مثل همیشه,7939565
p5d5v0,10,HAPPY,"خیلی خوشمزه
خیلی سریع
عالی",3234562
p5d5v0,10,HAPPY,سلام...بی نظیر بود..خیلی عالی...مدت زمان تحویل هم کم بود...ممنونم,5874396
p5d5v0,6,HAPPY,نسبت به سالاد های سزار با قیمت و کیفیت مشابه حجم کمتری دارد,4156261
p5d5v0,10,HAPPY,به نظرم عالی بووووود. سفارش همیشگیم شد پیتزا فیلع مرغتون,1753150
p5d5v0,10,HAPPY,ممنون از غذاتون وهمچنین پیک محترمتون ,7145611
p5d5v0,10,HAPPY,هر دو‌پیتزا بسیار لذیذ بودند,953118
p5d5v0,10,HAPPY,عالی بود طعم غذا و به موقع ارسال شد ,2049060
p5d5v0,10,HAPPY,بسیار تازه و داغ و زود به دستم رسیده ممنونم از شیلا شعبه میدان,983967
p5d5v0,10,HAPPY,مرسی. هات داگاتون همشون خوش مزست واقعا ,7145611
p5d5v0,10,HAPPY,"پیتزا خوشمزه و کلا طعم متفاوت با جاهای دیگه اما کم حجم. 
نان سیر تعریفی نداشت.
گرم بدستمون رسید.",2689723
p5d5v0,10,HAPPY,کیفیت غذا خوب بود. غذا گرم بود. ,5391444
p5d5v0,10,HAPPY,بسیار عالی، کیفیت فوق‌العاده بود,291613
p5d5v0,10,HAPPY,عالی بود مخصوصا سس روش ,2530997
p5d5v0,10,HAPPY,"اولین سفارش و یه تجربه خوب برای دونفرمون بود
نون خیلی با کیفیت و خوب تنوری شده بود
مواد تشکیل دهنده و ترکیبات پیتزا و طعمشون خیلی بود
و خوب تنوری شده بود
",1074651
p5d5v0,0,HAPPY,عالییی ممنون,1446993
p5d5v0,6,HAPPY,کیفیت غذا قابل قبول بود، ولی متاسفانه هنگام تحویل غذا سرد و تقریبا هیچ حرارتی نداشت.,8810793
p5d5v0,10,HAPPY,خیلی خوب بود.,5913042
p5d5v0,6,HAPPY,قابل قبول بود. اما با توجه به انتظار من از شیلا که همیشه غذاهاش طعم و کیفیت ویژه ای دارن به نظرم خیلی معمولی بود. مواد اولیه ی خیلی متوسطی استفاده شده بود و واقعا از شیلا انتظار بالاتری داشتم. در کل خیلی ممنون از تیم خوبتون:) ,289139
p5d5v0,6,HAPPY,کم حجم بود عزیزم ، پنجاه تومن میدونی چقدر زیاده؟ من با این سیر نشدم. بالاخره وقتی پنجاه تومن هزینه میشه آدم باید سیر بشه. دوست دارم,7766748
p5d5v0,8,HAPPY,با سلام و خسته نباشید. کیفیت بسیار خوب، قیمتها اما به نسبت کمیت بسیار بالا. با وجود علاقه ی زیاد و نوستالژی خاصی که به شیلا دارم نمیتوانم یک حقیقت را ناگفته بگذارم: جدای از حاشیه سود نسبتا بالای غذاها، با وجود اینکه دریافت مالیات ارزش افزوده از مشتری طبق قانون امکان پذیر هست، اما باید اعتراف کنم که با توجه به اینکه اکثریت رستورانها مالیات رو از مشتری نمیگیرند، این مسئله هم باعث میشود شاید از هر ۷-۸ باری که قصد خرید از شیلا را دارم تنها یک بار خرید خود را نهایی کنم. این مسئله را صرفا جهت اطلاع رسانی به مدیریت محترم شیلا عرض کردم و از این نکته که در انتها هر فرد بسته به قیمتهای نسبی نسبت به انتخاب رستوران مورد سفارش خود اقدام میکند نیز آگاهم. ,1045890
p5d5v0,10,HAPPY,چرا چیکن استریپس سالاد کلم نداشت؟؟؟,1272565
p5d5v0,10,HAPPY,سالاد سزار خيييييلى كم مرغ داشت. ولى استرامبولى عالى بود . سيب زمينيهاش تازه نبودن. ,1481767
p5d5v0,2,SAD,حجم غذا کم بود و مزه خمیر میداد,4422516
p5d5v0,10,HAPPY,خوب بود با کمی تلاش عالی هم می‌شوید,7411701
p5d5v0,10,HAPPY,عالی بود به موقع رسید,7145611
p5d5v0,10,HAPPY,عالی,7273314
p5d5v0,10,HAPPY,عالی بود عالی,4251254
p5d5v0,10,HAPPY,خوشمزه و با کیفیت بود,1726963
p5d5v0,8,HAPPY,مثل همیشه عالی,9855231
p5d5v0,8,HAPPY,ممنون خوب بود,8654038
p5d5v0,10,HAPPY,عالی,983967
p5d5v0,10,HAPPY,"همه چیز عالی و فوق العاده.
شیلای میدان ولیعصر چند ماهی میشه که بسیار بسیار با کیفیت شده. هرگز تجربه بدی تو ۳ ماه گذشته از این فست فود نداشتم. خسته نباشید به تمام پرسنل شیلای ولیعصر",212773
p5d5v0,10,HAPPY,مثل همیشه عالی ، ولی یه تشکر ویژه برای اونی که مینویسه نوش جان ، یه جوری مینویسه نوش جان که انرژی مثبت میده مخصوصا طرح لبخند مینویسه ,11768057
p5d5v0,10,HAPPY,"غذای عالی
و از پیک خوبتون هم تشکر میکنم که خیلی خوب و سالم و سریع غذا رو آورد.",1807186
p5d5v0,6,HAPPY,خیلی معمولی بود,6572950
p5d5v0,10,HAPPY,خیلی زود و گرم به دستم رسید ,983967
p5d5v0,10,HAPPY,قبلا گوشت چرخ کرده توش بود گمونم. الان فقط سوسیس و ژامبونه,4792007
p5d5v0,6,HAPPY,"بد نبود
ولی فکر میکنم کیفیت مواد استفاده شده نسبت به قبل یکم افت داشته",8810793
p5d5v0,8,HAPPY,از مشتری های ثابت شما بوده ام اینبار چیکن کیفیت عالی قبلیا را نداشت سرعت ارسال هم مثه همیشه عالی,7548611
p5d5v0,10,HAPPY,عالی بود,320068
p5d5v0,10,HAPPY," کیفیت عالی. تمیز و سریع و خوشمزه.
حتی خود رستوران از کیفیت غذا مستقیم از مشتری نظر میگیره.
خیلی کار خاصی نیست ولی به مشتری احترام میزاره و سفارش رو دقیق تحویل میده.
یه تشکر ویژه از شیلا ",2121970
p5d5v0,10,HAPPY,"غذا عالی.
رفتار و سرعت تحویل پیک هم عالی.",3977942
p5d5v0,10,HAPPY,غذاها عالی و خوشمزه و سروقت به دست ما رسید,9148829
p5d5v0,10,HAPPY,"طعم تازگی اسفناج عالی بود
خیلی هم زودتر از تایم مقرر رسید",3435967
p5d5v0,10,HAPPY,پیتزا استیک فوق العاده است,3797653
p5d5v0,10,HAPPY,شک نکن عالیههههه,6089690
p5d5v0,8,HAPPY,خیلی خوشمزه بود خیلی ممنون. و دقیقا مثل عکسش بود سیب زمینی هم زیاد داشت. ولی واسه دو نفر به نظرم کافی بود. میشد نصف همینو برای یک نفر با نصف قیمت بزنید. اونجوری عالی تره. ,5989801
p5d5v0,10,HAPPY,"سزار خوب
نون سیر عاالی",4603591
p5d5v0,10,HAPPY,بسيار عالي بود,2770429
p5d5v0,8,HAPPY,خوب بود,9004770
p5d5v0,10,HAPPY,مثل هميشه عالي بود و زودتر به دستم رسيد,5633135
p5d5v0,0,SAD,سوسیس‌ها بسیار چرب بودند و روغن زیادی ته بسته‌بندی جمع شده بود,156364
p5d5v0,10,HAPPY,کارتون درسته عالی مثل همیشه.,346078
p5d5v0,10,HAPPY,ممنونم ازتون همیشه زحمتتون میدیدم واقعا تشکر میکنم از پرسنل و مدیریت زحمتکشتون  سپاس فراوان ,7145611
p5d5v0,10,HAPPY,عالی,3058157
p5d5v0,10,HAPPY,"عالی بود
خوب نه ها،عالی بود
بسیار خوشمزه بود
",3031644
p5d5v0,8,HAPPY,"خوب بود 
طعم پیتزاهای قدیمی رو میداد فقط وسطش یکم خمیر شده بود و از هم وا رفته بود ",4173217
p5d5v0,10,HAPPY,عالي مثل هميشه,4931028
p5d5v0,10,HAPPY,فوق العاده,4856893
p5d5v0,0,HAPPY,"پیتزا کوئین شیلا واقعا خوشمزه و خاصه
یه مقدار گرونه ولی چیزیه که از خوردنش پشیمون نمیشید
هرچند که هیچوقت با اون سیب زمینی سرخ کرده های وسط پیتزا ارتباط برقرار نکردم :)))))
",4018844
p5d5v0,4,SAD,"سيب زميني عالي بود خيلي خوشم اومد 
اما پيتزاش مثل هميشه نبود خيلي كم حجم شده بود 
و اينكه خيلي زود به دستم رسيد ممنون",5743271
p5d5v0,10,HAPPY,مرسی عالی بود همه چیز ,6617396
p5d5v0,10,HAPPY,مث همیشه عالی ,3871699
p5d5v0,10,HAPPY,خیلی خوب بود,2128777
p5d5v0,2,SAD,من سه بار این غذا را خریدم واقعا کیفیت مناسبی داشت ولی این سری نصف شده بود حجمش و سرد و بی کیفیت بود,2671942
p5d5v0,10,HAPPY,خوشمزه خوشمزه,8008939
p5d5v0,10,HAPPY,مثل همیشه عالی و به موقع,9401922
p5d5v0,10,HAPPY,ممنونم مثل همیشه علی بود,4712659
p5d5v0,10,HAPPY,عاااااالی مثل همیشه,6280122
p5d5v0,10,HAPPY,عالی,7505458
p5d5v0,10,HAPPY,ممنون عالی بود,9053276
p5d5v0,10,HAPPY,واقعا عالی بود هم گرم هم به موقع امد,9401922
p5d5v0,10,HAPPY,عالی ,11500996
p5d5v0,10,HAPPY,واقعا عالي,3732302
p5d5v0,0,HAPPY,عااالی,6058930
p5d5v0,10,HAPPY,مثل همیشه خوب و عالی و خاص,8008939
p5d5v0,10,HAPPY,خیلی عالی بووووود,5245950
p5d5v0,10,HAPPY,عالی,11828339
p5d5v0,10,HAPPY,خیلی خوب بود و گرم رسید ، حجمشم واقعا خوب بود,11195725
p5d5v0,10,HAPPY,مثل همیشه عالی و با کیفیت،سرموقع میرسه و همیشه غذا داغ هستش و رفتار پیک فوق العاده عالی هستش,6514497
p5d5v0,2,SAD,نوشابه سفارش داده بودم اما تحویل داده نشد ,6468168
p5d5v0,4,SAD,"غذاها بسیار بسیار چررررررب بود
از استرامبولی روغن چک چک میریخت
پیده گوشت و بادمجان خمیر بسیار کلفت و انقدر چرب بود که نتونستم بخورم.
در کل اصلا راضی نبودم.",3423430
p5d5v0,10,HAPPY,عالي بود ممنون خيلي زود اومد و عالي,5245950
p5d5v0,10,HAPPY,خوشمزه و سالم ,7263978
p5d5v0,10,HAPPY,با کیفیت بود عالی و خوشمزه  اما نسبت به قیمت کم بود البته همه چیز گرون شده.,5347836
p5d5v0,10,HAPPY,عالی بود ,8143115
p5d5v0,10,HAPPY,غذا سر موقع و گرم رسيد و خوشمزه بود,222615
p5d5v0,10,HAPPY,ممنونم,10116068
p5d5v0,8,HAPPY,استرامبولی مرغ و بادمجانش خوشمزه بود,1649096
p5d5v0,10,HAPPY,"سلام وقتتون بخیر 
بسیار عالی و خوشمزه 
هم چنین پیک بسیار محترم بودن و زحمت کشیدن ۴ طبقه آوردن بالا تحویل دادند 
تشکر",3964249
p5d5v0,10,HAPPY,غذا خوشمزه و. با کیفیت و عالی با سپاس,7086857
p5d5v0,10,HAPPY,"همه چی عالی .
امیدوارم همیشه کیفیت برتر سرلوحه کارتون باشه",7049595
p5d5v0,10,HAPPY,عالی بود ,1108289
p5d5v0,10,HAPPY,من اشتباها تاخیر رو زدم اما غذا کاملا ب موقع رسید غذاهم ک عالی بود مخصوصا استرامبولی غذا خیلی زیاد بود برای یک نفر ممنون از تیم شیلا,1176023
p5d5v0,10,HAPPY,مثل همیشه عالی,213088
p5d5v0,10,HAPPY,نونه پیتزاش عجیب خوش مزس واقعا غذاهاتون عالیه قیمتاتونم خوبه مخصوصا سالاد سزارش واقعا محشر بود اسرامبولیم حرف نداشت رو دست این غذا من ندیدم ,11295203
p5d5v0,8,HAPPY,سریع ارسال شد. مثل همیشه غذا کیفیت خیلی خوبی داشت اما به عنوان اولین تجربه این طعم زیاد باب میلم نبود.,1633070
p5d5v0,10,HAPPY,عالی بود..ممنونم,4012967
p5d5v0,10,HAPPY,کاملا مطابق تصویر هست پیتزا. نان و طعم فوق العاده خوب. سرعت ارسال غذا هم خوب بود و غذا داغ بدست من رسید. ضمنا پرسنل پاسخگوی تلفن و پیک بسیار مودب بودند.,417639
p5d5v0,10,HAPPY,غذا بسیار عالی بود و قبل از تایم تعیین شده. غذا رسید ممنون از سرویس عالی شما ,11736161
p5d5v0,10,HAPPY,چیز برگر گوشتش بسیار لذیذ بود و سس خیلی خوشمزه ای داشت,3950055
p5d5v0,10,HAPPY,دستتان دردنکند،من راضی بودم.,932909
p5d5v0,10,HAPPY,عالی,8739211
p5d5v0,10,HAPPY,عالی,10437998
p5d5v0,10,HAPPY,عال بود,6108597
p5d5v0,10,HAPPY,خیلی خیلی پیتزا اسفناج و مرغ خوشمزه بود . ممنون به خاطر بسته بندی خوب و تحویل سریع ,7430163
p5d5v0,10,HAPPY,پیتزا کوئین فوق العاده عالی بود،,6038224
p5d5v0,10,HAPPY,عالیییییی,1105665
p5d5v0,8,HAPPY,پیک بسیار سریع اومد و برخورد عالی بود ، پیتزا خوب بود ,5083782
p5d5v0,10,HAPPY,عالی,13200460
p5d5v0,10,HAPPY,مثل همیشه عالی خیلی زود رسید ممنونم ,9562460
p5d5v0,6,HAPPY,"سلام کیفیت غدا خوب بود مخصوصا پیامی که رستوران با خودکار روی فیش من نوشته بود خیلی به دلم نشست ولی اقای پیک غذا رو آوردند همینطوری رها کردند و رفتند تا غذا سرد شد
میخواستم بدونم من مشتری حق یه تک زنگ ۵ ثانیه ای رو ندارم؟؟؟ یا حداقل داخل snapp بهم میگفت که تحویل داده شده میرفتم بگیرم :(((",1301127
p5d5v0,10,HAPPY,عاللللی,11828339
p5d5v0,10,HAPPY,پیتزا مرغ و اسفناج سفارش داشتم خیلی عالی بود به موقع رسید خیلی تشکر میکنم از پیتزا شیلا,6179785
p5d5v0,10,HAPPY,واقعا خوشمزه بود و گرم بدستمون رسید و زمان رسیدن سفارشم کوتاه بود در کل عالی بود,8859987
p5d5v0,10,HAPPY, عالی بود درکنارشم خیلی زود بدستم رسید ممنونم,7548039
p5d5v0,10,HAPPY,عااااااااالی بود عاااااااالی ,4384136
p5d5v0,10,HAPPY,"غذا گرم و با کیفیت بود و زمانبندی تحویل هم بسیار عالی 
",1325957
p5d5v0,10,HAPPY,عالی,1950938
p5d5v0,0,HAPPY,عالی بود,165011
p5d5v0,10,HAPPY,خیلی تازه و لذیذ بود,1737571
p5d5v0,6,HAPPY,هات داگ چیز فرایزش نصف ظرف بود برخلاف همیشه,3294292
p5d5v0,10,HAPPY,همبرگر گرم و سریع رسید و مزه گوشت خوبی داشت خیلی لذت بردم ,5160741
p5d5v0,10,HAPPY,خیلی عالی بود,7791096
p5d5v0,4,SAD,"غذا کاملا سرد شده بود ، سیب زمینی ها مونده و خشک شده بودن 
کیفیت دونر استیک هم بد نبود ولی در کل راضی نبودم ",582540
p5d5v0,10,HAPPY,این غذا فوووووق العاده بود خیلی طعم لذیذی داشت و فکر کنم ازین به بعد جز سفارش همیشگیم میشه پیشنهاد میکنم حتما امتحانش کنید ,7250088
p5d5v0,10,HAPPY,"بسیار عالی
ممنون از سرویس دهی تون متشکرم ",7145611
p5d5v0,10,HAPPY,مثل همیشه عالیی ممنون,4638809
p5d5v0,6,HAPPY,سرد بودن غذا,510097
p5d5v0,10,HAPPY,خوشمزه بود,4088188
p5d5v0,10,HAPPY,عااالی ,4708489
p5d5v0,8,HAPPY,رفتار پیک خیلی بد و توهین آمیز بود.,2357733
p5d5v0,2,SAD,پیتزا بسیار چرب بود ,6583702
p5d5v0,2,SAD,نسبت به حجم غذا مبلغ بسیار بالا بود و اینکه غذا کاملا سرد شده بود ,5493739
p5d5v0,6,HAPPY,اصلا مزه پپرونی نمیداد,1191347
p5d5v0,10,HAPPY,کیفیت غذا مثل همیشه عااالی بود فقط چقدر مقدار سیب زمینی ها کم بود,5079498
p5d5v0,6,HAPPY,ممنون از غذا ولی سرد بود,6738349
p5d5v0,4,SAD,"سیب زمینی ها سرد و مونده بود 
مواد روش هم خیلی کم بود ",5350681
p5d5v0,10,HAPPY,بسیار خوشمزه بود ، ممنون از شیلا ,1842990
p5d5v0,10,HAPPY,عالییی مثل همیشه با کیفیت و خوشمزه,3443845
p5d5v0,10,HAPPY,خیلی خوش مزه بود زودتر از زمان بندی به دستمون رسید و گرم بود ممنون,1343691
p5d5v0,2,SAD,کیفیت و مزه بسیار پایین و غیرقابل تحمل بود ،واقعا نظر من رو برای همیشه تغییر داد نسبت به سالاد سزار ، افتضاح بود . متاسفم واقعا اولین و آخرین خرید من بود,9129973
p5d5v0,10,HAPPY,عالی گرم و خوش مزه برخورد اسنپ فوق العاده بود فرش ماشروم و کراکف مثل همیشه عالی کوئین یه مقدار کیفیتش پایین بود ولی بازم عالی بود,8865009
p5d5v0,10,HAPPY,پیتزا عالی و سالاد بدمزه و مونده ,4949149
p5d5v0,8,HAPPY,همه چیز عالی فقط حجم ساندویچ نسبت به قیمت کم هستش,538448
p5d5v0,8,HAPPY,حوب بود,7567756
p5d5v0,10,HAPPY,بسیار عالی، خیلی سریع و تازه بدستم رسید، رفتار پیک هم بسیار عالی بود. ,3024548
p5d5v0,8,HAPPY,کیفیت غذا خوب بود به موقع هم رسید ، برخورد پیک هم بسیار محترم ,3461855
p5d5v0,0,HAPPY,پیتزا کویین عاااااااااااااالی بود واقعا ,769668
p5d5v0,10,HAPPY,مثل همیشه عالی,3294472
p5d5v0,10,HAPPY,غذا گرم و خیلی زود بدستم رسید ممنون از عوامل,7350806
p5d5v0,10,HAPPY,عالی بود,6118646
p5d5v0,8,HAPPY,غذا گرم نبود,8344637
p5d5v0,8,HAPPY,خوب,7173233
p5d5v0,10,HAPPY,غذا گرم و عالی بود ممنون,11736161
p5d5v0,4,SAD,سرد بود.,7013966
p5d5v0,10,HAPPY,خیلی خوب و خوشمزه بود من به عکسش دقت نکرده بودم که سیب زمینی هم داره وقتی باز کردم سیب زمینی هارو دیدم کلی ذوق کردم ممنون,11785113
p5d5v0,10,HAPPY,"مثل همیشه خوشمزه و عالی بود.
داغ داغ رسید دستمون 
ممنون از مدیریت محترم رستوران شیلا و اسنپ 
انشاءالله این کیفیت ماندگار باشه",2281091
p5d5v0,10,HAPPY,خوب بود,9975297
p5d5v0,10,HAPPY,همیشه خوبه,5575306
p5d5v0,0,,غذا کم و بسیار بی کیفیت بود,150280
p5d5v0,0,HAPPY,"غذا گرم خوب بود و هم به موقع رسید ، ممنون
",2517913
p5d5v0,0,HAPPY,انتقاد من به مسیجی هست که از زودفود برای من ارسال شد. شما برای من مسیج زدید که «بهمن عزیز، 900 تومان اختلاف قیمت سفارش شما از فست فود شیلا (میدان ولیعصر) توسط زودفود پرداخت شد.» من هم عرض می کنم خدمت تون که «زودفود عزیز، اگر سیستم شما مشکلی داره که هزینه ارسال رو اشتباه حساب می کنه، مسلما هزینه این مشکل بر عهده شماست تا زمانی که مشکل رو رفع کنید. پس این درست نیست که با چنین مسیجی به نوعی منت بر مشتری بگذارید که من اشتباه کردم» همین. ممنون,212554
p5d5v0,4,SAD,من يبار با خود فست فود شيلا تماس گرفتم و بهم گفتن اين وظيفه ى پيكه كه غذا رو تا طبقه پنجم بياره و تحويل بده. منتها برخورد پيك در اين زمينه بسيار نامناسب و بى ادبانه بود. كيفيت هات داگ هم مث هميشه نبود و نونش تيكه تيكه شده بود. به اميد بهبود,311616
p5d5v0,0,HAPPY,"رستوران شیلا همیشه غذاهای بسیار خوشمزه و لذیذ با بسته بندی مناسب داره و من همیشه تحسین اشون میکنم. سفارش من هم عالی و خوشمزه بود.
با تشکر",225773
p5d5v0,0,SAD,با مالیات ۴۰ هزار تومان پول یک پیتزای ایتالیایی دادم به جاش یه مینی پیتزای پر روغن و کوچیک که خمیرش پودره تحویل گرفتم بدترین  پیتزای عمرم بود,231572
p5d5v0,0,NOTHING,کیفیت کالباس معمولی بود و مخلفات هم همراه با غذا تنوری و پخته شده بود.,310924
