restaurant_code,rating,feeling,commentText,customerId
37jgem,10,HAPPY,سلام و ادب.  تمامی سفارشات بنده از کیفیت خوبی برخوردار بود. سپاس از شما. ,2452823
37jgem,10,HAPPY,غذا بسیار خوب ولی پیتزا بوقلمون متوسط بود و پیک بسیار عالی و سریع اورد ,3726978
37jgem,10,HAPPY,ساندویچ رست بیف با نان سفید بود وپیتزا سرد بود وخشک ولی سوخاری خیلی خوب بود,4695677
37jgem,10,HAPPY,مثل همیشه عالی و خوشمزه ، داغ هم بود ، باگت عالیه ,8870702
37jgem,6,HAPPY,طعم غذا خوب بود ولي سرد سرد شده بود و انگار از يخچال سرو شده. نوشابه اشتباه ارسال شده بود و نودل افتضااااح بود ,6453539
37jgem,10,HAPPY,سلام روز بخیر.واقعا خوشمزه بودفقط کمی سرد بود,8234353
37jgem,8,HAPPY,"کیفیت غذا و مواد اولیه عالی. 
تحویل بد . سس ها ریخته بود",1340601
37jgem,8,HAPPY,با اينكه نزديكيم و غذا يك ربعِ رسيد ولى پيتزا سرد بود پنيرشم كم بود بيشتر سس گوجه بود. ولى در كل ميشه گفت خوش طعم بود. مرغ سوخارى هم خوب بود، ممنون.,7316211
37jgem,10,HAPPY,عااااالیه پیتزا مارگاریتا جدید، بهترین پیتزا تهران همینه، یه پیتزا اصیل و سنتی ایتالیایی,156739
37jgem,2,SAD,غذا سرد تحویل داده شده با کیفیت پایین. واقعا جای تاسفه با این قیمت این کیفیت تحویل داده میشه.,10219887
37jgem,6,HAPPY,غذا سرد واز دهن‌افتاده بود، پیاز توی پیتزاسبزیحات کلا ذائقه من نبود، پرملات بود ولی در نهایت سس قرمز هم اضافه کردم پیتزای شیرینی بود!,344605
37jgem,10,HAPPY,غذا مثل همیشه ، تازه و لذیذ بود اما بسیار زودتر از موعد تحویل گرفتم .,2362737
37jgem,10,HAPPY,مثل همیشه عالیییی,4332027
37jgem,10,HAPPY,غذا بسیار سریع تحویل داده شد و خیلی تمیز و بهداشتی و خوب بسته بندی و تحویل داده شد، پیتزا عالی بود، فقط سیب زمینی کم بود و یکم مانده بود، ساندویچ رست بیف هم خیلی خوب بود اگر بیشتر پخته شده و نرمتر بود به نطرم بهتر بود,6747678
37jgem,10,HAPPY,"از معدود رستوران هایی که همیشه به کیفیت اهمیت میده
موتزارلای پیتزا واقعا تازه بود
سس قارج تو بسته ی جدا ارسال شده بود که مانع از خمیر شدن سیب زمینی ها تا زمان سرو میشد. ممنون ",264042
37jgem,10,HAPPY,مثل همیشه بی نظیر,3477321
37jgem,10,HAPPY,عاشقتم‌‌ باگت جونم ؛  بهترینی ؛ قسم میخورم که بهترین ساندویچ ها رو داری ,3477321
37jgem,6,HAPPY,قارچ سوخاری شور بود پیتزا هم خمیرش یه جوری بود و یکم خیس بود از زیر مواد... و فلفل پیتزا زیاد بود و از همه مهم تر جفت غذاها سرد بودند این همه نظر گذاشتند مردم که غذا سرد به دستشون میرسه و شما کاری انجام نمیدهید در کل از کیفیت غذا ها راضی نبودم,903335
37jgem,10,HAPPY,مثل همیشه همه چیز عالی بود ,246249
37jgem,10,HAPPY,به توضیحات کاملا توجه کرده بودن و با این حال که به دلیل درخواست اضافه ای که داشتم ازشون خواسته بودم سس کچاپ و دستمال و سس چیلی مخصوص ساندویچ رو نفرستن محبت و مشتریمداری کردن و فرستادن، مثل همیشه عالی و نمونه بودی باگت دوست داشتنی! ,230377
37jgem,10,HAPPY,عالي، نان برشته و مواد ساندويچ مثل هميشه خوشمزه ممنونم,1125159
37jgem,10,HAPPY,همه چیز عالی بود فقط پیکی که غذا رو آورد یکم رفتار نامناسبی داشت ,941510
37jgem,4,SAD,پیتزا کاملا سرد بود و دیر رسید !!!,4901584
37jgem,10,HAPPY,عالی,279426
37jgem,2,SAD,خیلی سرد,570340
37jgem,8,HAPPY,غذا سرد به دستمون رسید,328663
37jgem,4,SAD,سرد بودن  غذا,3953311
37jgem,10,HAPPY,خوشمزه و تازه ,731949
37jgem,8,HAPPY,"اندازه پیتزا دو نفره هیجان انگیز بود
کیفیت پیتزا هم خوب بود",5324929
37jgem,10,HAPPY,خوشمزه بود اگه گرم میرسید حرف نداشت,519771
37jgem,10,HAPPY,خیلی عالی بود ممنون :)),5725525
37jgem,10,HAPPY,عالی بود. ممنونم از مجموعه باگت,5702968
37jgem,2,SAD,سرد بودن غذا,4245364
37jgem,8,HAPPY,عالی,6124201
37jgem,10,HAPPY,"غذا گرم و به موقع رسید
بال سرخ کرده خوشمزه بود و کمی تند
سس های متنوع داخل پک بود
مرغ ها مزه خوبی داشت و تازه بود
تنها ایرادی که میشد گرفت اندازه مرغ بود
که جاهای دیگه اندازه تیکه های مرغ بزرگ تری با همین قیمت ارائه میدن.",8697519
37jgem,10,HAPPY,عالی ، با تشکر .,3127704
37jgem,10,HAPPY,خیلی خوشمزه بود از اسنپ فود ممنونم از تحویل سریع و به موقع غذا ,5040798
37jgem,8,HAPPY,به موقع اومد و خوشمزه بود اما متاسفانه از رستوان تماس گرفتن گفتن نگهبان نمیذاره پیک‌بیاد داخل درصورتی که من شما ه پیک و گرفتم گفت من باید حاهای دیگه غذا ببرم وقت ندارم بیارم بالا اونم تازه میخواست با اسانسور بیاد تماس گرفتم رستوران گفتم خوده پیک نمیاد و خندیدن متاسفانه ! امیدوارم یه مقدار احترام به مشتری بذارید من پول پیک میدم رایگان که نمیارن,809511
37jgem,8,HAPPY,غذاها از لحاظ کیفیت بسیار خوب بودن، ولی مزه ساندویچ استیک از خوبی قابل توصیف نیست :),2384340
37jgem,10,HAPPY,عالی,3477321
37jgem,10,HAPPY,عالی,187761
37jgem,10,HAPPY,خوب بود ,1524329
37jgem,10,HAPPY,خوب بود,1362725
37jgem,10,HAPPY,باگت همیشه خوبه ,5998826
37jgem,10,HAPPY,عااااالی بود,156739
37jgem,10,HAPPY,واقعا عالی و خوشمزه بود.,159299
37jgem,10,HAPPY,درود بر کادر خوب باگت,3477321
37jgem,10,HAPPY,چی بگم اخه؟؟؟ نفسهههه، عالیه، همه چیش!!!!! لامصب کیفیت هیچ کدوم از ایتماشون جمممممم نمیخوره، مثل همیشه عالییییی,1480099
37jgem,2,SAD,پیتزا بوقلمون خشک و سرد بود. تکه‌های ریش ریش شده‌ی گوشت کاملا سفت و خشک و غیر قابل خوردن بودند. قبلا هم سفارش داده بودم و راضی بودم ولی این بار اصلا کیفیت نداشت. قارچ رو هم چون خیلی داغ بوده و گذاشتن تو ظرف، وقتی به دستمون رسید خمیر شده بود ولی مزه‌ی مناسبی داشت. امیدوارم این کیفیت پایین اتفاقی بوده باشه! بعید بود از این رستوران!,246249
37jgem,10,HAPPY,از همه نظر عالی... پیک هم فوق العاده مودب و تمیز,2327291
37jgem,10,HAPPY,عالی عالی,1787145
37jgem,10,HAPPY,بسیار عالی و تازه و خوشمزه بود ، کیفیت فوق العاده ، سریع آماده و حویل داده شد ، با رعایت کامل موارد بهداشتی از طرف پرسنل و پیک محترم ، با تشککککر .,3127704
37jgem,0,HAPPY,عالیی بود غذا داغه داغ رسید ,952421
37jgem,2,SAD,متاسفانه برعکس همیشه، بعد از حدود ۱:۴۰ و ۳ با پیگیری، غذا سرد و فیله ها هم اسپایسی نبود,7505170
37jgem,10,HAPPY,باگت جان دوستت داریم,3477321
37jgem,10,HAPPY,"بسته بندی کاملاً بهداشتی بود.
زمان ارسال هم خوب بود
و از طعم غذا هم راضی بودم
مرسی *_*",6060503
37jgem,10,HAPPY,دوست داشتم مرسی,322094
37jgem,10,HAPPY,مثل همیشه بی نظیری باگت جان,3477321
37jgem,2,SAD,مرغ سوخاری که آماده ترین غذا میتونه باشه بعد از دو ساعت و نیم دستم رسید تازه با کلی پیگیری و دعوا و اعصاب خوردی,502288
37jgem,10,HAPPY,سپاس ,3477321
37jgem,10,HAPPY,"عالی
خیلی خوشمزه، بسته بندی مناسب، برخورد خوب پیک و سس فوق العاده‌ای که کنار سفارش میذارن باعث میشه حتما پیشنهاد کنم این رستوران و این غذا رو به همه.",372303
37jgem,10,HAPPY,خیلی باحال و خوشمزه بودواقعا. ,3107572
37jgem,10,HAPPY,یکی از خوشمزه‌ترین پیتزاهای سبزیجات که خوردم، سالاد بالزامیک هم که عاشقشم سفارش همیشگیه :),2384340
37jgem,10,HAPPY,عالي بود,5559805
37jgem,10,HAPPY,قارچ برگر هاش عاليه مثل هميشه همه چيز خوبه,489785
37jgem,10,HAPPY,پیتزا  طعم  خوبی  نداشت خیلی  تازه  نبود در اثر  فشار مواد دیگه  شکل  خوبی نداشت,2978881
37jgem,0,HAPPY,"واقعا هر چی بگم کم گفتم. از تمیز بودن پک ارسالی
از برخورد خوب پیک و ماسک و دستکش ایشون
از کیفیت غذا
واقعا لذت بردم. عالییییی",458346
37jgem,10,HAPPY,سریع، گرم و بسیار لذیذ و با کیفیت ,5468314
37jgem,10,HAPPY,فوق العاده بود .,3127704
37jgem,8,HAPPY,"سس سیب زمینی رو جدا میذارید و حال نمیده
اما پیتزا عالیییی",1480099
37jgem,10,HAPPY,بار اول بود سفارش میدادم . خیلی خوشمزه بود . واقعا پسندیدم . ,396793
37jgem,10,HAPPY,باگت ، انتخاب اول و آخر من,3477321
37jgem,2,SAD,سالاد اصلا تازه به نظر نمی رسید ،سس سالاد طعم بدی داشت,5271175
37jgem,10,HAPPY,مثل همیشه عالی ,3477321
37jgem,10,HAPPY,در مجموع راضی بودم,1888578
37jgem,6,HAPPY,قیمت نسبت به کیفیت خیلی بالاست. اما بازم سیر و استیک باگت تنها چیزی هست که فعلا رتبه یکه!,3641060
37jgem,10,HAPPY,"با سلام
توجه به درخواست ، تازگی ، گرم بودن غذا و ارسال بسیار سریع .
در یک کلام بدون نقص و عالی 
سپاسگزارم",6170975
37jgem,10,HAPPY,مثل هميشه خوشمزه و تازه و سريع خيلي ازتون راضي هستم,489785
37jgem,10,HAPPY,همه چیز فوق العاده,3637285
37jgem,10,HAPPY,خوب بود ممنون ,8742686
37jgem,10,HAPPY,بی نظیر,3477321
37jgem,10,HAPPY,best of bests,3477321
37jgem,10,HAPPY,"قارچ مثل همیشه عالی
اما پیتزا به شدت خشک بود مثل نان خشک سفت که برای اولین اینطور شد. برخورد پیک عالی",3947612
37jgem,10,HAPPY,متاستفانه به ظرف سس قارچ فشار اومده بود و ریخته بود درش هم فرو رفته بود توی سس,230870
37jgem,8,HAPPY,کیفیت خوب بود ولی حیف که سرد بود,4322158
37jgem,10,HAPPY,عالی مثل همیشه,3947612
37jgem,4,SAD,"پیتزا سرد به دستم رسید
سیب زمینی مونده بود
مرغ روی سالادم بد رنگ و مونده بود کلا قابل خوردن نبود",4423388
37jgem,10,HAPPY,بسیار خوشمزه و عالی,3120604
37jgem,10,HAPPY,الهی همیشه در اوج بمانی باگت جان ؛ بهترینی ,3477321
37jgem,10,HAPPY,خدا قوت مدیریت محترم باگت ، خدا قوت پرسنل گرامی باگت ؛ بی شک بهترین ساندویچ های جهان متعلق به برند شماست,3477321
37jgem,10,HAPPY,بسیار عالی و خوشمزه بود مثل همیشه ، داغ هم بود ، باگت عالیه ,8870702
37jgem,10,HAPPY,باگت خیلی خوبه کلا ولی تجربه من از باگت این بوده که یه بار خوبه یه بار افتضاح نمیدونم چرا نمیتونن همیشه خوب باشن.. اینبار غذا عالی بود اما ۱ساعت تاخیر خیلیه... اما بازم ترجیح میدم غذا دیر بیاد  ولی با کیفیت باشه نه اینکه شانسی باشه,9426080
37jgem,10,HAPPY,خیلی خوش طعم بود و زود رسید,3247987
37jgem,10,HAPPY,بسیار خوب بود,809511
37jgem,10,HAPPY,مثل همیشه خوب و خوشمزه و عالی ,5017884
37jgem,10,HAPPY,خیلی زود و گرم به دستم رسید ؛  هر کسی یکبار ساندویچ چیکن تریاکی رو امتحان کنه مثل من عاشقش میشه ,3477321
37jgem,10,HAPPY,عالی عااالی,280894
37jgem,10,HAPPY,بسیار عالی و خوشمزه,691840
37jgem,4,SAD,"قارچ سوخاری ماسیده بود.
سس قارچ خیلی شل بود.
پیتزا سرد به دستمون رسید ",326075
37jgem,8,HAPPY,کیفیت خوب بود ,6537198
37jgem,4,SAD,پیتزا سیر و استیک کاملا سرد و بیات به دستم رسید و از دهن افتاده بود و اصلا خوشمزه نبود درصورتی ک من بهترین پیتزا سیر و استیک رو تو باگت خورده بودم و اصلا باگت برای من یعنی سیر و استیک اما برعکس پیتزا کمبو دیپ دیش بسیار عالی و خوشمزه بود و داغ به دستم رسید نمیدونم چرا دوتا پیتزا یکی باید داغ و یکی سرد باشه این نشون میده ک پیتزا سیر و استیک از قبل درست شده و بیات بوده ک با اینکه همزمان اومدن یخ کرده,1736506
37jgem,10,HAPPY,برگر عالی و گرم و بهداشتی,279426
37jgem,10,HAPPY,طعم و کیفیت عالی ؛ چقدر خوبه که در طول زمان ، کیفیت ، بهتر و بهتر شده ، از مک دونالد هم بهتری باگت جان ؛ امیدوارم روزی برسه که در تمام جهان ، شعبه داشته باشی,3477321
37jgem,10,HAPPY,چقدر پیتزا عاااالی بود، طعم اصیل و واقعی که دنبالش بودم بدون اضافاتی که طعم سنتی مارگاریتا رو تغییر بده. مرغ هم خیلی خوشمزه و طعم‌دار بود، امکانش هست که وقتی مرغ ۳ تیکه سفارش میدیم، هر ۳ تا رون باشه؟,156739
37jgem,10,HAPPY,عالي,8471488
37jgem,10,HAPPY,مثل هميشه عااااالي,3269461
37jgem,10,HAPPY,عالی بود,230377
37jgem,0,SAD,من از طرفداری باگت هستم ولی چند وقتیه که کیفیت خمیر پیتزا خوب نیست و ضخیم شده هم اینکه حس میکنم حجم مواد روی پیتزا داره کم میشه هر سری! امیدوارم زودتر اشکالات رفع کنن چون مزه غذاهاشون هنوز خوبه. تشکر,5645099
37jgem,10,HAPPY,عالی,7665519
37jgem,6,HAPPY,"سس ریخته بود داخل پلاستیک و دستمال ها رو غیر قابل استفاده کرده بود.
فکر نمیکردم انقدر زمان ببره آماده شدنش. منظور از سریعترین زمان چیه؟",1668716
37jgem,0,SAD,"از باگت واقعا انتظار نداشتم که همچین غذای بی کیفیتی بده دست مشتری
نونش که عین لاستیک بود
غذا سرد
پنیرشم ماسیده شده بود",1029210
37jgem,2,SAD,بد ترين پيتزايي بود ك تا الان خوردم. آخر هفته ها ٢ ساعت جلو تر سفارش بدين تا براتون پيتزاي سردو خشكتونو بفرستن. ,5261406
37jgem,2,SAD,خیلی گران بود و کیفیت بالا نبود ,4191050
37jgem,8,HAPPY,سیبزمینی سرد بود تقریبا... ولی غذا اوکی بود,12993909
37jgem,2,SAD,بال مرغ فوق العاده بی کیفیت بود و بوی بدی میداد، تنها چیزی که ازین رستوران گرفتم و کیفیت بدی نداشت پوره سیب زمینی بود. این آخرین باری خواهد بود که ازین رستوران چیزی سفارش میدم...,2970451
37jgem,10,HAPPY,عالی,2874298
37jgem,10,HAPPY,خوب بود,9949367
37jgem,10,HAPPY,عالی,8745467
37jgem,6,HAPPY,نان سرد بود,13373077
37jgem,6,HAPPY,غذای سرد بوده است,8724861
37jgem,8,HAPPY,"با این قیمت و آوازه رستوران باگت میتونست کیفیت پیتزا بهتر باشه.
من خوشم نیومد.",4289864
37jgem,10,HAPPY,خوشمزه، تازه و گرم بود. متشکرم,1352727
37jgem,10,HAPPY,عالى,4368697
37jgem,10,HAPPY,عالى,4368697
37jgem,10,HAPPY,طعم عالی و بسته بندی خوب,9215300
37jgem,10,HAPPY,سيب زميني كنار ساندويچم طعم باگت و نميداد ادويه سيرش و نزده بودين انگار اما كيفيت عالي,4548409
37jgem,10,HAPPY,خوشمزه بود فقط گرون,4514979
37jgem,10,HAPPY,همیشه عالی,10083769
37jgem,8,HAPPY,"فیله سوخاری عالی بود
اما پیتزا خوب نبود و اما ایرادات پیتزا:
۱_نان پیتزا خیلی سفت بود و سخت جدا و جویده میشد
۲_بشدت پیتزا چرب بود یعنی پر از روغن بود 
و در کل پیتزا معمولی رو به ضعیف بود",2283047
37jgem,10,HAPPY,عالی عالی عالی,9543080
37jgem,10,HAPPY,عالی بود مثل همیشه، سس مخصوصی که همراهمش خواسته بودیم و فرستادن و با رعایت همه نکات بهداشتی تحویل شد. فقط بهتره دستمال کاغذی  و قاشق چنگال یکبار مصرف در ایام کرونا نفرستین چون درجا دور انداخته میشه. ,3695535
37jgem,8,HAPPY,کیفیت غذا خوب بود ولی متاسفانه یکم سرد شده بود.,774134
37jgem,6,HAPPY,نانش ترد نبود ولی کیفیت مواد عالی بود نان رو باید ترد درست کنن,3968553
37jgem,10,HAPPY,خیلی سریعتر از زمانی که اسنپ اعلام کرد به دستم رسید و کیفیت غذا هم عالی بود.,9817637
37jgem,4,SAD,"غذا خیلی دیر رسید و سرد تحویل داده شد. 
کیفیت در مقایسه با چیزی که حضوری قبلا در رستوران خورده بودم افت پیدا کرده بود. ",8087952
37jgem,8,HAPPY,ایرادی ک نمیشه گرفت متاسفانه هزینه ها بالا رفته ، هم قیمت غذا هم ارسال هم مالیات ‌..,2451509
37jgem,10,HAPPY,غذا واقعا عالی بود فقط کاش دقت امور بیشتر بود,715854
37jgem,2,SAD,"خیلی دیر تحویل شد و همینطور کاملا سرد بود و از همه بدتر پنیر پیتزا هنوز خوب پخته نشده بود واقعا باگت دیگه کیفیت قبل رو نداره
",3870985
37jgem,2,SAD,افتضاح افتضاح، تاخیر زیاد بطوریکه بیشتر از یک ساعت طول کشید، و کلا پشیمونمون کرد، پیتزا کمبو نازکش سرد شده بود، سسهای سفیدش تو نایلون بیرون ریخته بود،  خلاصه حیف پولی که دادم،  پشموووووونننننممممم  ,5402008
37jgem,10,HAPPY,"خوشمزه و عالی بود 
سپاس",2070775
37jgem,0,HAPPY,"گزینۀ ""راضی بودم"" رو انتخاب کردم ولی پیتزا خیلی سرد به دستمون رسید با اینکه فاصله رستوران تا منزل ما حدود 6-7 دقیقه ـست. انقدری سرد بود که پنیر روی پیتزا بُریده بُریده و ماسیده بود. ",158435
37jgem,6,HAPPY,"طعمش مثل همیشه عالی نبود, تخلمه هم شده بود",248261
37jgem,10,HAPPY,عالی مثل همیشه،درخواست سس اضافه هم داشتم فرستادن,3934441
37jgem,4,SAD,"پیترا سرده سرده سرد به دستم رسید. طعمش هم اصلا باگتی نبود. 
سالاد خوب بود",12292296
37jgem,6,HAPPY,نان پیتزا یکم سفت بود و چاشنی خاصی نداشت,1398445
37jgem,2,SAD,ساندویچ فیله مرغ و قارچ سوخاری سفارش دادم،غذا خیلی دیر به دستم رسید،قارچ ها کاملا مونده بود دور انداختم،نون ساندویچ سوخته بود و کاهو ها هم مونده بودن،واقعا کیفیت غذا خیلی پایین هست,7710003
37jgem,10,HAPPY,"غذا عالی .سفارش ۳۰ دقیقه زودتر از زمان تقریبی رسید 
ممنون",1550499
37jgem,2,SAD,"علاوه بر تاخیر تحویل غذا فوق العاده سرد و بی مزه شده بود 
مدیریت محترم لطفا بجای اینکه فقط خواننده مطالب باشید سعی بر حل آنها نمایید .",6925364
37jgem,6,HAPPY,"با سلام
بر خلاف موارد گذشته متاسفانه سفارش دیر تحویل داده شد و اصطلاحا از دهان افتاده بود. کیفیت خود غذا مناسب بود. 
با احترام",197859
37jgem,10,HAPPY,سپاس - عالی,820440
37jgem,10,HAPPY,"همه چیز عالی 
کیفیت غذاها بسیار عالی 
پیک از همه لحاظ خوب ( رفتار + ماسک + دستکش ) ",8305914
37jgem,2,SAD,"۱- پیتزا سیر واستیک سفارش داده بودم پیتزا استیک برام اوردن
۲-من مشتری دائم وقدیمی باگت هستم،تا حالا پیتزا به این بی کیفیت از باگت نخورده بودم،روی خمیر پیتزا بجای سس مخصوص همیشگی انگار رب گوجه مالیده بودن،اصلا انتظارش نداشتم",8899033
37jgem,2,SAD,"بسیار بی کیفیت بود ، بوی غذا نامطبوع بود 
گوشت خیلی بد مزه دار شده بود واقعا احساس میکردم قیمه رو ریختن رو پیتزا حتی بوی لیموی عمانی هم می داد",154650
37jgem,8,HAPPY,پیتزا کج شده بود داخل جعبه از شکل اصلیش خارج شده بود,12030526
37jgem,10,HAPPY,باگت كلاً عاليه فقط سرد رسيد غذا,7832659
37jgem,4,SAD,متاسفانه غذا بسیار سرد بود و قابل خوردن نبود،سیب زمینی ها سرد بود و مثل لاستیک شده بود,6549705
37jgem,10,HAPPY,عالی بود ،کاملا مثل عکس,7390774
37jgem,10,HAPPY,"مثل همیشه عالی و بی نقص بود 
پیک دستکش و ماسک داشت 
غذا ۱۵ دقیقه زودتر از تایم انتظار به دستم رسید 
سپاس از شما ",8305914
37jgem,10,HAPPY,پیتزای پپرونی و پیتزای سبزیجات، هر دو عالی و خوشمزه بودن. سالاد کلم هم طعم دلپذیری داشت. بال سرخ کرده هم خوشمزه بود. کلا محصولات باگت باکیفیت هستند.,5656507
37jgem,10,HAPPY,"من یه فست فود خور حرفه ای هستم ، رست بیفش بینظیر بود ، نونش عالی برشته ، به به لذت بردم ،  سوخاریش عالی بود موادش عالی بود ، فقط سس تایلندی و سیرش خیلی بد مزه بود "" در کل غذاش تمیز و با کیفیت  به به ، حتما امتحان کنید "" دوستون دارم ",7330053
37jgem,2,SAD,مزخرفترین غذایی بود که تا تاحالا خوردم البته یه تیکه شو امتحان کردم بقیه شو ریخیتیم دور . بعد از ۲ ساعت یه پیتزا آوردن با نون جو بود فک میکنم که همچین چیزی رو ننوشته بود تو منو . نون به شدت سفت که نمیشد گاز زد. پیتزا بوقلمون بود که چند تیکه بوقلمون روش بود . واقعا بدترین بود,11349822
37jgem,2,SAD,بسیار کیفیت پایین قشنگ مشخص بود پس ماند غذای دیروز یا روز قبلتر بوی نامطبوع اصلا نشد بخوریم فقط سیب زمینیشو خوردیم ,4165451
37jgem,10,HAPPY,واقعا خوشمزه و متفاوت بود سریع تر از زمانی که گفته بودن هم رسید و گرمم بود ممنون,397014
37jgem,10,HAPPY,پیتزا سیر و استیک مثل همیشه عالی بود، سیب زمینی با سس قارچ هم خیلی خوشمزه بود، یه ظرف بزرگ سس قارچ داده بودن دمشون گرم ، تحویل خیلی سریع و داغ و آقای پیک هم خیلی مودب و محترم . دست همه پرسنل زحمتکش باگت درد نکنه.,4522051
