restaurant_code,rating,feeling,commentText,customerId
p5ddx0,2,SAD,غذا سرد. بی کیفیت. خمیر پیتزا خام. اسفناج سوخته و کاملا مغایر با غذایی که در سالن رستوران سرو میشه. اصلا راضی نبودم. فقط بالاجبار ۲ تیکه پیتزا خوردم و بقیه اش رو دور انداختم...,860721
p5ddx0,10,HAPPY,مثل همیشه عالی,7730656
p5ddx0,0,SAD,"سلام
20 سانت هم نبود - کیفیت هم درخور توجه نبود.",6266838
p5ddx0,10,HAPPY,فوق العاده,5821771
p5ddx0,4,SAD,پیتزا روکولا روی هر اسلایس فقط یک ساقه روکولا داشت و‌ در مقایسه و مغایرت حجم ماده اولیه این پیتزا نسبت به سفارش های قبلی، کمتر از همین ایتم بود ,2164423
p5ddx0,10,HAPPY,خمیر بسیار خوب و نازک ,813227
p5ddx0,10,HAPPY,عالى بود,10188463
p5ddx0,0,HAPPY,"درود بر شما
به امید سلامتی و حفظ کیفیت غذاتون.من خیلی وقته که مشتری تون هستم و شما رو به همه معرفی می کنم فقط تورو خدا کیفیتت کارتون پایین نیاد.
سپاسسسسسسسسسسسسسسسسسسسسسسسسسسس",3774433
p5ddx0,0,HAPPY,خوشمزه بود ولی اندازه پیتزا نسبت به قیمتش فاجعه باره,924155
p5ddx0,2,SAD,افتضاح!,794626
p5ddx0,8,HAPPY,ساندویچ عالی بود ولی سیب زمینی خیلی خشک و بی کیفیت بود همین حجم سیب زمینی در رستورانهای دیگه قیمتش پایینتره، وقتی ما قیمت بالاتری میپردازیم از رستوران هم انتظار بالاتری داریم,3752699
p5ddx0,2,SAD,کیفیت سالاد پایین بود، گردو اصلا نبود تو سالاد گردو با مرغ و ۸۵ درصد بیشتر کاهو بود ,1942224
p5ddx0,4,SAD,گابن پيتزا خام بود,1163757
p5ddx0,8,HAPPY,پیتزا بیکن و قارچ بوی چربی میداد دوست نداشتم,708720
p5ddx0,4,SAD,افتضاح بود خیلی خشک و مرغ های سفت,536588
p5ddx0,6,HAPPY,طعم لذیذ اما مقدار نامناسب پیتزا ها نهایت ۲۰-۱۹ سانتی بودند و مقدار سیب زمینی بسیار کم و بی کیفیت. در کل برای یک وعده قیمت و مقدار پیتزا هم خونی نداشتند,7306608
p5ddx0,10,HAPPY,خیلی خوشمزه مثل همیشه، غذا هم گرم به دستم رسید ,1338807
p5ddx0,2,SAD,پاستا آلفردو سفارش دادم.تاکید کردم پنیر اضافه داشته باشه ولی یه غدای آبکی بدون مزه  و بدون پنیر  که قارچهاشم برشته شده بودن تحویل من دادن,12616929
p5ddx0,8,HAPPY,سلام از انتخابم راضی بودم،متشکرم ، لذیذ وبا کیفیت بود .قیمتش کمتر باشه خیللللللی خوب میشه,11576025
p5ddx0,10,HAPPY,مزه عالی بود فقط دیر اومد خیلی,9897156
p5ddx0,2,SAD,لازانیا نرم و وا رفته بود.کیفیتش به شدت افتضاح بود.جوری که اصلا قابل خوردن نبود از بس که نرم و وا رفته بود,7182687
p5ddx0,2,SAD,چیزی به عنوان استیک وجود نداشت فقط چند برش باریک از گوشت که حتی ممکن است گوشت یخی باشد و به هیچ عنوان طعم گوشت تازه نداشت ترکیبی سس سفید با مقدار خیلی کم از پنیر داشت و با طعم تند فلفل کیفیت پایین گوشت پوشش داده شده بود بدترین ساندویچ استیک ممکن ,6490114
p5ddx0,4,SAD,سیب زمینی یخ بود و کهنه، برگر داخلش قرمز و نپخته بود و متاسفانه تیکه های سفتی مثل استخوان داخلش بود واقعا بد بود.,3414985
p5ddx0,2,SAD,هم گوشت پیتزا هم گوشت پاستا بسیار بد مزه و سفت بود!!!,764534
p5ddx0,10,HAPPY,حداقل ۵،۶ سال میشه مشتری جو هستیم، مثل همیشه عالی بود ,172960
p5ddx0,8,HAPPY,پیتزا با کیفیت و لذیذ بود اما سرد به دستم رسید,5782687
p5ddx0,6,HAPPY,"یکم نان سیر زیاد تست شده بود، سفت نبود نان سوخته بود‌.
به خاطر اینکه همه جو گریل عالی ست،انتظارم بیشتر بود.
از دوستان عزیز در جو گریل ممنونم.",7904073
p5ddx0,4,SAD,هر بار تحویل دیرتر انجام میشه ۱ ساعت شاید دیگه سفارش ندم ,3817966
p5ddx0,0,SAD,"پیتزا سردی بود.
بسته بندی کاملا بد بود.
نسبت به پیتزاهای هم قیمت هم کم بود -  هم مزه ضعیفی داشت.",913598
p5ddx0,10,HAPPY,کیفیت خوب آب انار طبیعی باتشکر تشکر هم از اسنپ فود.,5710347
p5ddx0,8,HAPPY,طعم و مزه عالی ولی اندازه پیتزا خیلی کوچیک بود ، حتی یکنفرم سیر نمیکنه این اندازه,6899637
p5ddx0,10,HAPPY,کیفیت پیتزا عالی بود تشکر از جو گریل فقط پیتزا ولرم شده بود که نا هماهنگی بین پیک و زمان آماده شدن نشان می دهد در کل تشکر ,10752552
p5ddx0,2,SAD,"پیتزا روکولای چهار پنیر، همون نون پنیر سبزی خودمون بود اونم فقط با یه نوع پنیر و یه خمیر خیلی خیلی نازک. پیتزای ایتالیایی خمیر انقدر نازک هم نداره حتی.  پیتزای کلاسیکو بدمزه بود واقعا.
حتی سیب زمینی سرخ کرده هم بیشتر شبیه خلال سیب‌زمینی‌های مزمز بود.
تنها چیزی که توی سفارشمون خوب بود سوپ روز بود.
برای این حجم از پایین بودن کیفیت چطور همچین قیمتایی می‌ذارین؟",1025781
p5ddx0,6,HAPPY,"سلام
تنها نمک پیتزاها زیاد بود",5020838
p5ddx0,2,SAD,سیر خیلی زیاد استفاده میشه و طعم غذا رو خراب میکنه,9569666
p5ddx0,8,HAPPY,طعمش خوب بود ولی خیلییییی کوچیک بود,5061583
p5ddx0,2,SAD,"من قبلا از جو گریل خرید کرده بودم خیلی خوب بود ولی اینبار افتضاح بود
نون سیر کاملا سوخته بود
کیفیت پیتزا هم اصلا خوب نبود",286275
p5ddx0,10,HAPPY,واقعا عالیه,3842016
p5ddx0,2,SAD,یه اسم فرنگی، رستوران بالاشهر، غذای مزخرف، قیمت بالا. شاید قدیما کیفیت داشته، امشب که تو ذوق زد,2935810
p5ddx0,2,SAD,بسیار کم حجم‌ بود,7432108
p5ddx0,10,HAPPY,گرين برگر خيلي سنگين و پر از پنير بود به سختي مي شد خورد اما برسكتا به نظر تازه مي امد و برگر اوريجينال خوشمزه بود ,11208117
p5ddx0,2,SAD,سيب زميني سرخ شده مونده بود و خيلي خشك، مابقيش خوب بود,3986183
p5ddx0,4,SAD,واقعا دیگه از جو چیزی نمیخرم,2198171
p5ddx0,2,SAD,عوض نان جوی خشمزه ی همراه سوپ نان سفید ارسال کردند...,1127511
p5ddx0,2,SAD,من دو تا پنه آلفردو سفارش دادم یک عدد اومده متاسفم واقعا,2182160
p5ddx0,0,HAPPY,کمی شور بود. سپاس.,6127489
p5ddx0,0,HAPPY,"من درخواست سس سیر و سس خردل داشتم.
واقعن ناراحت شدم که نذاشتین",750814
p5ddx0,10,HAPPY,به جای فیلی چیز، اشتباها پیتزا استیک تسورو ارسال شده بود,214263
p5ddx0,2,SAD,دو سیب زمینی سرخ شده ارشال نشده ,1803854
p5ddx0,6,HAPPY,"بنظرم پاستایی که قیمتش ۹۵ هزار تومنه، باید بیشتر از ۴ تا میگو داشته باشه. 
غذا هم با تاخیر و چپه شده و با روغن پس داده رسید. ",746286
p5ddx0,8,HAPPY,متاسفانه نونش تازه نبود,6180983
p5ddx0,2,SAD,بد مزه ترين ساندويچي بود كه خورده بودم. افتضاح بود.,6583105
p5ddx0,2,SAD,سلام كيفيت براي اولين بار امده پايين اگه بازم به اين صورت باشه ديگه سفارش نميدم,176686
p5ddx0,8,HAPPY,سس قرمز برای لازانیا نذاشتید ,312730
p5ddx0,10,HAPPY,"غذا داغ و در زمان کوتاه رسید
مرسی جو گریل ",342205
p5ddx0,2,SAD,واقعا متاسفم ۱۶۰ تومن پول لازانیا بود ولی حتی ردپای گوشت درونش دیده نمیشد متاسفم ,4064970
p5ddx0,8,HAPPY,نوشابه رو ارسال نکردن ,131634
p5ddx0,0,SAD,پیتزا مثل قبل نبود بسیار بدون طعم بود و همچنین خیلی کوچیک شده بود,319643
p5ddx0,6,HAPPY,کیفیت و حجم غذا نسبت به قبل پایین اومده,412258
p5ddx0,2,SAD,"سال هاست مشتری این رستورانیم، اما اخرین باری بود که به صورت بیرون بر ازشون خرید کردم. بعد از بیش از دو ساعت غذا کاملا سرد رسید.
",4860175
p5ddx0,2,SAD,کیفیت غذا خوب بود ولی به شدت تاخییر داشت دوبار مدت زمان تحویل تمدید شد ولی بازم تاخیر داشت,273091
p5ddx0,2,SAD,سالاد سزارش سرد و مرغش 5تیکه باریک از جو گریل توقعم خیلی بیشتر از این حرفا بود قیمت یه سالاد سزار و یه همبرگر 140تومن شد که به نظرم بالا بود,8071066
p5ddx0,10,HAPPY,بسیار خوشمزه و خمیر نازک عالی بود,234128
p5ddx0,10,HAPPY,خاص و خوشمزه ,3850077
p5ddx0,10,HAPPY,عالی مثل همیشه با کیفیت,8606045
p5ddx0,6,HAPPY,بسیار سرد و غیرقابل قبول بود,5732370
p5ddx0,10,HAPPY,مثل همیشه  هم کیفیت و هم زمان تحویل و هم برخورد پیک عالی و بدون نقص بود . ,3969003
p5ddx0,10,HAPPY,عالی مثل همیشه,326223
p5ddx0,2,SAD,كيفيت و مزه و طريقه پخت در حد غير قابل قبول. بادمجان نپخته اسپاگتي  با پخت ناهمگن ، بدمزه  با سس  رب گوجه غليظ و تيره و بيش از حد و مزه بسيار بد  گوشت داخلش بسيار بد مزه و سفت ، در عين قيمت بالا,1586291
p5ddx0,6,HAPPY,با این قیمت بالا انتظار میره غذا کیفیت بهتری داشته باشه. پیتزا و سیب زمینی به شدت سرد. سیب زمینی ها سفت و مانده. واقعا نمی ارزه ,2604194
p5ddx0,2,SAD,بسيار شور و چرب بود و به تلخى مى زد، كه قابل خوردن نبود.كيفيت به نسبت قبل خيلى پايين امده ,1047342
p5ddx0,2,SAD,"بالغ بر ۱۵۰ هزار تومان از من پول گرفتن برای پنه میگو با سس آلفردو 
خیلی صادقانه بگم یا آشپز اینجا نمی‌دونه پنه چیه یا من تا الآن پنه به این بی‌مزگی و بدمزگی ندیدم و امیدوارم هیچوقت نبینم.
بابت هزینه زیاد و کیفیت پایین غذای تحویل شده بسیار گله‌مند هستم و به هیچکس توصیه نمیکنم تجربه تلخ منو تکرار کنه.",10941950
p5ddx0,4,SAD,"نوشيدنيهايى كه سفارش داده بوديم و فراموش كرده بودن بذارن.
دو تا زيرو
يه دونه اسپرايت",2730214
p5ddx0,6,HAPPY,خیلی غذا سرد بود موقع تحویل ,4403684
p5ddx0,8,HAPPY,سالاد سزار جالب نبود و خیلی معمولی بود  ,6370646
p5ddx0,10,HAPPY,عالی,2426003
p5ddx0,10,HAPPY,عالیه مثه همیشه,5261734
p5ddx0,8,HAPPY,مقدار مرغ بنسبت پاستا کم است,3716807
p5ddx0,10,HAPPY,بهترین سالادی که تا حالا خوردم من واقعا معتادشم عالیه مخصوصا سسش بی نظیره,4369427
p5ddx0,8,HAPPY,"به جای پیتزای سبزیجات پیتزا استیک فرستادن
سالاد و ساندویچ عالی بود ",346087
p5ddx0,10,HAPPY,فوق العاده ,3546848
p5ddx0,10,HAPPY,عالی,6848265
p5ddx0,10,HAPPY,خیلی عالی و خوشمزه مواد تازه,4199359
p5ddx0,10,HAPPY,عالی مثل همیشه ,9938356
p5ddx0,8,HAPPY,سیب زمینی سرخ شده مونده بود,328852
p5ddx0,0,HAPPY,خیلی خیلی خوشمزه بود مرسی جوجو فرایز عالیه مرغ هم عای و به اندازه بود,265682
p5ddx0,10,HAPPY,این مدل نان گرد برای تست های صبحانه خیلی بهتر و نرمتره,7232166
p5ddx0,10,HAPPY,بنگرز اند مش عالی بود، اگه گریوی رو بیشتر بذارین و با نخود‌فرنگی سرو کنین هم خیلی خوب می‌شه.,7186614
p5ddx0,6,HAPPY,برخلاف همیشه متاسفانه به نظر میرسید که سیب زمینی ها مجدد گرم شدن و کیفیت سابقو نداشتن. مرغ های داخل سالاد هم همینطور.,214037
p5ddx0,2,SAD,متاسفانه کیفیت سفارش من بسیار بسیار پایین بود، فیله مرغ در هر سه ساندویچ تقریبا تبدیل به کربن شده بود و با توجه به بوی ماندگی آن مشخص بود که روغنی که با آن طبخ شده بود قبلا بارها مورد استفاده قرار گرفته بود. ,1204673
p5ddx0,10,HAPPY,عالی و با کیفیت,12726405
p5ddx0,10,HAPPY,عالی ممنون,6848265
p5ddx0,6,HAPPY,وقتي به دستم رسيد نصفش ريخته بود همچنين پاستا خيلي خيلي خوشمزه ترم خورده بودم دوس نداشتم پاستاشون رو ,3724707
p5ddx0,2,SAD,سیب زمینی مخصوص خورشت قیمه بود....,1284681
p5ddx0,10,HAPPY,شما واقعاً درستین .. ممنون ,322530
p5ddx0,10,HAPPY,خیلی عالی بود ، نان بسیار خوشمزه مرغ روشم تازه و خوش طعم ,1560753
p5ddx0,10,HAPPY,کیفیت عالی ، خیلی هم سریع و گرم رسید سفارشمون. ممنون ,6728804
p5ddx0,10,HAPPY,با جوجو فرایز حاضر به تجربه هیچ سیب زمینی سرخ شده دیگری نخواهید بود.,678448
p5ddx0,2,SAD,"با سلام
من سال‌ها خونم شهرک بودم از مشتری‌های فعال جو
الان اوست هستم و بعد از مدت‌ها گفتم از خوشمزگی جو لذت ببرم. اول اینکه غذا تقریبا یک ساعت دیرتر از زمان مشخص شده رسید و سرد سرد بود که حالا با توجه به اینکه راه دور بوده، منطقی هست ولی سیب‌زمینی بسیار مانده بود و وقتی که گرمش کردم مثل لاستیک شد!
کلا به خاطر سیب‌زمینی جذابتون سفارش داده بودم که خیلی ناامیدم کرد..",6683540
p5ddx0,8,HAPPY,خوب بود. میزان نمک ساندویچ‌ پستو و پیتزا خیلی کم بود و دوست داشتم مرغ ساندویچ با توجه به قیمت بالا طعم خاصتری داشته باشه اما مرغ مزه خاصی نداشت,7626369
p5ddx0,10,HAPPY,به نظرم بهترین و خوش طعم ترین همبرگره و تنها جاییه که سیب زمینی سرخ شده ش خمیر نمیشه,4763215
p5ddx0,10,HAPPY,عالی عالی ,7954914
p5ddx0,6,HAPPY,در صفحه رستوران نوشته شده ارسال رایگان، اما ۵۰۰۰ تومان هزینه پیک دریافت شد,160467
p5ddx0,10,HAPPY,عالی,4090623
p5ddx0,10,HAPPY,عالی,9632372
p5ddx0,10,HAPPY,در یک کلمه عالی,1560753
p5ddx0,10,HAPPY,عالی,8523158
p5ddx0,10,HAPPY,عالی هستین عالی بمانید,1284681
p5ddx0,10,HAPPY,همه چیز عالی و مرتب ,8013663
p5ddx0,10,HAPPY,بهترین هستید,4763215
p5ddx0,10,HAPPY,مثل همیشه خوب و راضی ام,6218853
p5ddx0,8,HAPPY,غذا تقریبا سرد به دست من رسید ولی کیفیت و طعم خوبی داده,3348485
p5ddx0,8,HAPPY,بد نبود  ممنون,424389
p5ddx0,10,HAPPY,عالی ,329658
p5ddx0,10,HAPPY,تازه وخوشمزه ,6643010
p5ddx0,10,HAPPY,"من طعم سس رو دوست داشتم، به نظرم یه جور طعم فانتزی داشت. حجم سس خوب بود ولی چون خوشمزه است آدم دوست داره بیشتر بریزه بازم، به دل مشتری باشه حجم سس بیشتر باشه خوشحال‌تر میشه.
با سپاس",3338251
p5ddx0,6,HAPPY,سيب زمينيش خيلي خشك بود ,967497
p5ddx0,8,HAPPY,غذا بسيار سرد تحويل شد,1199179
p5ddx0,8,HAPPY,غذا هم داغ رسيد هم به موقع هم لذيذ بود،ممنونم,9570576
p5ddx0,8,HAPPY,مقدارش نصف چیزی بود که در تصویر هست اما خوب بود طعمش.,972843
p5ddx0,0,SAD,"متاسفانه کیفیت غذا در حد انتظار نبود و غذا سرد شده بود. 
بسته بندی مناسب نبود و پیتزا به جعبه چسبیده بود. از نظر بسته بندی و رعایت بهداشت در شرایط کرونا، رعایت موارد بهداشتی نشده بود.
متاسفانه سفارش من با کم و کسری(سس، قاشق و چنگال و ...) به دستم رسید و بعد از پیگیری از رستوران و حدود 10 دقیقه پشت خط بودن، به من گفتن بابت ارسال مابقی سفارش، باید هزینه ارسال مجدد پرداخت کنی، این نشان از بی توجهی به مشتریان و ضعف در سیستم مدیریت است.  
البته انصافا برخورد و لحن شخصی که تلفن رو جواب داد، بسیار مودبانه و محترمانه بود و میتونم بگم تنها نقطه مثبت این رستوران همین بود.

آرزوی موفقیت",1160615
p5ddx0,2,SAD,همه چی خوب بود بجز پیتزا,1285759
p5ddx0,8,HAPPY,"همبرگر عالی بود
ولی سیب زمینی سرد شده بود",1261571
p5ddx0,10,HAPPY,خیلی خوشمزه بود و گرم رسید به دستم. ممنونم .,3213432
p5ddx0,2,SAD,ناقص بودن سفارش سيب زمينى نداشت ,1683721
p5ddx0,10,HAPPY,عالی و خوشمزه. لطفا همراه پیتزاها سس های مختلف و اویشن هم بفرستید.,337053
p5ddx0,10,HAPPY,عالی بود. جوجوفرایز حرف نداشت,4515862
p5ddx0,6,HAPPY,سرد بودن غذا,413409
p5ddx0,6,HAPPY,متاسفانه پنه طعم خوبی نداشت. ولی غذا گرم رسید و سیب زمینی اش خوشمزه بود,1004916
p5ddx0,8,HAPPY,ادویه و کیفیت سیب جوجوفرایز کم شده و ظرف و پکیج جوجوفرایز مقوایی و بد شده ,5839309
p5ddx0,8,HAPPY,"پیتزا خیلی خوب بود ولی متاسفانه کیفیت سیب زمینی بسیار بسیار پایین بود و به نحوی که مثل لاستیک بود و جویده نمیشد. مشخص بود ۲تا ۳ ساعت قبل آماده شوه بود. ولی پیتزا استیک پستو واقعا خوشمزه بود
پیشنهاد میکنم در طرز تهیه و نوع برش سیب زمینی هاتون تجدید نظر کنید",3318625
p5ddx0,10,HAPPY,"عالیییی بود هم طعم پیتزا گوشتش فوق العاده لذیذ بود
سالاد هم عالی بود",1111877
p5ddx0,10,HAPPY,غذا بسیار عالی بود مثل همیشه وخیلی زود رسید ممنونم ,957836
p5ddx0,2,SAD,افتضاح,745804
p5ddx0,2,SAD,طبق معمول سرد برخلاف اینکه تماس گرفتیم و سفارش کردیم که گرم بفرستن!,1518227
p5ddx0,10,HAPPY,بسیار خوشمزه ‌ و اندازه ,1111459
p5ddx0,6,HAPPY,غذا سرد بود ,7106235
p5ddx0,2,SAD,بوی روغن مونده از سیب زمینی ها واقعا بد بود. چرا باید با این هزینه کرد این کیفیت سیب زمینی سرخ شده باشه,6875382
p5ddx0,10,HAPPY,محشر,1727056
p5ddx0,6,HAPPY,"چیکن پستو متاسفانه مواد پستوش بسیار بدطعم بود، من مجبور شدم فیله هارو دربیارم و موادش رو پاک کنم بعد بخورم اما خود فیله خوشمزه بود
گرین برگر خوب بود اما پیازهاش خیلی کلفت و درشت بود، از بیرونی ترین لایه های پیاز گذاشته بودن که کیفیتش پایینتره ",890634
p5ddx0,10,HAPPY,عالی به تمام معنا ,2964595
p5ddx0,0,HAPPY,علیرغم تعریف بسیار کاربران کیفیت غذا بسیار بد بود، خمیر پیتزا در حد نان لواش بود، سس کارخانه ای با برند نامعتبر ناشناخته فرستاده بودن، سیب زمینی در حد چیپس خلالی بسیار نازک و خشک بود، متاسفم از خریدی که کردم و اصلاااا اینجارو توصیه نمیکنم,7137910
p5ddx0,10,HAPPY,غذا خیلی خوب بود ولی خیلی دیر اومد ,1592725
p5ddx0,4,SAD,مقدار غذا خیلی کمه ,4223563
p5ddx0,10,HAPPY,"مرغ هیچوقت انتخاب من نیست،
ولی این بشقاب جو حرف نداره ... ",402895
p5ddx0,8,HAPPY,"تست بادمجان طعم خوبی نداشت 
سیب زمینی ها همیشه خوشمزن اما ایندفعه بیات بود کمی 
پیتزا کیفیت خوب بود 
حجم پنیر پیتزا نسبت ب قبلا کم شده بود و با اینکه ذکر کرده بودم نان جو نباشه خمیر پیتزا و ساده باشه باز هم از خمیر سبوس دار استفاده شده بود و مورد علاقم نبود",1513531
p5ddx0,8,HAPPY,خیلی تازه مثل همیشه نبود,3929619
p5ddx0,10,HAPPY,خوشمزه و با کیفیت بود ، ممنون,3953470
p5ddx0,10,HAPPY,سس فراموش شده بود ارسال بشه ولی بازم من نمره کامل میدم چون بسیار باکیفیت بود به توضیحات کامل توجه شده بود و مهمترین نکته با اینکه فصل انار رو به اتمام ولی واقعا آب انار با کیفیتی ارسال شده بود طبیعی عالی ، یکمی قیمت ساندویچ کمتر بشه بهتره نسبت به جاهای دیگه ولیی اینم باید گفت که نسبت به کیفیتی که ارائه شد خوب بود معلوم بود که رستوران برای این ساندویچ وقت گذاشته شده بود و همینجوری یک چیزی ارسال نکرده بود باتشکر از رستوران و اسنپ فود.,4806115
p5ddx0,8,HAPPY,سس اين سالاد بي رقيبه، كاهو ميتونست تازه تر باشه، گردو به نسبت سابق كم شده بود.,972843
p5ddx0,10,HAPPY,پیتزا مرغ پستو عالی بود مثل همیشه پیتزا قارچ و پنیر هم بد نبود من مرغ پستو رو ترجیح میدم به دومی,2777569
p5ddx0,8,HAPPY,با اينكه تاكيد كرده بودم داخل ساندويچ خيار نگذارند گذاشته بودند,4290225
p5ddx0,6,HAPPY,با توجه به قیمت بالای پیتزا تسورو توقع یک پیتزای ویژه استیک داشتم در صورتی که بسیار معمولی بود و هیچ طعم ویژه ای نداشت . ,3548933
p5ddx0,2,SAD,سیر و خامه‌ی بسیار زیاد و اذیت کننده . ,4772257
p5ddx0,10,HAPPY,سالادها همیشه بینظیر,4772257
p5ddx0,6,HAPPY,"همیشه عالی بودین ولی سفارش دیروز واقعا با دفعات قبلی فرق بنیادی داشت، اصلا از شما انتظار این پیتزا رو نداشتم، 
ناگفته نمونه  سریع ارسال شد، اما کیفیت سابق نبود اصلا",4538450
p5ddx0,6,HAPPY,راستش خیلی سرد رسید دستمون ، که غذاها مزه خاصی نمی داد، چون ماسیده شده بود ولی حتما وقتی گرم سرو میشه خیلی خوشمزه ست,3913642
p5ddx0,10,HAPPY,بسیار خوشمزه و عالی ,182182
p5ddx0,2,SAD,مرغ نپخته و طعم غذا واقعاً افتضاح بود.من با همون ظرفش انداختم دور.اصلا قابل خوردن نبود.,2349288
p5ddx0,2,SAD,من تو این سفارش در توضیحات سس اضافه درخواست کرده بودم ولی ارسال نشد,7541928
