restaurant_code,rating,feeling,commentText,customerId
3271je,10,HAPPY,عالی بود,785818
3271je,4,SAD,قبلا دو تیکه استیک بود الان شده یکی بعد گرون هم میکنید واقعا دور از انصاف هست ,951326
3271je,6,HAPPY,سس سزار هیچ شباهتی به سس سزار نداشت…فقط مایونز بود و چاشنی,178106
3271je,10,HAPPY,عالی هستین فقط یکم سریع تر ارسال کنید  خیلی خوب میشه,1255271
3271je,6,HAPPY,سیب زمینی ها مزه اش عالی بود اما واقعا ساندویچ افتضاح بود،مواد بیف استروگانف توش بود و گوشت خودش سنگینه ورداشتین توش فلفل دلمیه ای خام ریختین!نه گوجه نه خیارشور نه کاهو.خیلی هم شور بود.,7988740
3271je,4,SAD,ماهی باید بیشتر پخته شود ولی ترتیب اثر نمیدند متاسفانه ,4505803
3271je,10,HAPPY,عالی و تازه,1169151
3271je,10,HAPPY,بسيار عالي,7739947
3271je,10,HAPPY,خوب بود,7897635
3271je,10,HAPPY,کمی تاخیر داشتن ولی سالاد ها عالی بود ,4235867
3271je,10,HAPPY,بسیار با کیفیت و لذیذ,4153810
3271je,10,HAPPY,مثل همیشه عالی بود هم ساندویچ هم بشقاب سبزیجات فقط نون  ساندویچ بخار کرده بود و نرم شده بود ,5962009
3271je,10,HAPPY,عالی بود,171732
3271je,10,HAPPY,عالی… تنوع سبزیجات، طعم سبزیجات و حجم غذا عالی است..,4367015
3271je,10,HAPPY,عالی بود,8726330
3271je,10,HAPPY,همیشه جذاب و با کیفیت,131129
3271je,10,HAPPY,سس سزارشون خیلی خوشمزه بود من با کمی سیر و روغن زیتون قاطی کردم و روی سالاد خونگیم ریختم و خیلی خوب شد. ,2130289
3271je,4,SAD,سس سالادوسس سیب زمینی کم بود,6580675
3271je,2,SAD,"پیک‌‌ اول گفت حساب نشده 
که شده بود 
بعدش هم گفت اگر قرار بود برای ۱۰ تومن بیام نمیومدم !!!!",229174
3271je,10,HAPPY,عالی,171732
3271je,10,HAPPY,عالی و درجه یک مثل همیشه..,3456666
3271je,10,HAPPY,مثل همیشه عالی,3402175
3271je,8,HAPPY,عالی,4936347
3271je,10,HAPPY,بسیار عالی و تازه بود هم کیفیت هم حجم سالاد بینظیر بود,1263187
3271je,10,HAPPY,عالییییییی,8762345
3271je,8,HAPPY,شور بود..قبلا هم گفتم ..جز این همه چیز عالی,4741768
3271je,6,HAPPY,قبلا كيفيت متريال خيلي بهتر بود,1550827
3271je,10,HAPPY,خیلی خوش کیفیت و عالی,6739266
3271je,0,HAPPY,"عالی بود ، کیفیت سالاد و ساندویچ خیلی خوب بود
سوپ تازه و خوشمزه
",3643066
3271je,10,HAPPY,همه چیز خوب الان مدتی هست که من کلا به خاطر کیفیت خوب غذا و بشقاب سبزیجات فقط از این مجموعه سفارش میدم. فقط بهتره ماهی یکم بیشتر پخته بشه.,1169801
3271je,6,HAPPY,خوب بود ولی خییییلییی دیر آمد و یه نوشابه هم کم آورد!!!,2166001
3271je,2,SAD,به جای ۲ سالاد یونانی، ۲ سالاد سبز و با تاخیر ارسال شد,4259985
3271je,10,HAPPY,خیلی عالی بود مرسی که هستی,9521537
3271je,10,HAPPY,خیلی سریع به دستم رسید و خیلی تازه و خوب,3258147
3271je,10,HAPPY,در کل راضی بودم ,9894077
3271je,6,HAPPY,ساندویچ رست بیف سرد سرد !!!!!,1534781
3271je,8,HAPPY,حجم آیتم ها خیلی خوبه. سیب زمینی کاملا دو نفر رو سیر میکرد.,3734047
3271je,10,HAPPY,"عالی بود ممنون
سس خوشمزه و مواد اولیه تازه",4215517
3271je,10,HAPPY,مثل همیشه عالی، فقط درخواست داشتم یک سس اضافه تر بفرستید، عاشق سس سالادتونم ولی هیچ سس اضافه ای برام نیومد,7254940
3271je,10,HAPPY,خیلی خوشمزه بود در مجموع از بسته بندیش هم خیلی خوشم اومد ,3497330
3271je,10,HAPPY,خیلی خوشمزه بود,7254940
3271je,10,HAPPY,غذاهاش خیلی با کیفیت و تازس,3375554
3271je,10,HAPPY,"فوق العاده عالی و خوشمزه 
نمرتون ۲۰ عه",3433188
3271je,4,SAD,مرغش خام خام بود,5295925
3271je,6,HAPPY,بسته بندی پاره شده بود وسس غذا ها ریخته شده بود,7345456
3271je,10,HAPPY,فوق العاده تازه و خوشمزه..ممنونم,744208
3271je,10,HAPPY,"آقایون خانوما اینجا خیلی خفنه خوده خودشه سفارش بنده سبزیجات بود خوب و با کلاس پکبندی موادغذایی تازه بیشک حال میکننین 
:)",4456309
3271je,10,HAPPY,عالیه هرچی سفارش می‌دیم، خوشحالم این رستوران رو پیدا کردیم,1434459
3271je,10,HAPPY,فقط تاخیر زیادی داشت. پس از اتمام زمان اولیه، سی دقیقه دیگر به زمان اضافه شد,884958
3271je,2,SAD,متاسفانه پیک کل مسیر بسته سالاد رو برعکس اورده بود تمام آب قارچ و کدوها از بسته بیرون ریخته بود ,571100
3271je,10,HAPPY,"عالی بود 
بسیار خوشمزه",319688
3271je,2,SAD,"وقتی میبینید یکی داره مشتری دائمتون میشه تمامِ تلاشتون رو میکنید ک از دست بدیدش
۲۰ هزار تومن هزینه پیک میگیرید ک غذا سالم و گرم ب دست مشتری برسه
بعد از یک ساعت و نیم ب دستم غذای یخ زده و تمامن قاطی شده و داخل کیسه ریخته تحویل دادید
واقعا تاسف آوره",4914802
3271je,10,HAPPY,برای اولین بار بود که از رستوران شما سالاد سفارش دادم  واقعا عالی بود و با کیفیت ، بسیار ممنون هستم از کیفیت عالی سالاد و غذاهای شما,3045380
3271je,10,HAPPY,عالی مثله بیشتر اوقات,3739087
3271je,6,HAPPY,سالاد تازه و باکیفیت بود. اما متاسفانه بسیار با تاخیر تحویل شد.,1312129
3271je,6,HAPPY,"سالاد چاینیز بسیار عالی و خوشمزه بود...
اما پاستا پنه آلفردو با مرغ بسیار کیفیت غذا پایین بود،،اصلا سس نداشت و پاستاها به هم چسبیده بود....خیلی خشک بود و بوی خوبی نمی داد.",4375754
3271je,8,HAPPY,"با سلام و سپاس 
غذای دیشب عالی و گرم بود اما امشب غذا خوشمزه ولی کاملا سرد بدستم رسید که لذت غذای دیشب رو برام کم کرد.  
 بی انصافیه  اگه نگم طعم غذا عالی بود. ",5189814
3271je,10,HAPPY,سلام.واقعا براتون بهترین ها آرزو میکنم شما بی شک بهترین رستوران تهرانید .همه غذاهاتون عالیه .گریل ها فوق تصور عالیه. امروزم که ساندویچ ماشروم اوردید معرکه بود. سالاد هم مثل همیشه عالی. خدا به کسبتون برکت بده. فقط خواهش میکنم قدری تخفیفاتونو بیشتر کنید که بیشتر سفارش بدیم و همچنین خواهشا خواهشا خواهشا کیفیت فوق العادتون رو‌حفظ کنید. بازهم تشکر و ممنون به خاطر غذای عالی تون,6208526
3271je,10,HAPPY,خیلی خیلی عالی ، سیب زمینی خیلی زیاد بود ، حروم شد بیشترش ,7841164
3271je,10,HAPPY,عالی.,3497929
3271je,2,SAD,اولين بار نيست سفارش ميدم ولي اين سري خيلي بد بود,212561
3271je,8,HAPPY,مثل دفعه ی قبل خوشمزه نبود,7575926
3271je,10,HAPPY,سفارش دومم بود از همین منو با همون کیفیت عالی تازه سالم و خوشمزه با طبخ مناسب مرسی,3497929
3271je,2,SAD,غذا یخ یخ رسید. ,287659
3271je,10,HAPPY,عالی بود مرسی ,4911450
3271je,0,HAPPY,با سلام متاسفانه این برای چندمین بار هست که پیش میاد و در قسمت اضافات هر چی می نویسیم ارسال نمی شه مثل امروز که من زده بودم سس سبز اضافه گردد و باز هم ارسال نشد,1593819
3271je,10,HAPPY,"به جرات میتونم بگم از بهترین سالادهای بود که خوردم
طعم و حجم مرغ عاااالی ،
متریال تازه 
و مزه ی شش ها بی نظیر ! واقعا بی نظیر !!!!
",928130
3271je,8,HAPPY,وای که چقد مرغ داشت درصورتی ک سری پیش خیلی کم بود. خیلی ممنون همیشه مرغشو زیاد بزارید,2679070
3271je,10,HAPPY,بسیار خوشمزه و عالی بود,4519347
3271je,6,HAPPY,قبلا قیمتش ۱۰۰ بود با حجم بالای استیک ..الان شده ۱۳۵ با نصف استیک مقدار قبلی,7065173
3271je,10,HAPPY,عالی بود و ممنونم.,3974736
3271je,6,HAPPY,بسته بندی معمولی،کیفیت و طعم عالی،سس ها هردو خوشمزه، دقیقا طبق نظرات دوستان با کلی تاخیر ارسال شد،نون کنجدی خیلی خوشمزه، حجم سس ها کم و نامتناسب با حجم سالاد. در کل اگر تاخیر نداشتند به نظرم سفارش خوبی بود,6750127
3271je,10,HAPPY,فوق العاده عالي بود,821904
3271je,4,SAD,سالاد اسفناج رو چندین بار هست سفارش میدیم و به قوای هر بار گذشت میکنم ولی اینبار خواستم بگم بزرگترین سایز اسفناج هست ، رستوران عزیز شما قیمت سالادی که میگیرید باید بی بی اسفناج باشه نه اندازه برگ کاهو اسفناج میزارید,153655
3271je,10,HAPPY,خيلي خوب و خوشمزه بود ممنون ,1195563
3271je,4,SAD,"کاهو هاش تازه نبود و 
حدود یک سوم از کاهو ها نرم شده و کهنه بودن",2312219
3271je,0,SAD,من قبلآ اين سالاد رو خريده بودم از همين رستوران سس همراه داشت حجم بيشتري هم داشت,5051636
3271je,10,HAPPY,همه چیز بسیار عالی و خوشمزه ممنونم,709452
3271je,4,SAD,براي اولين باز گرفتم خوب بود ولي كاهو خيلي بزرگ بود و خورد نشده بود مقدار فيله هم نسبت به كاهو كم بود ولي در كل بد نبود,9742064
3271je,10,HAPPY,عالی بود عالی,730164
3271je,10,HAPPY,فکرنکنم بهتر از این بشقاب سبزیجات تا به حال امتحان کرده باشم. مرسی واقعا عالی با کیفیت بود ,3497929
3271je,10,HAPPY,عالی,8574424
3271je,0,HAPPY,پرفکت بود کیفیت غذا ,149809
3271je,8,HAPPY,دورچین استیک مرغ طعم خاصی نداشت,8792912
3271je,10,HAPPY,بسيار عالى,1268903
3271je,10,HAPPY,سريع، گرم و خوشمزه,280320
3271je,10,HAPPY,تو همه سبک غذا فوق العاده خوشمزه و باکیفیت هستن,961136
3271je,10,HAPPY,عالی بودددد خصوصاا پوره سیب زمینی از شما ممنونم,717864
3271je,8,HAPPY,"بسیار عالی
هم بسته بندی هم خود سالاد
تنها ایراد تحویل و آماده سازی طولانی",2213246
3271je,10,HAPPY,سوپ عالی بود,206991
3271je,10,HAPPY,كيفيت غذا و سالاد بي نظير سس خيلي خوشمزه ، فقط هزينه ارسال ٣٥ هزار تومان يكم زياد بود,502545
3271je,0,HAPPY,"بشقاب سوسیس کاری یکیش نون داشت یکیش نداشت!
ولی خوشمزه بود انصافا",742926
3271je,10,HAPPY,خیلی خوشمزه بود و سالم اما سالاد بنده جوانه نداشت داخلش,8618402
3271je,2,SAD,ساعت ۱۳.۱۳ دقیقه ثبت سفارش شده و ساعت ۱۵.۴۵ رسیده، برای سالاد آیا این تاخیر منطقی است؟,2467907
3271je,2,SAD,۲ ساعت تاخیر برای ارسال از رستوران به ۵ تا خیابون پایین تر,3002541
3271je,8,HAPPY,ای کاش گرون نمیکردین,3739087
3271je,6,HAPPY,"محتویات بشقاب سبزیجات قرار بود حاوی کدوی گریل شده باشه اما ظاهرا سرخ شده بود
درکل هم بسیار چرب بود",180758
3271je,10,HAPPY,عالیییی,814064
3271je,10,HAPPY,فوق العاده عالی و حجم خوب بازم سفازش می دم,4936347
3271je,2,SAD,کیفیت معمولی,490613
3271je,2,SAD,در ظرف پاستا اصلن خوب بسته نمی شود.,226792
3271je,10,HAPPY,عالی هستین,3739087
3271je,10,HAPPY,"عالی عالی عالی. هرچی بگم کم گفتم
ممنونم ازتون",350414
3271je,8,HAPPY,غذاتون كيفيتش خوب هست ، ولي خيلي خيلي شور و چرب شده، اوايل اصلا اينجوري نبود,11130853
3271je,10,HAPPY,فوق العاده بود.,302847
3271je,4,SAD,بازم شور بود!!!,1239411
3271je,10,HAPPY,فوق العاده,4997254
3271je,10,HAPPY,خیلی خوشمزه و حجم غذا زیاد بود.,3453183
3271je,2,SAD,"حدود دو ساعت طول کشید ، 
سالاد فروش نان مخصوص داره نان این سالاد نون کنجدی بود ",7544486
3271je,8,HAPPY,همه چیش عالیه،فقط کاش هزینه حمل کمتر شه,380434
3271je,0,HAPPY,همه چی عااالی خسته نباشید,3223800
3271je,6,HAPPY,استیک گوساله خیلی سفت بود,1057857
3271je,10,HAPPY,محشرررررر-مثل همیشه عالی-تمیز-خوشمزه است و من ۲ماه میشود که مشتریشان شده ام,304772
3271je,10,HAPPY,"رُفقا دمتون گرم. کلی کارتون درسته. خوشحالم شما رو پیدا کردم. 
همه چی عالی - استیکاشون رو از دست ندین",7132805
3271je,0,HAPPY,همه چیز عالی کیفیت و پخت ,2080063
3271je,10,HAPPY,"پرتقال و سیب داشت ، تعداد قارچ ها مناسب بود 
عالی بود ممنون ",1310583
3271je,0,SAD,کیفیت فرش باکس روز به روز داره افت می کنه. تو این روزا که مشکلات اقتصادی یقه ی همه رو گرفته اصلا منصفانه نیست که برای غذای بی کیفیت پول زیاد پرداخت بشه. متاسفم که اینجوری دارید مشتری از دست میدید مجموعه ی فرش باکس. ,3663155
3271je,10,HAPPY,عالي,8798324
3271je,10,HAPPY,عالی بود,2973094
3271je,10,HAPPY,خیلی خوب و به موقع رسید ,2796187
3271je,10,HAPPY,باكيفيت و خوشمزه بود .. ممنونم,7714147
3271je,10,HAPPY,کیفیت عالی و قیمت مناسب,1069503
3271je,8,HAPPY,خیلی خوشمزه و عالی، فقط پوره سیب زمینی کم بود ,5169954
3271je,10,HAPPY,بسيار عالى بود و داغ رسيد ,1908718
3271je,2,SAD,ساعت ۱۰ شب سفارش داده شده است و پس از دو مرتبه اعلام تاخیر در ساعت ۱۱/۳۵ شب سفارش اشتباه ارسال گردید و و علیرغم ۳ مرتبه پیگیری از پشتیبانی مشکل حل نشد,1026798
3271je,2,SAD,نسبت به همیشه حجم‌ سیب زمینی بسیار کمتر بود وکاملا خمیرشده بود ‌نوشابه هم یه دونه بیشتر نبود جعبه کاملا پاره شده بود,5616867
3271je,6,HAPPY,همیشه خوب بود ولی ایندفعه سرد بود که تو ذوقم زد!,3412192
3271je,10,HAPPY,خیلی خوب بود هم کیفیت و هم انتخاب مناسب مواد تشکلی دهنده سالادکه فوق العاده باهم جور بودن,6060778
3271je,10,HAPPY,سلام سالاد خیلی سریع رسید فقط پیشنهادم اینه یه سس رژیمی به منوتون اضافه کنید واسه کسایی که نمیتونن سالاد و با سس پر کالری بخورن,3799227
3271je,10,HAPPY,پیک اعزامی مسیر را بلد نبود و با چند بار تماس بالاخره ,969762
3271je,6,HAPPY,قبلا که قیمتش پایینتر بود بیشتر توش رست بیف داشت هم قیمت رو بردین بالا هم مواد توش رو کمتر کردین واقعا چرااااا,2000221
3271je,10,HAPPY,عالي ,9146224
3271je,10,HAPPY,خیلی خوب بود,779474
3271je,10,HAPPY,مثل همیشه عالی,6555067
3271je,10,HAPPY,خیلی عالی بود,8226439
3271je,10,HAPPY,جدایی از اینکه طعم و تازگی غذا عالی بود ، میزان این کمبو برای دو نفر نبود برای ۲۲ نفر بود ..  ,1473229
3271je,10,HAPPY,"عالیه
من هفته ای یکبار از این سالاد خوشمزه می‌خرم 
کیفیت هم عالی هست ",1251067
3271je,2,SAD,"سیب زمینی ها سرد و مونده بود  
داخل ساندویچ همش فلفل دلمه ای بود به جای مرغ و بشدت بی مزه بود و  نسبت به قیمت بالایی که داشت نمی ارزید",6913225
3271je,10,HAPPY,همه چي عالي,6148589
3271je,2,SAD,حجم و بسته بندی خوب بود ولی به جای یک ساعت که تعیین کرده بودند دو ساعت بعد رسید و متاسفانه سالادها گرم شده و غذا سرد بود.,5543638
3271je,10,HAPPY,عالی,1578651
3271je,0,HAPPY,غذا سرد بود,4653767
3271je,0,HAPPY,درسته زمان آماده سازی و رسیدنش طولانی بود اما واقعا عالی و خوشمزه بود. حرف نداشت,186549
3271je,10,HAPPY,بی نظیر ,8041502
3271je,8,HAPPY,خیلی خوشمزه و سالم بود,1245895
3271je,10,HAPPY,مثله همیشه تمیز و خوشمزه و اندازشم عالیه ,2827834
3271je,2,SAD,"سالاد بسیار ضعیف بود ! حجم هویج بادوم زمینی لوبیا کلم همش با هم اندازه به مشت هم نبود ! عکس هم گرفتم براشون ! کل سالاد کاهو بود فقط!! 
سس هم اشتباه آوردن ! یه بالزامیک آوردن به جای بادوم زمینی ! ",317804
3271je,0,HAPPY,"بسته بندی و زمان ارسال خیلی خوب بود
غذا هم خوشمزه بود ولی پوره سیب زمینی نداشت. اما در کل راضی بودم. امیدوارم کیفیت حفظ بشه همیشه.ممنونم",502912
3271je,4,SAD,"نسبت به سری قبل واقعا افتضاح بود
فقط ریحان گذاشته بودند تا اونجا که میشد، واقعا خیلی بد بود، کلم بروکلس یه دونه کوچیک ، نه کلم دلشت وحجم سبزیجات خیلی خیلی کم شده بود
حداقل قیمت رو بالاتر ببرید که کیفیت غذاتون اینقد افت نکنه، اصلا ارزش سفارش نداره",739604
3271je,10,HAPPY,"استیک مرغش عالیه واقعا
سوپ معمولی",2358663
3271je,8,HAPPY,بسته بندی جذاب و طعم عالی. لطفا با همین کیفیت بمونید ممنون.,7358951
3271je,2,SAD,"برای سالاد بیش از یک ساعت زمان ارسال اونم در شرایطی  که هزینه پیک جدا دریافت شده واقعا مسخره هستش
من دو تا سالاد سفارش دادم که با توجه به مواد موجودی که نوشته شده در سالاد بود که اصلا اون مواد و این عکس با سالادی که برای من ارسال شد کاملا فرق داشت سالاد سبز فقط خیار و کاهو و گوجه بود در صورتیکه گفته بودن زیتون سیاه پیاز و پنیر داره که هیچی نداشت سالاد شگسزار هم همینطور و به نسبت قیمت واقعا غذای چرت و بدرد نخوری بود خیلی افتضاح بود ",1885678
3271je,2,SAD,"غذا سرد شده بود، پوره غذا ترش بود ، ادویه اش خیلی زیاد، فیله سوخته 
غذام غیر قابل خوردن بود واقعا افتضاح بود ",5025385
3271je,10,HAPPY,مثل همیشه عالی ,1796238
3271je,0,SAD,سس فراموش شده بود,156447
3271je,0,SAD,پيش بيني زمان يكساعت بود كه خودش كم نيست براي يه سالاد ولي دقيقا دوساعت طول كشيد تا بياره واقعااا بد اين مقدار تاخير ,220040
3271je,0,SAD,"من الان 3 باره که از فرش باکس سفارش میدم و هر 3 بار مواد داخل سالاد با منو فرق داره. و جالب اینجاست که موادی که قیمتشون بیشتره اصولا حذف یا جایگزین شدن مثلا گوجه خشک با آلو یا آووکادو با کمپوت آناناس جایگزین شده یا مثلا تو منو زده تخم کتان داره ولی تو سالاد اثری ازش نیست
",3347568
3271je,0,SAD,"خیلی خیلی تاخیر داشت
بیش از حد",3349848
3271je,0,SAD,چرا آووکادو نداشت این,735024
3271je,2,SAD,,178082
3271je,0,SAD,سس سالاد اصلا طعم نداشت و نزدیک ۲ساعت طول کشید تا برسد .,486993
3271je,0,HAPPY,چند هفتهای است که کیفیتش از دست داده,331251
3271je,0,HAPPY,خیلی خوبه,534179
3271je,0,HAPPY,زمان رسیدن سفارش طولانی شد ولی از پیگیری های مسئولان اسنپ فود رضایت کامل دارم. موفق باشید,951422
3271je,0,SAD,"من بارها از رستوران شما سالاد سفارش دادم ولی این بار کینوا های دو سالاد خریداری شده، خراب و سیاه بوند.
متاسفانه کیفیت مرغ گریل شده هم پایین بود و مثل همیشه نبود.",527604
3271je,0,HAPPY,سالاد سزار خوب بود، البته به نظر سس سزار میتونه از این خوشمزه تر هم باشه. تیرامیسو طعم بدی داشت ضمن اینکه لیدی فینگرهای داخلش سفت بودن در صورتی که باید در قهوه زده شده و نرم می شدن. بسته بندی هم مرتب و تمیز بود. سفارش هم زودتر از زمان گفته شده به دستم رسید,565143
3271je,0,HAPPY,گقته بودم سس بذارید توجه نکردن :(,299376
3271je,0,HAPPY,حجم کاهو نسبت به سایر مواد خیلی زیاد است.,1205851
3271je,0,HAPPY,"بسیار عالی بود، سس بادام زمینی بی نهایت خوب بود 
ممنونم",466470
3271je,0,SAD,"متاسفانه همانند موارد قبل بازهم باوجود درخواست سس سزار
سس اشتبان ارسال شده بود",3749650
3271je,0,HAPPY,سوپ عالی بود  سالاد انتظار بیشتری داشتم.   ,264422
3271je,0,HAPPY,"با سلام
کیفیت و حجم سالادها بسیار خوب و کافی بود.
بسته بندی سالادها هم بسیار خوب و محکم بود.
تنها یک انتقاد کوچک در مورد سالاد کینوا دارم که به نظر بنده میزان کینوا در اون خیلی کم بود.
و در مورد سس هر دو سالاد هم به نظرم خیلی سفت بودند و طعمشون هم من خیلی دوست نداشتم، اگر سس انتخابی داشته باشن و  سس های سالم تری مث ترکیب لیمو ترش و روغن زیتون هم در گزینه ها بگذارند خیل خوب میشه.

",656856
3271je,0,HAPPY,خیلی خوب بود امیدوارم کیفیت همینطور خوب  باقی بمونه,521144
3271je,0,HAPPY,"خیلی خوشمزه و زیاد بود 
",160283
3271je,0,HAPPY,خیلی طول میکشه تا بیاد...چرا؟ مگه سالاد نیست؟...از کیفیت راضی بودم ولی:),1275075
3271je,0,HAPPY,"بیش تر از دو ساعت منتظر اومدن غذا بودم 
ولی کیفیت غذاش متوسط رو ب خوب بود و سس‌ش خیلی خوب و عالی بود ",4477754
3271je,0,SAD,سس سالاد تونا واقعا مناسب نبود و تمام طعم آن را از بین برد ,562236
3271je,0,SAD,در سالاد اسفناج، حجمش نسبت به ظرف کمتر بود، و انار که جز میوه های فصل بود هم داخلش نبود. سس که ترکیبی از سس انار و سرکه بود. سرکه اش خیلی تند بود. البته اسفناج ها به خوبی شسته شده بود .,729368
3271je,0,SAD,"همیشه مرغش که روش میزاشتین بیشتر بود ، این دفعه فقط یه تیکه کوچیککککککک. خیلی تعجب کردم ، چون دقیقا دیروز همکارم سفارش داده بود تیکه های مرغ عالی داشت، ولی برای من فقط یه نوار باریک.
",1031382
3271je,0,HAPPY,خوب بود ولی سس خییلی غلیظی داره و باید حتما رقیق بشه,344295
