restaurant_code,rating,feeling,commentText,customerId
37jgem,2,SAD,پیتزا بوقلمون وحشتناک شور بود و همچنین پراز ادویه و فلفل ،در صورتیکه من تو توضیحات درخواست داده بودم ادویه فلفل زده نشود . قارچ هم پودرهای سوخاری ازش ریخته شده بود و مثل قارچ سرخ شده معمولی بود و بسیار ریز . اولین بار و همچنین آخربن بار بود که از باگت غذا گرفتم. یک ستاره رو فقط به پیتزا سیر استیک دادم. ,1277839
37jgem,10,HAPPY,"بهترین بسته بندی
غذا هم عالی",1327901
37jgem,10,HAPPY,خیلی خوب بود راضی بودیم  تاخیر داشت فقط ,5143830
37jgem,10,HAPPY,خوب بود,3581352
37jgem,4,SAD,فیله استرپس با همیشه فرق داشت و به نظر میرسید که تازه نیست و فقط گرم شده.,3009241
37jgem,10,HAPPY,هم بی نهایت خوشمزه و گرم سر وقت ممنون از اسنپ فود,8106333
37jgem,2,SAD,"فیله استریپس افتضاح‌ بود گوشت سفت و مونده غیر قابل خوردن
سیب زمینی مونده واقعا بد بود",11539069
37jgem,10,HAPPY,بسیار عالی بود,3404465
37jgem,2,SAD,بدترین پیتزای زندگیم بود سرد و بیمزه و بی کیفیت ,5533534
37jgem,8,HAPPY,سفارش ناقص بود ، سس هالی و سالاد کلم نذاشته بودن .,7108049
37jgem,10,HAPPY,باورم نشد چقدر زود رسید پیک و داغ ترین غذایی بود که تا حالا با پیک برام اومده بود! کارتون درسته لذت بردم,3321518
37jgem,2,SAD,ساندویچ ساب استیک اصلا خوب نبود ، گوشت کاملا خشک و سوخته بود ، لطفا پیگیری کنید ما که نتونستیم بخوریم,3590410
37jgem,10,HAPPY,غذای مورد علاقه منه,2146264
37jgem,10,HAPPY,مثل همیشه بسیار خوشمزه، کاملا گرم و سریع به دستمون رسید. ,5468314
37jgem,2,SAD,وقتي يه چيز مينويسي تو توضيحات هيچ اهميتي نميده اين دفعه چندمه كه اين اتفاق ميوفته,1418231
37jgem,10,HAPPY,"عالی و خوشمزه 
اگر سیب زمینی طعمدار باشه میتونه خیلی به کیفیت غذاتون کمک کنه",4485845
37jgem,10,HAPPY,"کیفیت غذا عالی
خیلی زود هم تحویل داده شد ",6390171
37jgem,4,SAD,ظرف های سس کوچیک شده بود و قیمت پیتزا بیست هزار تومن گرونتر !!هه جالبه,9489152
37jgem,10,HAPPY,سلام .بسیار عالی و با کیفیت مثل همیشه,9159142
37jgem,8,HAPPY,به جای چیکن برگر، قارچ برگر ارسال شده بود,973053
37jgem,10,HAPPY,عالی و فوق العادهههههههه خسته نباشید,4488927
37jgem,2,SAD,متاسفانه کیفیت مرغ سوخاری فوق العاده پایین. سینه مرغ بزرگ و خام. سیب زمینی سرخ شده سفارش داده بودم باهاش پوره سیب زمینی امد که اونم افتضاح بود. بسته بندی بد. سس ها ریخته بود.,159725
37jgem,10,HAPPY,عالي بود,3322542
37jgem,8,HAPPY,سیب زمینیش کم بود و تو قسمت توضیحات درخواست شده توجه هی نکرده بودن,7430712
37jgem,8,HAPPY,متاسفانه پیتزا سرد بود. نکته هیجان انگیزش این بود که سیب زمینی با یه ظرف سس پنیر جداگانه سرو شده بود ,140159
37jgem,4,SAD,تجربه خرید اولم بود خیلی راضی نبودم هم سرد به دستم رسی با اینکه تاکید به داغ بودن پیتزا داشتم  هم اینکه خیلی مواد نداشت بیشتر سبزیجات داشت تا سوسیس و کالباس ,766480
37jgem,4,SAD,به جای چیکن برگر همبرگر ارسال شده بود.کیفیت چیکن کوردن بلو نسبت به دفعات قبلی افت کرده بود.,4293930
37jgem,2,SAD,"واقعااا بد بود. سیب زمینی چی داره که باید انقدر بد باشه؟! سیب زمینی بطور کامل دور ریخته شد چون بو و مزه ی خیلی بدی میداد.
پیتزا هم واقعا هیییچ مزه ای نمیداد!!",848424
37jgem,10,HAPPY,عالی بود,9915412
37jgem,10,HAPPY,بسیار عالی و لذیذ,9150311
37jgem,2,SAD,افتضاح بود ، هم مرغ مزه بدی داشت و هم داخل برگر ترکیبات مونده و نان هم که بیات بود ,5071164
37jgem,8,HAPPY,سفارش ام سریع حاضر شد و غذا داغ به دستم رسید. کیفیت غذا مثل همیشه خیلی خوب بود و چیزی که برام جدید بود سس هایی بود که فرستادین، هم خوشمزه بود هم مقدارش مناسب بود.بسته بندی هم که مثل همیشه عالی.,6956623
37jgem,2,SAD,در یک کلام افتضاااااااااااااااااح ,1247773
37jgem,0,SAD,"همیشه از باگت انتظار بالاتری رو دارم 
مرغ ها مزه بد و بوی بد میدادند لطفا خودتون امتحان کنید بعد ارسال کنید ",272750
37jgem,0,HAPPY,همه چیز فوق العاده بود ,323397
37jgem,10,HAPPY,عالی بود,8899033
37jgem,2,SAD,کیفیت بسیار پایین، نان سفت طعم بد ,3380366
37jgem,2,SAD,واقعا همراه سفارش باید نوشابه گرم گرم فرستاد؟ ,1289073
37jgem,10,HAPPY,عالیی بود,4208184
37jgem,10,HAPPY,عالی هستی,3902823
37jgem,10,HAPPY,مثل همیشه عالی وخوشمزه،ممنون,8899033
37jgem,2,SAD,با سلام.کیفیت گوشت استفاده شده در پیتزا فوق العاده پایین اومده بود.نسبت به قبل کاملا فرق داشت.خود پیتزا هم هیچ شباهتی به پیتزاهای دیپ دیش قبلیتون نداشت.خمیر ضخیم و خشک و مواد بسیار کم.پپرونی فقط ۲ تکه بسیار کوچک و نصفه روی ۲ تکه پیتزا بود.کیفیت بال سرخ کرده و سیر و پارمزان خوب بود.سیب زمینی اصلا خوشمزه و تازه نبود.ما فقط از باگت خرید میکنیم واقعا حیفه که کیفیتشو پایین بیارید.میتونید قیمتی رو روی غذاها بذارید که براتون بصرفه ولی از کیفیت غذاها کم نکنید.بهرحال کسی که از باگت غذا میگیره دنبال ارزونی مسلما نیست.با تشکر.,3378900
37jgem,10,HAPPY,خیلی عالی بود فقط مرغ سوخاری یکم سرد بود ولی کیفیت غذاش خیلی خوب بود.ممنون,6938186
37jgem,8,HAPPY,کیفیت خوبی داشت و به موقع به دستمان رسید,3053730
37jgem,2,SAD,سلام کیفیت غذا فوقالعاده پایین بود و سیب زمینی با سس قارچ هم تو منو سفارش دادم ولی تو ارسال نبود,3951506
37jgem,10,HAPPY,کیفیت مرغ ها و بال های سوخاری عالی بود ,5468314
37jgem,10,HAPPY,"همبرگر با قارچ که واقعا عالی بود . به عنوان یکی از علاقمندان همبرگر شگفت زده شدم!
پیتزا هم خیلی سبک و خوشمزه بود 
ساندویچ استیک هم خیلی خوشمزه و جذاب بود . 
از هر نظر عالی",2362830
37jgem,10,HAPPY,عالی,3934441
37jgem,10,HAPPY,عالی,3934441
37jgem,10,HAPPY,"خوب بود 
تشکر",4376765
37jgem,10,HAPPY,عااالیی بود,6097172
37jgem,10,HAPPY,عالی,279426
37jgem,10,HAPPY,خیلی خوب و عالی ، غذا زود رسید و مثل همیشه با کیفیت بود,7554089
37jgem,4,SAD,سرد شده بود,4914340
37jgem,10,HAPPY,خوب بود ولی کوردن بلو کمی بیشتر از حد برشته شده بود,2358408
37jgem,10,HAPPY,"عالي بود
فقط طعم سير نسبت به قبل كمتر شده همينطور سس مخصوص هم براي پيتزا ها كم ميذاريد ",7832659
37jgem,8,HAPPY,کیفیت غذا خوب بود، اما زمان ارسال مطابق با زمان درخواستی نبود !!!!,6018350
37jgem,10,HAPPY,عالی بود ..... خیلی خیلی راضی بودم .... ممنونممم,7651693
37jgem,4,SAD,سالاد کلم تحویل داده نشد. ,178928
37jgem,10,HAPPY,خوب بود ممنون ,2197316
37jgem,2,SAD,سفارشم رو بعد از نزدیک به دوساعت فرستادن غذا کاملا سرد و سس ها ریخته شده بود اصلا غذا کیغیت خوبی نداشت ,4204423
37jgem,8,HAPPY,غذا خیلی خوب بود ولی با دیدن مالیات یکم سورپرایز شدیم,3248267
37jgem,10,HAPPY,عالیییییییییی بود مرسی باگت ,3444058
37jgem,10,HAPPY,همه چيز عالي ,923129
37jgem,10,HAPPY,ساندویچ ها کیفیت بسیار خوبی داشتن،استیک خوب و با کیفیت،ممنون از کادر باگت به خاطر احترامشون به سلامت مردم,4621487
37jgem,10,HAPPY,پیتزا سیر و استیک عالی بود ممنون از شما,11149675
37jgem,10,HAPPY,عالي,9607381
37jgem,2,SAD,دیر رسید سفارش . ساندویچ رست بیف ارسال نشد . قارچ سوخاری سرد بود و سالاد بسیار شور بود . واقعا تجربه بدی بود و دیگه از باگت سفارش نمیدم ,7702584
37jgem,6,HAPPY,"به موقع که نرسید
ساعت ۲:۳۰ ثبت سفارش شد
تازه ساعت ۳:۳ دقیقه پشتیانی تماس گرفت که مشکل پیش اومده براشون
از اون تایم تازه از ساعت ۳:۷ دقیقه تایم انداخت که سفارش ثبت شده
قیمتی نسبت به کیفیت خیلی بالا بود
خیلی معمولی بود",9963446
37jgem,10,HAPPY,"چیکن برگر واقعا خیلی خوب بود
تشکر :)) ",11981602
37jgem,10,HAPPY,بسیار عالی :) ,11981602
37jgem,2,SAD,نودل خیلی بد بود، هم خودش سفت و خمیری بود و هم سس بدمزه و شیرین داشت که اصلا هم پرتقالی نبود، مرغ سوخاری خوب بود ولی همه تیکه ها رو سینه ی مرغ گذاشتن که این عجیب بود، نون سیر خوب و باکیفیت بود نون و پنیرش خیلی خوب بود اما طعم سیرش کم بود، بال با سس سیر خیلی خوب بود,11921766
37jgem,10,HAPPY,عالی,1273929
37jgem,6,HAPPY,"ما مشتری باگت هستیم و از کیفیت غذا همیشه راضی بودیم
دوتا نکته این بار بود یکی اینکه درخواست کرده بودیم که مرغ فقط ران باشه ولی تکه اصلی سینه بود و دیگر اینکه توی توضیحات و عکس مارگاریتا ریحان ایتالیایی درج شده که در سفارش تحویلی خبری از ریحان نبود
لطفا اگر رسپی تغییر کرده توضیحات رو هم تغییر دهید
سپاس",1496129
37jgem,4,SAD,۲۳ اسفند فیله ۶۱ بوده ۳۰ اسفند ۷۳؟!؟!؟!این چه مدل افزایش قیمته؟! مالیاتم که اضافه کردین !غذارم انقدر دیر آوردن که معلومه ته غذا بوده! سیب زمینی خشک و مونده، سس هالی که مخصوص این غذاست و نذاشته بودن و نوشابه رو مشکی آوردن که من فانتا سفارش داده بودم! من مشتری ثابت بودم ولی کاملا نا امید شدم!!! اصلا در حد این قیمت نیست!,3388082
37jgem,8,HAPPY,پیتزا و همبرگر خوب بود فقط موهیتو خیلی شیرین بود ,3652801
37jgem,10,HAPPY,مثل همیشه عالی فقط مشکل اینه که همیشه مقداری سس و مخلفات فراموش میشه لطفا پیگیری کنید,5559805
37jgem,10,HAPPY,بى نظير,6320518
37jgem,10,HAPPY,خسته نباشین,3435807
37jgem,10,HAPPY,"مثل همیشه عالی 
ممنون از باگت",1458063
37jgem,10,HAPPY,طعم وکیفیت عالی.فقط قیمت کمی بالاس,11697632
37jgem,10,HAPPY,مثل همیشه عالی,6035450
37jgem,10,HAPPY,عالی بود ,10632854
37jgem,10,HAPPY,كيفيت زمان تحویل مزه حجم عالي اميدوارم هميشه به همين صورت ياشه,12850605
37jgem,10,HAPPY,فقط میتونم بگم عالی بود,11791513
37jgem,6,HAPPY,"خيلي كوچيك بود ساندوبچ
سيب زميني هم ١٠ تا دونه گذاشته بود",4665785
37jgem,10,HAPPY,همیشه از کیفیت غذا راضی هستم. ,10733130
37jgem,10,HAPPY,باگت واقعا عالیه.. فقط مرغ سوخاری بیشتر طعم دار بشه بهتره...,281167
37jgem,8,HAPPY,"پوره سیب زمینی: فوق العاده خوش مزه!
چیکن برگر: مرغش خوشمزه بود اما کاش پر‌ملات تر بود یا کاهو بیشتری داشت.
سیب رمینی سرخ شده: مزه ی خیلی بدی داشت!",11641668
37jgem,10,HAPPY,يكي از بهترين سالادهايي كه تا حالا خوردم سالاد كينواست,5513911
37jgem,10,HAPPY,طعم، ترکیبات و مرغ گریل عالی بود. فقط حجم سس و آلبالوها رو کمی بیشترش کنید ,5513911
37jgem,10,HAPPY,عالی باکیفیت و گرون,11697632
37jgem,10,HAPPY,کیفیت نسبتا خوبی داشت,3005741
37jgem,10,HAPPY,خوب بود مثل همیشه,1762738
37jgem,4,SAD,خمیر پیتزا خیلیییی خشک بود و کاملا سرد سفارشم رسید همچنین با تاخیر.اصلا از باگت انتظار نداشتم,4256670
37jgem,10,HAPPY,مثل همیشه عالی,347593
37jgem,10,HAPPY,عالی مثل همیشه,726020
37jgem,10,HAPPY,"عالي 
كاش كارتون غذاها رو بزرگ بزاريد 
فيله ها و سيب زميني ها جاشون تنگه خمير ميشن تا برسه به دستمون ",3269461
37jgem,10,HAPPY,عالی، به موقع هم رسید,666264
37jgem,2,SAD,بخش سیر و استیک ۵ اسلایسش نه استیک داشت نه پنیر فقط نان بود، سس قارچ آبکی بود و چند عدد قارچ داشت، قارچ سوخاری معمولی بود,169276
37jgem,10,HAPPY,عالی بود,3830043
37jgem,10,HAPPY,مثل همیشه عالی ممنون,1478113
37jgem,6,HAPPY,کیفیت ساندویچ خوب بود ولی به توضیحات توجهی نشده بود ، پیتزا کیفیت پایینی داشت مخصوصا خمیر پیتزا ,4322158
37jgem,10,HAPPY,good,4370493
37jgem,10,HAPPY,مثل همیشه به موقع، گرم و خوشمزه ,5468314
37jgem,8,HAPPY,خوب,7374236
37jgem,10,HAPPY,مرغ سوخاری بسیار ترد و خوشمزه بود ,4855261
37jgem,8,HAPPY,سالاد کینوا حرف نداره حتما امتحان کنین واقعا محتویاتش خوشمزه و هماهنگه,1594985
37jgem,10,HAPPY,طعم مرغ سوخاری رو خیلی دوست داشتم فقط یکم بو میداد مرغ ,325210
37jgem,8,HAPPY,کوردن بلوها خیلی خوش حجیم و خوش کیفیت بودن.سس ها خوب بود،پیک هم خوب بود.,3850525
37jgem,10,HAPPY,باگت ازهرنظر عالیه ب نظر من سردم تحویل بدن خوشمزست,3533211
37jgem,10,HAPPY,خوب بود,7711094
37jgem,10,HAPPY,بهترین در تهرانپارس شمایید,1586433
37jgem,10,HAPPY,پیتزا داغ بود فقط خمیر این پیتزا سلیقه ای هست بعضیا دوس دارن بعضیام نه مثل نون تافتون میمونه سفتم هست ولی مواد روش خوب بود ,7399693
37jgem,10,HAPPY,"با سلام 
مثل همیشه عالی .سپاسگزارم",6170975
37jgem,10,HAPPY,همه چی عالی بود ممنون,3050833
37jgem,10,HAPPY,عالی بود ممنون,8592845
37jgem,10,HAPPY,مثل همیشه عالی,3559575
37jgem,10,HAPPY,عالی بود پیک مودب کیفیت بهترین,914330
37jgem,8,HAPPY,نسبت به همیشه کیفیت کمتری داشت و غذا سرد به دستمان رسید، پنیرهای روی پیتزا آب نشده بودند.,5672722
37jgem,10,HAPPY,پیتزا سیر و استیک عالیه ، فقط قیمتا خیلی خیلی بالاست ,7767164
37jgem,8,HAPPY,کیفیت غذا نسبت به قبل افت کرده اما همچنان نسبت به رقبا قابل قبوله,875256
37jgem,10,HAPPY,کیفیت و طعم سالاد عالیه,3407052
37jgem,6,HAPPY,غذا سرد بدست ما رسيد ,5532537
37jgem,8,HAPPY,خوب بود البته که کیفیت کمی پایین اومده,1594985
37jgem,6,HAPPY,بسته بندی مناسب بود ولی خوب سرخ نشده بودند سیبا,11311533
37jgem,10,HAPPY,پوره سیب زمینی هاشون عالیه ولی سوخاریشون معمولیه. در کل خوبه و راضی میشید از سفارش,187636
37jgem,10,HAPPY,باگت چون پیک داره خودش همیشه به موقع میاره و کیفیت غذا هم که حرف نداره,3637285
37jgem,10,HAPPY,هنوزم بی نظیری باگت جان (ساندویچ),3477321
37jgem,10,HAPPY,عالی,12799586
37jgem,6,HAPPY,کاملا سرد به دستمون رسید,1348663
37jgem,10,HAPPY,بسیارباکیفیت,793716
37jgem,4,SAD,پيتزا سرد و يخ زده بدست ما رسيد .,5532537
37jgem,10,HAPPY,مثل همیشه درجه یک,571687
37jgem,10,HAPPY,عالی بود،باگت واقعا خوبه,7181475
37jgem,0,HAPPY,سلام اگه گرم تر بود بهتر بود یکم سرد شده بود،ممنون از پیگیری شما,2144785
37jgem,2,SAD,"غذاها همه سرد
پنیر پیتزا ماسیده
کنتاکی یه تکه اش اسپایسی بود
",7233242
37jgem,10,HAPPY,عالیه,5193006
37jgem,4,SAD,غذا کامل سرد شده بود,1327535
37jgem,10,HAPPY,عالی بود و خیلی زودتر از زمانی که انتظار داشتم به دستم رسید,4741254
37jgem,8,HAPPY,به جز پیتزای پپرونی که اصلا کیفیت خوبی نداشت (خود پپرونی) بقیه خوب بودند,4758183
37jgem,10,HAPPY,بسیار عالی ، خوش طعم و به موقع رسید.,3744743
37jgem,2,SAD,خیلی بدمزه و کلا مرغها بو میداد و داخلش نپخته بود . کلا همه ش دور ریخته شد,472894
37jgem,10,HAPPY,عالی و خوشمزه,1000230
37jgem,10,HAPPY,مثل همیشه عالی خوشمزه و مواد تازه استفاده شده.,1000230
37jgem,10,HAPPY,فوق العاده .,3127704
37jgem,10,HAPPY,"خوشمزه و عالی 
ی کم گرم تر بود بهتر می‌بود ",2282351
37jgem,2,SAD,بعد از یک ساعت و ده دقیقه سفارش به دستم رسید که غذا کیفیتی بسیار پایین داشت,604308
37jgem,10,HAPPY,از هر جهت عالی,1597399
37jgem,10,HAPPY,مثل همیشه عالی,347593
37jgem,2,SAD,کیفیت مرغ سوخاری و سیب زمینی افتضاح بود‌.انگاری برای ۲ روز قبل بود.در ضمن هم مرغ سوخاری و سیب زمینی و هم پیتزا سرد بود.در کل افتضاح بود,5566290
37jgem,10,HAPPY,آخ جون بالاخره این پیتزا مارگاریتا روستیک دوباره موجود شد، عالی بود! برگر هم خوشمزه و با کیفیت بود، سالاد هم تازه و تمیز بود,156739
37jgem,10,HAPPY,هر دو پیتزا مثل همیشه ، تازه ، لذیذ و داغ بودند ولی درمورد پیتزای کمبو دیپ دیش ، نان دور آن از دفعات قبلی ضخیم تر و بلند تر بود .,2362737
37jgem,8,HAPPY,"سيب زميني با سس قارچ افتضاح بود البته سس قارچش
چون اصلا خامه نداشت قارچ بود با شير كه به ترشي ميزد
ما سيب رو كامل ريختيم دور",1240271
37jgem,10,HAPPY,عالی,8132007
37jgem,10,HAPPY,آب پرتقال بسیار تازه بود ، فقط کیفیت استیک مثل همیشه نبود باگت جان ,3477321
37jgem,10,HAPPY,عالییی بود,809469
37jgem,4,SAD,برگر خام بود.مغز گوشت کامل قرمز و نپخته بود.نوشیدنی هم به جای دلستر اسپرایت تحویل دادن!,3663166
37jgem,10,HAPPY,"فقط كمي سرد بود
ولي كيفيت عالي ",898452
37jgem,10,HAPPY,عالی مثل همیشه,5331051
37jgem,10,HAPPY,خیلی زودتر از تایمی که اسنپ زده بود به دستم رسید و کاملا ساندویچ ها گرم بود، ممنون از باگت ,9117020
37jgem,2,SAD,غذا خیلی بد بود بال خوب سرخ نشده بود سس هم اصلا خوب نبود,1500317
37jgem,10,HAPPY,"مثل همیشه عالی
و به توضیحاتم توجه میشه ممنونم",1665068
37jgem,10,HAPPY,هر سه عالی بود فقط نون پیتزا سلیقه ای هست شاید کسی خوشش نیاد چون نون عادی پیتزا نیست,228035
37jgem,2,SAD,غذا ب صورت كاملا سرد تحويل شد قارچ ها نرم شده بودن و سوخاري نداشتن و پيتزا بي كيفيت حيف پولي ك بابت اين غذا پرداخت شد باتوجه ب قيمت بالاي پيتزا ي باگت انتظار مي رفت براي مشتري ارزش قائل باشه و كيفيت غذاش اينقدر بد و افتضاح نباشه,836325
37jgem,0,SAD,حجم غذا فوق العاده کم ,1059567
37jgem,8,HAPPY,بسیار خوب,178066
37jgem,10,HAPPY,"نحوه ارسال خیلی خوب بود، به دستم رسید کاملا داغ بود و پنیرش کش میومدبهترین پپرونی ایرانه
سالاد کلم کاش یکم حجمش بیشتر باشه",517177
37jgem,6,HAPPY,سفارش من پیتزا سیرواستیک و بوقلمون خانواده بود ،ک به صورت نصف نصف بود از هرکدوم. قسمت سیر و استیک بسیاز لذید خوشمزه بود ولی متاسفانه قسمت بوقلمون به شدت بوی زُحم میداد جوری ک مستقیم رفت تو سطل زباله ,6923798
37jgem,8,HAPPY,بسیار عالی ,3016752
37jgem,4,SAD,"من مشتری ثابت این پیتزا بودم ولی برای اولین بار دیدم حجم گوشت غذا بشدت اومده بود پایین و اون هم درست نپخته بود و مزه دار نشدا بود و جالبه که قسمتی از پیتزا فقط ندن خالی بود و حتی پنیر پیتزا هم نداشت!
واقعا متاسفم که با این قیمت همچین کاری رو تحویل مشتری میدن!!",1327305
37jgem,4,SAD,"خمیر پیتزا بسیار کلفت بود گوشت استیک هم کمی سفت بود.
مرغ سوخاری هم ۲تیکه خواسته بودم و تاکید کرده بودم هردو‌ رون باشه که متاسفانه یکیش سینه بود و همونجوری انداختیم دور.سیب زمینی هم مونده بود
من مشتری ثابت باگت هستم اما اینبار واقعا همه چی بد بود",961968
37jgem,10,HAPPY,برای بار چندم هست که سفارش میدم و واقعا عالیهممنون از کیفیت خوب غذاهاتون,6938186
37jgem,10,HAPPY,بسيار عالى,4548532
37jgem,10,HAPPY,عالی بودن هم کیفیت هم حجم غذا ,3911125
37jgem,10,HAPPY,بی نقص بود,3488932
37jgem,10,HAPPY,همه چیز خیلی خوب بود . موهیتو واقعا عالی بود و از طعمش لذت بردیم.,6743163
37jgem,2,SAD,خیلی معمولی و خیلی گرون بیخود,4554153
37jgem,10,HAPPY,همه چی خوب ولی همبرگر بوی بد گوشت میداد و یه طرفش سوخته بود! چجوری میتونید بعضی وقتا انقد افتضاح باشید. ولی درکل باز غذاهاتون رو دوست دارم لطفا کنترل رو کیفیت تون داشته باشید.,5645099
37jgem,2,SAD,"ميتونم بگم افتضاح بود ! من سال هاست عاشق چيكن برگرهاي باگتم و اين بار فقط و فقط طعم و مزه و بوي روغن جامد مونده و كهنه رو حس كردم و بس ! 
",6460522
37jgem,10,HAPPY,بهترین خوردنی که اسم پیتزا روش هست در تهران,3541501
37jgem,8,HAPPY,پیتزا بوقلمون نوشته بود گوشت پروسس شده ولی گوشت معمولی بوقلمون بود که بو‌ میداد ,440201
37jgem,10,HAPPY,بینظیرترین ساندویچ عمرم بوددد ,208984
37jgem,8,HAPPY,برگر و ساندویچ خیلی خوب بود. ولی نودل آنقدر خمیر شده بود و سسش بدمزه بود که تماما دور ریخته شد.,319270
37jgem,10,HAPPY,واقعا عالی بود راحت ۴نفر با پیتزا خانواده سیر میشوند کیفیت پیتزا هم خیلی خوب بود ..,1524329
37jgem,8,HAPPY,پیتزا مرغ دودی طعم خاص و عجیبی داشت ولی کیفیت غذا خوب بود,5645099
37jgem,10,HAPPY,هر چی از خوبیات بگم کم گفتم ,3477321
