restaurant_code,rating,feeling,commentText,customerId
3271je,2,SAD,"غذا اصلا کیفیت نداشت 
دورچین غذا به بدترین شکل ممکن بد مزه بود 
سبزیجات کنار غذا اصلا معلوم نبود چیه !!
نقطه قوتش بسته بندیش بود که الان یه رستوران معمولی هم این بسته بندی رو داره 
گوشت خیلی سفت بود،حدودا مثل لاستیک بود اصلا جویده نمیشد
در کل افتضاح بود
",6911245
3271je,2,SAD,بعد از دو ساعت غذا تحویل داده شد! تازه چیکن استراگانوف مزه زردچوبه میداد تا هر طعم دیگه ای...,1184419
3271je,2,SAD,تحويل سالاد دقيقا دو ساعت طول كشيد. از ساعت ١٨:١٠ تا ٢٠:١٠,688364
3271je,10,HAPPY,عالی فقط مقدار مرغش خیلی کم بود,4972312
3271je,10,HAPPY,۲:۳۰ بعد از سفارش رسید ,999144
3271je,6,HAPPY,کاهوش خیلی زیاد بود ,1507891
3271je,10,HAPPY,عالی,1914752
3271je,6,HAPPY,سس همراه سالاد خیلی شیرین بود و مزه سالاد رو خراب کرد.,350475
3271je,6,HAPPY,"بالاترین قیمت برای یک محصول غذایی باید بالاترین کیفیت رو داشته باشته باشه.
دو سوم فقط کاهو بود . 
من این حجم سالاد با دو برابر مرغ گریل رو با 25 الی 30 تومن خرید کردم! قیمت به نسبت کیفیت پایین بود! ",2402565
3271je,2,SAD,خیلی بد بود,7919639
3271je,10,HAPPY,بسیار خوشمزه و عالی ,1489931
3271je,8,HAPPY,تجربه خریدهای قبلیم از فرش باکس بهتر بود,806458
3271je,8,HAPPY,جالب بود و خوشمزه,8678788
3271je,10,HAPPY,عالي بود,1548071
3271je,2,SAD,ما همیشه کمبو سفارش میدادیم حجم پاستا دونفره و ظرف غذا پر بود ولی اینبار یک نفره بود حجم پاستا,5225139
3271je,10,HAPPY,عااالی بود خیلی خوشمزه بود و به موقع رسید واقعا ممنون از شماااا بهترینید,5006925
3271je,2,SAD,سفارش به دست من نرسید,1141803
3271je,10,HAPPY,خیلی خوشمزه بود ,8927993
3271je,6,HAPPY,کلا تجربه جدیدی نبود و معمولی البته ک تر و تمیز بود و خیلی معطل نشدم بابت تحویل گرفتنش و در نتیجه مجددا تست میکنم مدل های دیگه رو حجم مرغ کم اما سس خوشمزه ولی حجم سس کم . فکر میکنم کسایی ک این مدل غذاها رو سفارش میدن قطعا در محل کار یا هرجایی غیر از خونه مبخوان میل کنن در نتیجه برش کاهو ها باید طوری باش ک قابل خوردن باشه مثل برش سالاد کاهویی ک داخل منزل می‌زنیم ,180018
3271je,10,HAPPY,"واقعا عالیه کیفیتو نگه دارید
من بار ۴م یا ۵م هست که میخرم",4403609
3271je,4,SAD,به نظرم بهتره لابه لای اسفناج ها پنیر و سایر مواد باشه، نه اینکه یه ظرف پر اسفناج باشه با چهار تیکه میوه و پنیر روش ,2270456
3271je,4,SAD,"پاستا شور بود وقابل خوردن نبود، چرا نبايد طعم غذارو تست كنيد و بعد ارسال كنين!؟!
استيك بد نبود، متاسفانه دورچين استيك تازه نبود و تيكه اى درشت فلفل سياه آسياب نشده زير دندون ميومد!!!",855516
3271je,10,HAPPY,مواد اولیه مرغوب,2759131
3271je,6,HAPPY,شربت بسیار بو و طعم بدی داشت و کاملا معلوم بود که چندین روز است مانده و خراب بود ، سبزیجات هم خیلی خیلی زیاد تند بود,832230
3271je,10,HAPPY,مشما ارسالی پاره شده بود و پک چنگال نداشت,4719073
3271je,6,HAPPY,اسفناج بسيار درشت و نامرتب بود به نظرم از بى بى اسفناج استفاده ميشد بهتر بود.ريحون تمام ساقه هاى زخيمش بود و سبزيجات در كنار مرغ گريل شده بود چون طعم مرغ ميداد,1459017
3271je,10,HAPPY,من مشتری ثابت این رستوران هستم غذاها خیلی خوشمزه فقط پیکش یا دیر میاره یا اشتباه می‌کنه. سالاد امروز هم عالی بود,1154837
3271je,8,HAPPY,به شدت مقدار مرغ کم شده نسبت به همیشه : ,5210625
3271je,2,SAD,"واقعا فاجعه بود. فاجعه‌ی به تمام معنا.
در حد یک لقمه خوردم از غذا!
استیک گوشتش فقط با چوب قابل مقایسه‌س
استیک مرغ شدیدا بدمزه بود. نمی‌دونم چه ایرادی داشت مرغش و احتمالا از قبل طبخ ایرادی داشته.
واقعا فاجعه بود. غذاها. فاجعه
من ابدا از هزینه‌ و وقتی که بابت این سفارش از دست دادم راضی نیستم",181647
3271je,8,HAPPY,بار  چندمه  سفارش  میدم  در  کل  کیفیت و  حجم  غذا  خوبه ، فقط نمک خیلی  زیاد  میریزید  توی  غذا  واقعا  رست  بیف  شور  بود چیکن  استراگانف  هم  همینطور ولی کمتر بنظرم  واقعا  نیازی  نیست  اینقدر نمک  غذا  زیاد باشه. سیب زمینی  هام  گاهی نرم  میرسه  که  ترد باشه  بهتره,5424601
3271je,4,SAD,حجم بسیار بسیار کم سبزیجات روی کاهو به نسبت کاهوی خیلی زیاد! ,271863
3271je,6,HAPPY,تو‌توضیحات درخواست کردم جایه سس سزار سس یونانی ارسال کنن ولی متاسفانه هیچ توجهی نکردن,4719073
3271je,8,HAPPY,بشقاب سبزیجاتش خوشمزه بود اما کاش به جای ترشی فلفل ،بادمجون بود,7928410
3271je,10,HAPPY,غذا بینظیر بود عالی عالی عالی...... ولی سس پاستا با اینکه هزینه اش رو پرداخت کرده بودم ولی قرار نداده بودین تو بسته ارسال شده,9020509
3271je,8,HAPPY,سیب زمینی حجم زیاد و قابل قبولی داشت .پاستا هم حجم زیادی داشت می‌تونست خوشمزه تر باشه.ولی قابل قبول,764802
3271je,4,SAD,به جز پایتا بقیش افتضاح بود   ۱۳۰ تومن گرفتین یه ظرف کاهو دادید با دقیقا ۳ تا دونه میگو   اخرین باری بود که از اینجا گرفتم,10803989
3271je,6,HAPPY,روی اسفناجا تا نصفه آبلیمو ریخته بودن که روی بقیه قسمتا هم ریخته بود,766486
3271je,6,HAPPY,پوره بسیار چرب بود مثل همیشه نبود  ته ظرف خیلی چرب بود متاسفانه راضی نبودم ,1767878
3271je,10,HAPPY,خوب بود واقعا,2056677
3271je,4,SAD,من هر بار امتیاز کامل می دادم و خیلی راضی بودم ولی این بار سیب زمینی ها که خیلی بد و مونده بودن ، ساندویچ هم اصلا تعریفی نداشت، فقط استیک مرغ مثل همیشه عالی بود، امیدوارم رسیدگی کنین و مجددا کیفیت عالی را در همه چیز داشته باشین.,2398053
3271je,10,HAPPY,بسیار عالی ممنون از فرش باکس بشقاب سبزیجات عالی غذای هر شب من شده,1865794
3271je,6,HAPPY,متاسفانه طعم‌ مرغ گریل شده برعکس دفعات قبلی که سالاد را گرفته بودم ، خوب نبود,9402597
3271je,10,HAPPY,خیلی عالی بودن,3061318
3271je,10,HAPPY,عالی برای ۴نفر همراه با غذا,4117085
3271je,10,HAPPY,همه چیز عالی فقط پاکت مناسب نیست نوشابه ها پاکت پاره میکنن!,4388859
3271je,4,SAD,پاستا بوى نا مطبوعى ميداد,739480
3271je,10,HAPPY,"عالی بود 
۱. سینه مرغ گریل شده خوش طعم و به اندازه گریل شده بود
۲. سس همراه سالاد خیلی خوشمزه بود
۳.ترکیبات سالاد هم خوب و از مواد تازه درست شده بود",9402597
3271je,8,HAPPY,سبزیجاتش اینبار خوب طعم دار نشده بود و اندکی نسبت قبل خام بود,578252
3271je,10,HAPPY,"انصافاً خيلي خوب بود
٢ تا نكته
١ - دعا كنيد كه هميشه همينطور بمونه با همين كيفيت
٢ - حتما سفارش من رو امتحان كنيد",858609
3271je,8,HAPPY,عالی بود فقط یکم تند بود ,9444156
3271je,6,HAPPY,خيلي سس غذا زياد بود ,3593620
3271je,8,HAPPY,تازه و خوشمزه ,7461553
3271je,0,HAPPY,سیب زمینی - سالاد - سوسیس کاری خیلییی  خوشمزه و با کیفیت- مرسی فرش باکس :),3388957
3271je,10,HAPPY,بسیار خوشمزه و با کیفیت بود. ,808474
3271je,10,HAPPY,خوب و خوشمزه ولی خب سبزیجات در کره سرخ شده بودند. قارچها هم آبلیمو داشت که رنگش عوض نشه که یکم زیادی ترش بود. و در نهایت خیلی عالی.,279675
3271je,2,SAD,فکر میکنم بار دهمی باشه که همین محصول رو میخرم و دقیقا هر بار کیفتش بدتر از بار قبلی میشه، قطعا خرید آخرمه,7710677
3271je,10,HAPPY,عالي,2062569
3271je,10,HAPPY, کیفیت سالادها خوب بود و اندازه سالاد ها بسیار‌ مناسب بود،فقط تنها اشکال آن این بود که کاهو ها را قاچ نکرده بودند خیلی و خودمان موقع خوردن باید یه برش ریز می دادیم ولی در کل همه موارد خوب بود..,957482
3271je,10,HAPPY,بسیار خوشمزه و لذت بخش.,319688
3271je,10,HAPPY,بسیار عالی ، خوشمزه ، مواد اولیه بسیار خوب و تازه ، ممنونم ، مقدار غذا زیاد و خوب ، از سر آسپز تشکر کنین لطفا، موفق باشین,1287493
3271je,6,HAPPY,غذاهارا همیشه در پاکت کاغذی میگذاشتند امروز در پلاستیک! سس ها خوب بسته بندی نشده بود. یکی از سس ها کامل پر نبود. سالاد چاینیز تقریبا همش کاهو بود. شربت خاکشیر بیش از حد شیرین بود.,10658894
3271je,6,HAPPY,به مزش نمی ارزید از دید من بیشتر مرغ گریلتون خوشمزست,4002473
3271je,8,HAPPY,من چندانی غذا گرفتم بسیار عللی بود,4863330
3271je,10,HAPPY,خیلی خوشمزه بود,371935
3271je,8,HAPPY,متاسفانه بیف استراگانوف یکمی شور بود ولی در کل همه چیز عالی بود متشکرم ,3879109
3271je,2,SAD,واقعن سالاد ها خیلی بی کیفیت و کم بود. سس هم خیلی رقیق و بی کیفیت,1607219
3271je,8,HAPPY,سوپ خوشمزه و داغ بود، سالاد مثل همیشه عالی، اما کارد و چنگال رو نداده بودن,326327
3271je,2,SAD,"به نظرم سیب زمینی اصلا تازه نبود،
",3675008
3271je,6,HAPPY,برخلاف دفعات قبل که عالی بود اینبار بسیااااار تند بود . ,3018826
3271je,2,SAD,"واقعا بد مزه بود
سالاد پاستا که فقط ادویه بود
سوپ هم پر سبزی بود مزه اش میداد مواد داخلش خیلی بد سلیقه خرد شده بود 
اصلا جالب نبود",9795476
3271je,6,HAPPY,سس سالاد خيلي شيرين بود,10251186
3271je,0,SAD,بسیار بی مزه بود. پاستاها هم سفت بودند.,408330
3271je,2,SAD,سلام، درسته که به علت گرونا و کاهش مشتری رستوران ها تحت فشار هستند ولی بنظر من به جای استفاده از مواد مونده و بی گیفیت، میتوانند برای کنترل ریسک و دورریز خود تعداد محصولات را کاهش دهند، آووکادو مونده، سیبزمینی سرخ شده مثل سنگ، دیتاکس تلخ شده، ماست خیار مونده شده، حقیقتا راضی نبودیم..,2766787
3271je,8,HAPPY,من قبل از کرونا تایم آخرین بار از شما سالاد تهیه کرده بودم و سس ظاهرا عوض شده، شخصا سس قبلی رو بیشتر دوست داشتم، در هر صورت هنوز هم به نظرم یکی از مناسب ترین سالاد بارهای منطقه هستید,561260
3271je,0,HAPPY,"ضمن عرض سلام و خسته نباشی . 
من ساعت قید کرده بودم و خواسته بودم گرم بدستم برسه . خب اولین سفارشم بود از این رستوران و شناختی نداشتم . اما خیلی زود بدستم رسید ولی گرم ، مرتب ، تمیز و با پیکی محترم . 
ممنون از شما 
",10131602
3271je,6,HAPPY,بسته بندی خوب بود. سرد رسید. بوی دودش خیلی تو ذوق میزد کاش در فر گریل شده بود. نان اصلا همراهش نبود. نصف نان بروتون همراه سوسیس بود فقط. من درخواست نان داده بودم که توجهی نشده بود. گزینه اضافه نان هم ندیدم.سس قارچ خوشمزه بود. سبزیجات معمولی.چیپس سرد و بخار زده. بهرحال برای یکبار تجربه کافی بود,141471
3271je,10,HAPPY,کیفت و تازگی مواد اولیه کاملا مشهوده و از طرفی حجم سالاد به عنوان یک وعده غذایی مناسب و حتی زیاد  هست، یکی از بهترین خرید هام از اسنپ فود  بود. ممنون از مدیریت خوب مجموعه,7710677
3271je,6,HAPPY,متاسفانه حجم مرغ سالاد به نسبت قبل خیلی کم شده است,723848
3271je,8,HAPPY,سلام ودرود.  خیلی خوب بود. سپاس,7955547
3271je,10,HAPPY,عالی بود خدا قوت ,1544925
3271je,0,HAPPY,بشدت راضی کننده بود. مرسی,4390317
3271je,8,HAPPY,خوب بود ولی نان کنجدی نداشت اگه تو سالادتون نیست خوب ننویسید جز مواد,12301961
3271je,2,SAD,"افتضاح بعد ۱:۱۵ دقیقه سرد ماستیده
گفتن موتور پنچر کرده یک تازه میفرستن ولی همون ماستیده فرستاده
نوشته بیبی اسفناج ولی اسفناج داغون خیلی بزرگ افتضاح فرستاد
خیلی افتضاح خیلی افتضاح",5317581
3271je,6,HAPPY,مثل همیشه همه چی عالی بود فقط متاسفانه برای اولین بار مرغ سالادم خام بود,1141651
3271je,10,HAPPY,"همه چیز فوق العاده خوشمزه و باکیفیت
فقط فکر میکنم که حجم مرغ مناسب یک نفر هست نه دو نفر",2240219
3271je,10,HAPPY,بشقاب سبزیجات همیشه خیلی خوب بود، امروز با هدیه یلدا بهتر هم شد ,3397112
3271je,8,HAPPY,سس سبز رو نفرستاده بودن ولی اشکالی نداره,3550620
3271je,8,HAPPY,مقدار مرغ وسس‌خیلی کم بود,4491878
3271je,8,HAPPY,مرغ گریل خوش طعم بود، ,6461206
3271je,4,SAD,ماهی خورد شده بود و همه چیز سرد بود ,3785237
3271je,10,HAPPY,غذا بسيار لذيذ و خوشمزه بود سألاد متريال تازه و خوبي داشت سيب زميني سره شده كمي شور بود كه بهتر است به جهت حفظ سلامتي مشتريان از نمك كمتري استفاده شود ,4388722
3271je,10,HAPPY,موهیتو نرسید ب دست بنده,6876336
3271je,8,HAPPY,سس پاستا افتضاح بود,8431190
3271je,10,HAPPY,بسیار عالی  ,4003139
3271je,0,HAPPY,یکم حجم غذا کم شده هم پوره و هم اسفناجش کم بود,3643066
3271je,10,HAPPY,سیب زمینی کم روغن، زیاد و خیلی خوش طعم بود. بشقاب سبزیجات هم کاملا شکل عکس و عالی و لذیذ بود. فقط اگر کم روغن تر هم باشد که عالی تر است.,4686245
3271je,8,HAPPY,کاش کلم نداشت!,3638675
3271je,8,HAPPY,خوب‌‌‌ولی استیک‌مرغ شور بود,2913736
3271je,8,HAPPY,یه سس دیگه ارسال شده بود ک سس سزار نبود ولی خوشمزه بود. کارد و چنگال هم فراموش کرده بودن. درمجموع دقت بفرمایییییییید لطفا. مرسی,2679070
3271je,4,SAD,زیاد جالب نبود . پاستا که سس آلفردو از کنارش رد شده بود . ساندویچ استیکش هم بیشتر از گوشت توش فلفل دلمه داشت,3800308
3271je,10,HAPPY,عالی,3552561
3271je,8,HAPPY,"سلام،
یک امتیاز بخاطر بی توجهی به توضیحات کم شد.",2035990
3271je,0,HAPPY,"ماهی و دورچین عالیه 
حجمش هم زیاده 
سیب زمینی هم عالی بود",3643066
3271je,8,HAPPY,پاستاها بسیار خوشمزه بودن ولی دفعه ی قبلی که گرفتیم میگوهای بیشتری داشت. این بار ۳،۴ تا میگوی خیلی کوچیک داشت. ولی در کل بسیار خوشمزه بود. ممنون,3456767
3271je,10,HAPPY,"عالییی بعد از مدتها از همه چیز راضی بودم. 
ترکیب سبزیجات کامل و عالی بود و غذا به موقع و گرم رسید. 
امشب از خوردن شام نه تنها عذاب وجدان نداشتم حسابی لذت بردم غذایی سالم بود ",4062521
3271je,4,SAD,سستون نسبت به حجم سالاد خیلی کمه و وقتی تموم بشه بقیه سالاد رو نمیشه خورد و نصفش میمونه، پیک هم که خیلی دیر آورد. در کل سالادتون خوبه ولی سس رو بیشتر کنید لطفا چون فقط روی سالاد رو میگیره,7664923
3271je,8,HAPPY,"بطور کلی خوب بود ..اما هویج  تازه  نبود.
کاهو هم  اگر با ظرافت بیشتر  خورد بشه  بهتر..وجود بخش سفت  کاهو لازم  نیست ",6890670
3271je,6,HAPPY,كاش تو خورد كردن كاهوها كمي سليقه و دقت به خرج بدين ,910253
3271je,2,SAD,کیفیت این سالاد قبلا مطلوب بود ولی دو دفعه اخری که من سفارش دادم واقعا کیفیت پایین اومده ,1393939
3271je,10,HAPPY,"سالاد عالی و طعم سس ها بی نظیر بود
فقط من متوجه نشدم ۶۰۰ کالری با سس یا بدون سس؟",4992975
3271je,4,SAD,غذاها برخلاف همیشه به شدت شور بودند تا جایی که سیب زمینی کنار ساندویچ اصلا قابل خوردن نبود و گوشت و مرغ و پوره سیب زمینی و سس قارچ هم خیلی نمک داشتند ولی حجم و کیفیت مثل سابق خوب بود.,1421799
3271je,8,HAPPY,سس همراه سالاد نبود,1416837
3271je,10,HAPPY," فقط اگه تیغ ماهی کامل دراومده بود، همه چی عالی بود.
متشکرم ",8473361
3271je,6,HAPPY,سیزیجات دورچین به شدددت شور بود,3172572
3271je,4,SAD,"عالي بود فقط حجم غذا نسبت به قيمت كم بود
ممنون",8026882
3271je,2,SAD,بسیار شور و ادویه نامناسب و زیاد,3432971
3271je,10,HAPPY,خیلی خوب بود همه چیز. خیلی ممنون,730966
3271je,10,HAPPY,مرغش كم بود,4131381
3271je,4,SAD,"ساندویچ رست ‌‌و سوپ خیلی خوب بود ولی سالاد کینوا افتضاح بود واقعا 
حبوبات نپخته وحجم بالای کاهو ‌وبی کیفیت ترین میگو که بیشتر از میگو ،مایه سوخاری داخلش  قرارداده بودند",4545368
3271je,0,HAPPY,"عالی عالی عالی 
 باید امتحان کرد
همه اش عالی بود",3643066
3271je,8,HAPPY,همرا سالاد وجی کینوا سس نبود متاسفانه,4117085
3271je,10,HAPPY,خوشمزه بود,6713104
3271je,10,HAPPY,بی‌نظیر‌مثل همیشه ,9603695
3271je,8,HAPPY,"مواد با کیفیت و تازه
بسته بندی خوب
سس های بسیار بد
ترکیب مواد بد مزه",1016682
3271je,10,HAPPY,عالی ، هم کیفیت غذا خوب بود و هم حجمش زیاد ,260832
3271je,8,HAPPY,پوره سیب زمینی جا داره که بهتر باشه ,3641060
3271je,6,HAPPY,تصویر قبل از سفارش با سفارش دریافتی زمین تا آسمان تفاوت داشت,161433
3271je,4,SAD,سوپ بسیار بد مزه… ساندویچ هم خوب نبود,3039250
3271je,2,SAD,من شربت خاکشیر سفارش دادم،اما برای من شربت تخم شربتی و خاکشیر فرستادن...واقعا نمیدونم انقدر سخته...,7720156
3271je,2,SAD,"غذا بعد از حدود دو ساعت رسید
سرد و بی کیفیت بود. ",4478632
3271je,10,HAPPY,"بله از سالاد واستیک راضی بودم اما به نسبت استیک مرغ،سس قارچ فلفل بسیار زیادی داشت 
در کل که خوشمزه و دلچسب بود ",7269245
3271je,10,HAPPY,فوق العاده بود. بسیار خوشمزه، تمیز و بسته بندی بسیار شیک. بینهایت ممنونم ,6037303
3271je,10,HAPPY,"از نظر کیفیت عالی ولی قیمت خدایی بالا بود
و سوال از مدیریت محترم اسم سس چی هست؟",4318317
3271je,10,HAPPY,این رستوران از سبزیجات تازه استفاده میکنه و اینو میشه از طعم غذاهاش فهمید,7361385
3271je,4,SAD,"سلام
همیشه از فرش باکس راضی بودم ولی سفارش امشبم سالاد اسفناج خیلی بد بود..در واقع با اون توضیحاتی که داده بودن تو پیج فرق داشت..فقط اسفناج بود..وچند تا تیگه پنیر..",5307131
3271je,10,HAPPY,"کیفیت و طمع بسیار عالی
",2339999
3271je,8,HAPPY,توی توضیحات عرض کرده بودم بدون پنیر باشه ولی توجه‌ای نشده بود,4480658
3271je,10,HAPPY,خیلی خوب بود,1310381
3271je,0,SAD,برخلاف همیشه چندین بار است کاهو در سالادها کهنه و تغییر رنگ یافته است!!,1304031
3271je,8,HAPPY,طعم سس رو به علت اینکه خیلی تیز بود و مزه‌ی سرکه می‌داد زیاد دوست نداشتم، ولی مواد تشکیل دهنده‌ی سالاد عالی و با کیفیت بود,326327
3271je,0,HAPPY,عالی بود. مرسی,4514025
3271je,4,SAD,"سرد بود
یه غذای کاملا معمولی",1532375
3271je,6,HAPPY,"مرغ گریل شده متاسفانه خیلی خیلی بوی ضحم می‌داد متاسفانه.

آووکادو هم در سالاد مشاهده نشد.",759282
3271je,10,HAPPY,"همه چیز خوب
فقط در مشخصات باید یادداشت شود که کمی تند
من مقداری حساسیت به فلفل دارم و باید حتما بعدش دارو استفاده کنم
اگر بشه بدون فلفل آماده بشه خیلی عالیه",3572794
3271je,6,HAPPY,"در  ظرف نیمه باز بود،اصلا این بسته بندی سالم نیست
",318636
3271je,2,SAD,پاستا خيلي بوي بدي ميداد و اصلا نخورديم و بيرون انداختيم خيلي بو ميداد ,7602498
3271je,10,HAPPY,"فرش باکس عزیزم
امشب 
از شما برای شام به همراه خانواده سفارش دادم.
همه راضی بودن و خیلی لذت بردن 
از طعم، عطر و مزه غذا.

یکی از نکات مهم رستوران شما سرعت عمل در ارسال هست.
باز هم امشب تکرار شد.
معمولا من سفارش غذای مطب رو به شما میدم.

به‌هر ترتیب از همه چی ممنون.
برکت باشه براتون",7908082
3271je,0,HAPPY,"خوب بود، مقدارش هم مناسب بود
",160647
3271je,10,HAPPY,لطفا سس سالاد و زيادتر بزاريد براي اين مقدار سالاد كم همه چيز عالي ,8774579
3271je,10,HAPPY,"واقعا مثل همیشه عالی
با کیفیت، بهداشتی، کامل",264484
3271je,6,HAPPY,پاستا از نظر کیفیت مواد اولیه و حجم خوب بود ولی طعم سس مارینارا رو دوست نداشتم، اصلا تند نبود و خیلی آبکی بود، ضمنا پنیر پارمژان هم نداشت,4838393
3271je,10,HAPPY,مثل همیشه عالی ,3266084
3271je,10,HAPPY,عالى,4249061
3271je,10,HAPPY,عالییی,1421799
3271je,10,HAPPY,اشتباه فرستاده بودید،به جای وجی کینوا ،چیکن کینوا فرستاده بودید...عالی بود,6070921
3271je,10,HAPPY,به جای سس بادام زمینی سس بالزامیک ارسال شده بود با سالاد. من سس بادام زمینی رو بیشتر دوست داشتم.,1393939
3271je,8,HAPPY,دوتا سس خریدم یکی ارسال شد,1136219
