restaurant_code,rating,feeling,commentText,customerId
p5d5v0,6,HAPPY,حجم اسفناج  بالا بود در حدی که انگار قرمه سبزی روی پیتزا ریختن ,3156264
p5d5v0,10,HAPPY,مثل همیشه عالی ,308471
p5d5v0,8,HAPPY,کمی کیفیت استریپس ها پایین اومده,526704
p5d5v0,4,SAD,توش غضروف میومد زیر دندون,812960
p5d5v0,10,HAPPY,مثل همیشه عالی وبدون نقض سپاس از مدیریت ,7905446
p5d5v0,10,HAPPY,"مثل همیشه عالی
همشون خیلی خوب بودن",10518026
p5d5v0,8,HAPPY,"خوب بودن، اوفول و حالا رشد شیلا رو به چشم دیدم...
هات داگ خوب بود...
نان سیر هم طعم سیر خوبی می‌داد...",144194
p5d5v0,10,HAPPY,عالی. حتما امتحان کنین. همیشه خیلی سریع و گرم و با کیفیت ارسال میشه. ممنون از شیلا,5324355
p5d5v0,10,HAPPY,بسیار خوش طعم و منظم,5496008
p5d5v0,10,HAPPY,عالی بود ,320068
p5d5v0,2,SAD,سيب زميني كم بود,5035133
p5d5v0,10,HAPPY,عاااااااااااااااااالی,8228196
p5d5v0,2,SAD,اصلا خوب نبود و اشتباه کردم از رو نظرات سفارش دادم,11373869
p5d5v0,10,HAPPY,عاالی,320068
p5d5v0,10,HAPPY,ممنون از ارسال به موقع,7145611
p5d5v0,10,HAPPY,خوشمزه اس اما گرونه,3682151
p5d5v0,0,HAPPY,کیفیت خیلی خوب...,1504761
p5d5v0,10,HAPPY,پیتزا خوشمزه و عالی,1390661
p5d5v0,10,HAPPY,خیلی خوش مزه و دلچسب بود سپاس ,7145611
p5d5v0,10,HAPPY,مرسی از غذای خوش مزتون,7145611
p5d5v0,0,HAPPY,خوشمزه,6810036
p5d5v0,2,SAD,بسیار بسیار شور بود. ,147232
p5d5v0,6,HAPPY,خوشمزه ولی گرون بود....,5747028
p5d5v0,10,HAPPY,همیشه خوشمزه تردوعالی وسریع ارسال میشه امیدوارم همیشه‌ همینطورباشه,1679492
p5d5v0,10,HAPPY,عالی مثل همیشه فوق‌العاده,983967
p5d5v0,6,HAPPY,سس سالاد سزار اصلا خوب نبود ,8712916
p5d5v0,10,HAPPY,عالی بود,7145611
p5d5v0,2,SAD,سيب زميني كم بود,5035133
p5d5v0,4,SAD,این سری واقعا غذا بد بود .جای مرغ ژامبونشو گذاشته بودن. بادمجونم یه تیکه بیشتر نداشت. پنیر هم که فقط نشون داده بود و بسیار بدمزه. واقعا ناامید کننده شده شیلا. ,720606
p5d5v0,10,HAPPY,استرامبولی مرغ و بادمجان پیتزا شیلا یه چیز دیگه اس ,6808421
p5d5v0,10,HAPPY,عاالی,320068
p5d5v0,0,HAPPY,غذا کاملااا داغ رسید به دستم و خب طعم جالبی هم داشت ... فقط به نظرم یه کوچولو نمکش میتونست کمتر باشه که البته مشکل خاصی نداشت و خوب بود ... مرسی از شیلا,189002
p5d5v0,6,HAPPY,متوسط بود و سالاد کلم هم ارزش خرید نداشت خیلی کوچیک بود,628780
p5d5v0,8,HAPPY,همه چیز خوبه، یکم پر پیمون تر باشه که عالی میشه,349513
p5d5v0,10,HAPPY,واقعا عالی بود استرامبولی,3397670
p5d5v0,2,SAD,سيب زميني كم بود,5035133
p5d5v0,10,HAPPY,عالی فقط اگه نون زیرش برشته تر بشه خیلی جذابتره,3998199
p5d5v0,0,HAPPY,کیفیت و طعم غذاهای شیلا حرف نداره ولی قیمتها خیلی بی منطق گرون هستن,479497
p5d5v0,10,HAPPY,خیلی خوش طعم و خوش مزه بود. ,1536117
p5d5v0,10,HAPPY,"مثل همیشه و قدیمی بود
از شعبه ممنونم ",7145611
p5d5v0,10,HAPPY,کیفیت بالا به موقع رسید ,7145611
p5d5v0,8,HAPPY,"با سلام
پیتزا و استرامبولی فوق العاده معمولی بودن
در کل طعم نسبتا خوبی داشتن و بد نبود

ممنون
",346829
p5d5v0,10,HAPPY,عااالی,320068
p5d5v0,10,HAPPY,"عالی بود عاااااالی 
اما بجای ۴ تیکه فیله ۳ تیکه گذاشته بودند",3446112
p5d5v0,2,SAD,بسیار بیمزه بود. در سراشیبی سقوط از نظر کیفیت قرار گرفتید متاسفانه. ,363675
p5d5v0,10,HAPPY,عااالی,2932345
p5d5v0,8,HAPPY,متاسفانه طعم جالبی نداشت,308471
p5d5v0,6,HAPPY,"از شیلا کیفیت بهتری انتظار داشتم 
به توضیحات سفارش هم توجهی نمی کنند",175165
p5d5v0,0,HAPPY,خیلی تازه و خوشمزه و با کیفیت ,151109
p5d5v0,10,HAPPY,واقعا فوق العاده مخصوصا پيتزا,6201812
p5d5v0,2,SAD,سيب زميني كم بود,5035133
p5d5v0,10,HAPPY,عالی!!!,1723073
p5d5v0,10,HAPPY,همه ی  اونچه از همبرگر انتظار دارید,2234069
p5d5v0,10,HAPPY,عااالی بود ,7145611
p5d5v0,0,HAPPY,"به جای کراکف برای من همبرگر فرستادن!!!!!!!!!!!!!!!!!
",208490
p5d5v0,2,SAD,اولا که ننوشتین چندتا فیله ...هیچ رستورانی نیست که تعدادو ننوشته باشه ، و واقعا تو ذوقم خورد وقتی دیدم با این قیمت فقط ۳ تا فیله داره ،با لای ۴۴ تومن همه جا ۴ تا فیله میدن، ثانیا تعداد سیب زمینی ها رو شمردم ! به بیست تا نمیرسید ، من همیشه ازتون پیتزا و هات داگ میگرفتم و راضی هم بودم ولی این افتضاح باعث شد دیگه همونارو هم نگیرم ازتون,1728664
p5d5v0,10,HAPPY,عالی و خوش مزه تجربه ای متفاوت و عالی,7145611
p5d5v0,10,HAPPY,عالی,1239539
p5d5v0,10,HAPPY,"ساندویچ خیلی خوشمزه بود 
پیده متاسفانه بادمجونش خیلی تلخ بود از طعمش خوشم نیومد 
در کل شیلا خیلی با کیفیت هست و کارتون حرف نداره",308471
p5d5v0,10,HAPPY,خداییش خیلی خوشمزه بود و همه خوشمون اومد.ممنون,2137294
p5d5v0,8,HAPPY,شیلا همیشه خوبه ولی جای بهتر شدن بسیاااار داره,3610565
p5d5v0,10,HAPPY,"ممنونم از غذای با کیفیت و گرمتون
ممنون از پیک موتوریه محترمتون ",7145611
p5d5v0,0,HAPPY,عالی بود ,230654
p5d5v0,10,HAPPY,واقعا عالی ,7145611
p5d5v0,4,SAD,با اينكه خيلي تاكيد كرده بودم تازه باشه ولي هم سيب زميني كهنه بود هم فيله ، نپسنديدم,7664077
p5d5v0,10,HAPPY,ممنون از اینکه همیشه به ما لطف دارید ,7145611
p5d5v0,10,HAPPY,ممنون از توجه تون به توضیحات,7145611
p5d5v0,2,SAD,سيب زميني كم بود,5035133
p5d5v0,8,HAPPY,شیلا تنها فیت فودیه که این همه سال کیفیتش رو حفظ کرده ولی ادویه‌ها اخیرا یکم عوض شده.. دفعه پیش چیکن استریپس سفارش داده بودم و انگار توی یه ماده رنگی گذاشته بودنش فیله‌ها هم رنگ قرمز گرفته بود..,526704
p5d5v0,8,HAPPY,نسبت به مقدارش خیلی گرونه,1212433
p5d5v0,10,HAPPY,خیلی خوشمزه بود گوشتش خوب مزه دار شده بود,4565934
p5d5v0,10,HAPPY,عالی,127354
p5d5v0,10,HAPPY,عالی بود مثل همیشه,5041518
p5d5v0,10,HAPPY,عالی,891795
p5d5v0,10,HAPPY,تازه، خوش طعم، با کیفیت,212773
p5d5v0,8,HAPPY,مثله همیشه عالی,7171316
p5d5v0,2,SAD,سيب زميني كم بود,5035133
p5d5v0,10,HAPPY,خوشمزه,144771
p5d5v0,8,HAPPY,پیتزاش خوب بود نسبتا، سیب زمینی خییییلی کم بود و نمی‌ارزید، ساندویچ‌ها هم نسبتا خوب بودن,792730
p5d5v0,0,HAPPY,"کیفیت مناسب استرامبولی دونر استیگ پنیری
ولی واقعا مبلغش بالا بود",430784
p5d5v0,6,HAPPY,خیلی خوشمزه نبود,4767022
p5d5v0,10,HAPPY,"بي نظير بود ممنونم هم كيفيت عالي بود
هم حجمش عالي بود هم تازه و گرم 
با بسته بندي عالي و بهداشتي،شيلا تو بينظيري",5711185
p5d5v0,10,HAPPY,داغ و خوشمزه,3646581
p5d5v0,10,HAPPY,خیلی خوب,1084279
p5d5v0,4,SAD,پیتزا نسبت به دفعات قبلی خیلی چرب بود، به اندازه ای که کاغذ زیر پیتزا کاملا خیس شده بود,421281
p5d5v0,10,HAPPY,کیفیت غذا عالی بود فقط کمی نمکش زیاد بود,1017699
p5d5v0,8,HAPPY,خیلی خوشمزه بود و باکیفیت فقط سایزش کوچکتر از تصور ما بود ,6881048
p5d5v0,10,HAPPY,کیفیت عالی، ولی حیف که تاخیر در تحویل آن باعث نارضایتی میشود.,7613290
p5d5v0,10,HAPPY,عالی,7145611
p5d5v0,10,HAPPY,خیلی خوشمزه بود و داغ داغ بود، رفتار پیک هم عالی بود، ممنون,3788363
p5d5v0,2,SAD,کیفیت افتضاح پایین بود، نان سیر، ضخامت 2 میلیمتر، بجای سیر، از پودر سیر استفاده شده، حجم مغایر باتصویر. دیگه نه بنده نه همکاران شرکتم سفارشی از شما نخواهیم داشت. ,613047
p5d5v0,4,SAD,شیلا به نان های خاص خودش معروف بود که با جایگزین کردن نان باگت معمولی کیفیت و طعم غذا پایین اومد. سس استفاده شده مکزیکن نبود. یک سس تند بسیار معمولی بود. کشمش داخل سالاد کلم رو دوست نداشتم,6332911
p5d5v0,4,SAD,این دفعه افتضاح بود! روغن میچکید از غذا... بسیار چرب بود!!!,746856
p5d5v0,2,SAD,خمیر مونده ، حجم غذا بسیار کم ، این برای دومین باره که غذای بی کیفت میفرستن ، متاسفم شیلا این  آخرین بار بود سفارش دادم ,6935380
p5d5v0,10,HAPPY,خیلی خوب بود,1545927
p5d5v0,0,HAPPY,خیلی خوب...!,891795
p5d5v0,2,SAD,مرغ با آبلیمو مزه دار شده بود و طعم آبلیمو غالب بود من دوست نداشتم,316137
p5d5v0,10,HAPPY,Sos haton alian,7145611
p5d5v0,8,HAPPY,خوب بود ولی عالی نبود ,8862827
p5d5v0,10,HAPPY,"خیلی خوشمزه بود
ممنون",416338
p5d5v0,10,HAPPY,عااالی بود ,320068
p5d5v0,0,HAPPY,استرامبولی خیلی خوب بود رفت تو لیست انتخاب های همیشگی,347510
p5d5v0,10,HAPPY,"خیلی تازه بود
سپاس",7145611
p5d5v0,10,HAPPY,خیلی خوب و تازه بود ,983967
p5d5v0,2,SAD,افتضاح,1593077
p5d5v0,10,HAPPY,عاالی,3553749
p5d5v0,10,HAPPY,خیلی خوب و خوشمزه بود فقط خیلی گرم بدستم نرسید. ,1203245
p5d5v0,10,HAPPY,ممنون شیلا بهترینی ,320068
p5d5v0,10,HAPPY,خوشمزه و داااغغغغغ,7145611
p5d5v0,10,HAPPY,پيتزا عاااليييي  سيب زميني و سالاد هم خوب سس سزار يكم متفاوت بود با مزه اصلي ولي خوب بود ,3669404
p5d5v0,8,HAPPY,خوب بود، چسبید! ولرم هم رسید و بهم نریخته بود خدارو شکر,7104518
p5d5v0,10,HAPPY,عااالی بود ,320068
p5d5v0,4,SAD,نميخوام بگم بد بود نه ولي من همه طعماتون امتحان كردم همه عالي عالي بودنم فقط گوشت و پنير دوست نداشتم بنظرم حذف بشه از منو بهتره,7622830
p5d5v0,10,HAPPY,مثله همیشه عالی خوش طعم ممنونم,3531893
p5d5v0,10,HAPPY,عااالی,3553749
p5d5v0,10,HAPPY,عالی و باکیفیت و تازه.,7816082
p5d5v0,4,SAD,قیمت 20 درصد تخفیف داشت، ولی کیفیت 50 درصد افت کرده بود متاسفانه.,1266523
p5d5v0,10,HAPPY,عااالی بود ,320068
p5d5v0,8,HAPPY,خوب بود,628780
p5d5v0,6,HAPPY,اندازه اين ساندويچ رو كوچيكتر كرديد ظاهرا، كيفبت خوبه ولي خب سايزش كوچيك شده,9642717
p5d5v0,4,SAD,سلام.  این غذا رو از شعبه های دیگر نیز تهیه کردم، ولی متاسفانه حجم و کیفیت این شعبه پایین تر بود,1189283
p5d5v0,10,HAPPY,پنیرش خیلی زیاده,3794977
p5d5v0,2,SAD,"پیتزا اصلا افتضاح بود مزه ش معلوم نیست چی بود فوق العاده هم چرب
استرامبولی معمولی بود",3035868
p5d5v0,10,HAPPY,همه چی عالی عالی بود . فقط سیب زمینی اینبار کم بود,317008
p5d5v0,10,HAPPY,عالی بود واقعا بهترین شعبه شیلا هست,317008
p5d5v0,10,HAPPY,عالی بود خیلی خوشمزه و بی نظیر,3808878
p5d5v0,10,HAPPY,"شیلا فست فود خلاقی هست که مشابه پیتزاها هیچ جا پیدا نمیشه 
و همیشه غذاهای جدید به منو اضافه میشه که امیدواریم هر ماه یه غذا جدید حداقل اضافه بشه ",308471
p5d5v0,10,HAPPY,بسیار خوب,375648
p5d5v0,10,HAPPY,"واقعا عالی بود ،هم به موقع رسید،هم گرم بود
ممنون ازتون،موفق باشین",11566292
p5d5v0,10,HAPPY,مثل همیشه عالی و به موقع ,3890998
p5d5v0,10,HAPPY,عالی ,7866359
p5d5v0,8,HAPPY,کیفیت و بسته بندی که مثل همیشه عالی ولی متاسفانه به جای نوشابه زیرو ، کولا ارسال شده بود و برخلاف همیشه نی هم ارسال نشده بود,3983290
p5d5v0,0,SAD,هر بار سرد به دستم میرسه قیمتش خیلی زیاده نسبت به حجم و کیفیت پک قاشق و چنگال و چاقوباید کامل باشه هزینه مالیات خیلی زیاده ,324204
p5d5v0,10,HAPPY,"به موقع رسید 
ممنون از شیلا",320068
p5d5v0,10,HAPPY,سلام ممنون از اقای پیک محترمتون ,7145611
p5d5v0,10,HAPPY,خیلی گرم بود ممنونم  بسیار تازه,983967
p5d5v0,8,HAPPY,گرم و خوش طعم بود,5372329
p5d5v0,10,HAPPY,مول همیشه عالی.ممنون,6498699
p5d5v0,10,HAPPY,عالی,7905957
p5d5v0,10,HAPPY,خیلی خوب پخته شده بود همه چی عالییی وخوشمزه بود.,8434700
p5d5v0,10,HAPPY,عالی,9794199
p5d5v0,10,HAPPY,"کیفیت و حجم عالی بود. یه نفره نتونستم تمومش کنم
بسته بندی هم خیلی عالی و اصولی
چیکن ترد و خوشمزه بود ولی سیب زمینی ها سرد بودن
سفارشم خیلی زودتر از زمانی که باید منتظر میموندم به دستم رسید ممنون ازتون",8589096
p5d5v0,8,HAPPY,برگر خوب بود فقط قیمت خیلی بالاست,4908854
p5d5v0,8,HAPPY,معمولی,12306899
p5d5v0,10,HAPPY,دوست دارم شیلا همیشه همینجور با کیفیت بمونه,12538000
p5d5v0,10,HAPPY,عالی,6289953
p5d5v0,10,HAPPY,پیتزا اسفناج فوق العادس کاملا سالم,5010318
p5d5v0,10,HAPPY,Awli mesle hamishe,4769612
p5d5v0,10,HAPPY,بسیار عالی و خوشمزه بود ممنون ,4924531
p5d5v0,10,HAPPY,تازه و گرم تحویل داده شد و کیفیت خوبی داشت!,3985809
p5d5v0,10,HAPPY,بسیار خوشمزه بود,792138
p5d5v0,10,HAPPY,کیفیت خوبی داشت با توجه به قیمتش و در کل راضی بودم,13234219
p5d5v0,8,HAPPY,معمولی بود,13380258
p5d5v0,10,HAPPY,"بسیار عالی بود غذاهاتون متشکرم
فقط لطف کنید توسیب زمینی هاتون یکم بیشتر دقت کنید 
بفضی از سیب زمینی ها سفت بودن 
سرویستون هم عالی بود تشکر از ایشون
و زودتر از موعد به دستمون رسید",2785912
p5d5v0,0,HAPPY,زودتر از زمان بدستم رسید و عااالی ,12381428
p5d5v0,2,SAD,بسیار غذا سرد بود,4366425
p5d5v0,2,SAD,افتضاح.متاسفم براتون.افتضاحم کمه,7241926
p5d5v0,10,HAPPY,طعم و کیفیت عالی,7983083
p5d5v0,10,HAPPY,من واقعا لذت بردم هم خودم هم مهمان هایم .ممنون از کادر خوب و عزیزتون,7661125
p5d5v0,2,SAD,حقیقتا تا حالا تجربه بد از شیلا نداشتم و این بار خیلی عجیب بود. طعم سس رو اصلا دوست نداشتم. یعنی با توجه به محتویات نوشته شده و همینطور طعم متداول یک هات داگ، انتظار چنین طعم ناآشنا و بدی رو نداشتم. البته احتمالا این طعم سلیقه بعضی از مشتریان بوده که نظرات مثبت گرفته اما متاسفانه برای من اینجور نبود. و واقعا هیچ بخشی از غذا رو نتونستم بخورم.,3513776
p5d5v0,10,HAPPY,عالییی,7505458
p5d5v0,10,HAPPY,عالی گرم خوشمزه,4813591
p5d5v0,10,HAPPY,"تمام مواد مصرفي تازه و با كيفيت
عالي ",3876104
p5d5v0,8,HAPPY,غذا خوشمزه بود اندازه پیتزا برای یک نفر کافی بود ,6870939
p5d5v0,10,HAPPY,مثله همیشه خوب بود,4286985
p5d5v0,10,HAPPY,عالی,6485644
p5d5v0,10,HAPPY,"ممنون از پیتزا شیلا 
پیتزا واقعا خوش مزه بود 
سالاد کلم هم که خیلی خوب بود 
نکته مهم سفارش زودتر از انتظار به دستم رسید 
",6055303
p5d5v0,10,HAPPY,غذا که عالی بود خیلی زود و گرم به دستمون رسید، مرسی از پیک خوش برخوردتون ,127116
p5d5v0,8,HAPPY,داغ و لذیذ بود ولی کیفیت ژامبونش میتونست بهتر باشه و به نظرم استرامبولی مرغ بادمجون خوشمزه تر هست,6838694
p5d5v0,2,SAD,"برعکس همیشه خیلی بد بود
پنیر خام بود
تو فود پارتی گرفتم؛نمیدونم بخاطر تخفیف فود پارتی کیفیت انقد پایین بود یا نه
اگر بخاطر تخفیف فود پارتی؛کم کاری کردن تو کیفیت؛ خیلی کار بدی کردن",8595414
p5d5v0,10,HAPPY,خول بود,1314353
p5d5v0,10,HAPPY,سلام ، واقعا غذا عالی و خوشمزه بود ، از تمام کسایی که برای ارائه غذای با کیفیت زحمت میکشن ممنونم و سپاسگزارم ,11679765
p5d5v0,10,HAPPY,پیتزا بینظیر بود,3491418
p5d5v0,10,HAPPY,به موقع رسید مثل همیشه خوب بود,149179
p5d5v0,10,HAPPY,کیفیت عالی,1290315
p5d5v0,10,HAPPY,خيلي سريع اوردن،گرم و خوشمزه,9997011
p5d5v0,10,HAPPY,خیلی خوب بود ,736600
p5d5v0,10,HAPPY,عالی بود,7503931
p5d5v0,10,HAPPY,کیفیت مثل همیشه خوب اما شیلا خیلی دیر به دیر تخفیف میذاره تو اسنپ فود.,6596743
p5d5v0,10,HAPPY,مثل همیشه عالی ,4841253
p5d5v0,10,HAPPY,همیشه وقت شناس . کیفیت عالی . کارکنان  محترم و با حوصله ,914573
p5d5v0,10,HAPPY,"سلام 
من دو بار گرفتم
عین دو بار عالی  با کیفیت بوده
به موقع هم رسیده  ",5053168
p5d5v0,10,HAPPY,پیتزا خوش طعم و بسیار خوب ، ارسال غذا سریع و بسته بندی بسیار مناسب ,5466575
p5d5v0,2,SAD,بسیار بی کیفیت سس بسیار شل انگار آبلیمو بود کلا کاهو ها مونده و زرد شده بودن سالاد کلم هم خیلی مونده بود و بو میداد در کل اصلا راضی نیودم,2622529
p5d5v0,8,HAPPY,کم نمک بود,1277285
p5d5v0,4,SAD,"غذا مشخص بود که دوباره گرم شده
طعم و بوی خوبی هم نداشت
دوتا تیکه کوچیک خوردیم و بقیه‌ش موند
در کل اصلا راضی نبودم",4894714
p5d5v0,10,HAPPY,خوش طعم و لذید,6412879
p5d5v0,8,HAPPY,"ساندویچ کراکف مثل عکس نبود، اما بد هم نبود.
زمان تحویل خیلی بهتر از بقیه فست فودها بود. ",210649
p5d5v0,10,HAPPY,کلی منتظر بودم دوباره بیاد ، خوب بود ، ممنون,9647910
p5d5v0,10,HAPPY,کیفیت خوب بود.منتها ما ۴ تا چیکن سفارش دادیم.همراهش ۳ تا سالاد و سس مخصوص بود,7116061
p5d5v0,2,SAD,نسبت به یکی دو هفته پیش قیمتش بیشتر شده و فقط ۶ تومن هم مالیات میگیره که معلوم نی برا چیه ,9773176
p5d5v0,10,HAPPY,"غذا عالي و با كيفيت تازه، رفتار پيك محترم و عالي 
مرسي ",3416422
p5d5v0,10,HAPPY,"کیفیت عالی نبود ولی در کل خوب بود فقط به خورده نونش کم حجم بود
قیمتش هم با نخفیف اسنپ با کیفیتش میخوند ولی قیمت خود شیلا با کیفیت پیتزاش توازن نداره",7643439
p5d5v0,10,HAPPY,ممنون از کیفیت بالا،مزه عالی و ارسال به موقع مجموعه شیلا,980181
p5d5v0,4,SAD,خيلي كم و بي كيفيت بود,5728485
p5d5v0,8,HAPPY,خوبه ولی کم پنیر,9702390
p5d5v0,10,HAPPY,بینظیر,3845434
p5d5v0,10,HAPPY,در حد انتظار بود,3492839
p5d5v0,8,HAPPY,"من مشتری همیشگی شیلا هستم 
پیتزا مثل همیشه خوب و مورد قبول بود
اما همبرگر خیلی مورد پسند من نبود .
",4025561
p5d5v0,8,HAPPY,سس نفرستادین!!!!!!!!!!,8082984
p5d5v0,10,HAPPY,پیک بسیار خوش برخورد بود و تا دمه در غذا رو آوردن. سفارش خیلی سریع ارسال شد.,4673746
p5d5v0,10,HAPPY,خیلی خوب بود,143525
p5d5v0,10,HAPPY,کیفیت غذا مثل همیشه عالیه. ممنون,7417946
p5d5v0,2,SAD,متاسفانه سفارش ما چيز ديگه اي بود لطفا دقت كنيد ,13110495
p5d5v0,10,HAPPY,عالی عالی,7983083
p5d5v0,8,HAPPY,سیب زمینی های استریپس خیلی داغ نبودند.,4522605
p5d5v0,8,HAPPY,از شیلا بعید بود یه همچین پیتزای بی کیفیتی، انتطارمو بهیچعنوان برآورده نکرد،کیفیت پپرونیش پایین،پنیرشم معمولی،برای اینکه پیتزا مزه تند بده،یه قسمتایی رو فلفل ریخته بودن.,8075628
p5d5v0,2,SAD,هات داگ چیز فرایز اصلا شباهتی با عکس نداشت. یک سوم بالای ظرف خالی بود. 4 تا حلقه سوسیس روی سیب زمینی ها بود و زیرش کلا سیب زمینی سرخ کرده بود. فرقی نمیکرد اگر سیب زمینی سفارش میدادم,646708
p5d5v0,6,HAPPY,فقط سوسیس و پنیر بود!!!! ,5237990
p5d5v0,10,HAPPY,"خوب بود
۳تا سس کم بود به نظرم :)",292669
p5d5v0,10,HAPPY,"غذا زودتر از موعد و گرم و خوشمزه
پیک مناسب 
",6470665
p5d5v0,10,HAPPY,خوشمزه بود و من کاملا راضی بودم.,166759
p5d5v0,10,HAPPY,عالیه فقط یکم گرونه,8478715
p5d5v0,10,HAPPY,خوب بود ,11106812
p5d5v0,10,HAPPY,پشتیبانی سفارش درخواستی از طرف شیلا ( میدان ولیعصر ) عالی بود ,4114382
p5d5v0,10,HAPPY,غذا عالی بود و سریع هم ارسال شد. مرسی,7417946
p5d5v0,10,HAPPY,وااااقعا عالی بود . مرسی از شیلا. همه چی به اندازه و خوشمزه ,8900068
p5d5v0,8,HAPPY,قطعا سالم تر از ژامبونه . یبار امتحان کردنش میارزه . مرسی از پیک که تا دفترم آورد . ,9922055
p5d5v0,10,HAPPY,بسیار خوش مزه و تحویل سریع و داغ غذا,3900696
p5d5v0,10,HAPPY,خیلی خوب خوشمزه بود ممنون,6296885
p5d5v0,2,SAD,ما قبلا این پیتزا رو سفارش میدادیم، اما اینبار واقعا از کیفیت پایین پیتزا تعجب کردم. خیلی کیفیتش پایین بود. قطعا دیگه سفارش نمیدم و توصیه هم نمیکنم. ,500628
p5d5v0,10,HAPPY,کلا خوب بود و نان سیر فوق‌العاده ,4583176
p5d5v0,4,SAD,سلام من استرامبولی مرغ و بادمجان سفارش دادم ولی مرغ و اسفناج ارسال شده,5232214
p5d5v0,6,HAPPY,روی غذاها  نوع آنها مشخص نشده بود ینی معلوم نبود چه پیتزا یا ساندویچ یا همبرگر  بوده. من ۸تا ساندویچ مختلف سفارش دادم ولی نمیدونستم کدوم به کدومه. کلی کیفیت خوب بود,8381392
p5d5v0,10,HAPPY,خیلی خوب,2678242
p5d5v0,10,HAPPY,بسیار عالی,2590654
p5d5v0,2,SAD,همش سویا بود ,9163980
p5d5v0,2,SAD,3تیکه استریپس نه مرغش تازه بود ونه پودر سوخاریش درکل خوشمزه نبود پیتزاو ساندویچایی که از این مجموعه گرفته بودم خوب بود فکر کردم 3تیکه شم خوبه که اصلا اینطور نیست,4740289
p5d5v0,10,HAPPY,درجه یک,11733788
p5d5v0,2,SAD,به جای گوشت از سویا استفاده شده ,9163980
p5d5v0,10,HAPPY,بی نظیرید,7661125
p5d5v0,4,SAD,پیتزا سرد سرد بود و کیفیت قبلی را نداشت . ,3243017
p5d5v0,6,HAPPY,کیفیت غذا بد نبود،  از پک چاقو و چنگال همراهش خوشم اومد پک کامل بود ,8263627
p5d5v0,8,HAPPY,مثل همیشهok,7480221
