restaurant_code,rating,feeling,commentText,customerId
p624mo,2,SAD,واقعاخیلی بدمزه وکهنه بوداولین وآحرین باربودکه سفارش دادم,11372447
p624mo,10,HAPPY,بسیار عالی,250243
p624mo,10,HAPPY,چرا وقتي اسم سالاد ، سالاد سزار و مرغ گريل گذاشتيد، به جاي مرغ تازه گريل شده، تكه هاي ريز شده ي سينه مرغ فراوري شده ي شركتي روي سالاد گذاشتيد و فرستاديد اين كار درستي نيست,3353886
p624mo,8,HAPPY,پیتزا کوئین فقط طعم پنیر بود,789566
p624mo,10,HAPPY,طعم و کیفیت غذا خوب بود و گرم به دستم رسید,1514147
p624mo,0,HAPPY,مثل همیشه عالی و خوب,5024485
p624mo,8,HAPPY,مرغ خوشمزه بود، سیب زمینی تازه نبود.,393982
p624mo,10,HAPPY,درود بر‌شما که مثل همیشه باکیفیت و عالی هستین,7748303
p624mo,10,HAPPY,خوب بود,2334407
p624mo,10,HAPPY,"بسيار خوشمزه و با كيفيت بود
مثل هميشه
از همه لحاظ عالي",4899891
p624mo,10,HAPPY,بی نظیر,663124
p624mo,10,HAPPY,عالی,8441056
p624mo,0,SAD,"کیفیت گوشت بد بود !! 
",4117752
p624mo,0,HAPPY,مثل همیشه عالی,5024485
p624mo,8,HAPPY,کیفیت خوب بود فقط اندازه برگر کوچک بود,774906
p624mo,6,HAPPY,"پیتزا مرغ بار اول بود سفارش میدادم و خوشمزه بود
پیتزا قارچ و گوشت بنظرم کامل پخته نشده بود و مقدار پنیرش زیاد بود راضی نبودم
هات داگ خوشمزه بود",3280132
p624mo,0,HAPPY,مثل همیشه عالی و گرم,5024485
p624mo,10,HAPPY,عالی بود هم مزه هم کیفیت ,10238400
p624mo,8,HAPPY,استرامبولی بی طعم بود. ,579996
p624mo,8,HAPPY,غذا عالی بود  ولی سالاد کلم مونده بود ,2870059
p624mo,10,HAPPY,عالی بود دوتاشون خیلی خوشمزه,4363085
p624mo,10,HAPPY,سیب زمینی چی میگه؟عالیی ,322732
p624mo,8,HAPPY,هم از کیفیت غذا کم شده ، هم قیمتش اضافه شده ، دیرتر از همیشه هم رسید . ,2870059
p624mo,10,HAPPY,خیلی ممنون عالی,10047024
p624mo,10,HAPPY,خیلی خوشمزه بود,4346501
p624mo,8,HAPPY,طعم پیتزا مثل همیشه عالی بود ولی چیز فرایزر به شدت از مقدارش کم شده بود و سیب زمینی هاش هم کامل سرخ نشده بود,8450493
p624mo,8,HAPPY,سالادش کاملا مونده بود ,2845609
p624mo,10,HAPPY,مثل همیشه عالی,1410017
p624mo,8,HAPPY,سلام و خسته نباشید به موقع رسید و خیلی خوب بود,219114
p624mo,4,SAD,سالاد کلم همراه چیکن استریپس نبود و فقط ۳ تیکه فیله بود!!,4547595
p624mo,10,HAPPY,فوق العاده عالی,7748303
p624mo,10,HAPPY,بی نظیر مثل همیشه، ممنونم,6032019
p624mo,10,HAPPY,واقعا عالي,5035388
p624mo,10,HAPPY,"خیلی خوشمزه ... 
فقط سس سبز رنگ داخل برگر به نظرم حذف بشه، طعم ساندویچ خیلی بهتر میشه.",1278733
p624mo,10,HAPPY,خیلی با کیفیت ولی کمی گرون,6849676
p624mo,10,HAPPY,پیتزا هاش عالیه و من عاشق پیتزا رست بیف ش هستم,4212697
p624mo,10,HAPPY,همه چیز عالی و خوشمزه بود,1169151
p624mo,10,HAPPY,خوب بود بسته بندیش هم بهداشتی بود ممنون,7808663
p624mo,8,HAPPY,خیلی گرون ,6849676
p624mo,10,HAPPY,"بهترینید 
فوق العاده خوشمزه ،داغ از همه مهم تر اینکه به چیزایی که نت میزاری توجه میکنن،خیلی سریع رسید . پیک هم بسیار محترم",7723900
p624mo,10,HAPPY,خیلی عالی بود,6388340
p624mo,10,HAPPY,همه چیز عالی بود.,370756
p624mo,10,HAPPY,"دیگر مشتری ثابت شیلا شدیم. کیفیت و اندازه‌ی متریال به‌کار رفته در پیتزا به نسبت قیمت کاملاً خوب و مناسب بود. طعم پیتزاهای قدیمی را می‌داد.
سیب زمینی ترد و داغ و حجم آن هم در مقایسه با دیگر فست فودها مناسب بود.",156192
p624mo,10,HAPPY,از هر نظر عالی,2218373
p624mo,10,HAPPY,فوق العاده ,6823798
p624mo,10,HAPPY, شیلا  مثل همیشه عالی و با کیفیت.و از همه مهمتر رفتار پیک لسیار محترمانه و درجه یک . ,636959
p624mo,10,HAPPY,ممنون خوش طعم و لذیذ البته کمی تند,3523261
p624mo,6,HAPPY,دقیقا چرا باید روی سیب زمینی آلفردو پیاز باشه!,4478392
p624mo,10,HAPPY,"خیلیییییییی خوشمزه بوووووود و عالی.
عاشقتونم",1410017
p624mo,10,HAPPY,عالی و خوشمزه,1169151
p624mo,10,HAPPY,خوشمزه و لذت بخش مثل همیشه,10666506
p624mo,10,HAPPY,مواد تازه ، خوشمزه و نقطه قوتش چرب نبودن پیتزاها بود ,5092211
p624mo,2,SAD,با توجه به قیمتها حجم سیب زمینی به شدت کاهش یافته و کیفیت سیب زمینی بسیار بد و له شده بود و طعم فیله استریپس بسیار تغییر کرده و بد شده است,1158031
p624mo,10,HAPPY,خیلی خوب و عالی,6311012
p624mo,6,HAPPY,سیب زمینی نداره و یکم سرد بود و  نوشابه رو هم گرم آوردن و پنیر  کم هم داشت,9523058
p624mo,8,HAPPY,کیفیتش خوبه ولی حجم ساندویچ با توجه به قیمت خیلی کمه,1523793
p624mo,6,HAPPY,استرامبولی عالیه عالی بود اما هات داگ مفتضحانه بود و بد بود,8969107
p624mo,10,HAPPY,عالی مثل همیشه,5569841
p624mo,10,HAPPY,پیده گوشت و بادمجان فکر کنم تازه به منو اضافه شده .مورد علاقم شد خیلی خوشمزه بود ترکیبش.الفردو چیز فرایزش رو من نپسندیدم.سس الفردو طعم خاصی نداشت.,2093836
p624mo,10,HAPPY,خیلی عالی بود,1118605
p624mo,10,HAPPY,سپاس فراوان ، بسیار عالی بود ، از اینکه برای کسب و کارتان و همچنین مشتری خودتان ارزش قائل هستید بسیار سپاسگزارم,203478
p624mo,8,HAPPY,خوشمزه اس فقط‌ یکم به تلخی میزنه یه قسمت هاییش ،اون رفع بشه عالی میشه,205971
p624mo,10,HAPPY,بسیار عالی,3210060
p624mo,10,HAPPY,"خیلی خوبه که با خیال راحت به شیلا سفارش میدم خیالم راحته
بسیار عالی متشکرم",10047024
p624mo,2,SAD,"واقعا کیفیت بد بود متاسفانه وقتی امتیاز میگیرن دیگه کیفیت افتضاح میشه
انگار داشتی پیتزا دور میدون آزادی رو میخوردی
حیف از پول 
سوخته هم بود
دیگه خرید نمیکنم",5217344
p624mo,10,HAPPY,عالی بود,4491111
p624mo,10,HAPPY,رفتار پیک بسیاربسیار عالی ,5217344
p624mo,2,SAD,بر خلاف دفعات قبل پیتزا تا حدی نپخته و سرد بود. ,8745503
p624mo,10,HAPPY,بسیار عالی,7923145
p624mo,10,HAPPY,بد نبود انگار یکم مونده بود,7787706
p624mo,8,HAPPY,طعم و کمیت غذا خوب بود اما روی پیتزاها بیش از اندازه حرارت دیده بود,9229976
p624mo,2,SAD,همبرگر بی نهایت بی نهایت بوی چربی میداد.نخورده رفت توی زباله.ساندویچ و پیتزا هم فقط قابل خوردن بود,5762116
p624mo,8,HAPPY,هات داگ چیز فرایز :چندین بار گرفتم خیلی خوشمزه بود، فقط اینسری سسی که روی سوسیس ها بود خیلی خوش طعم نبود یه مزه  و بویی مثل زیره میداد. مثل قبل باشه بهتره .,8760822
p624mo,8,HAPPY,نون بسیار زخیم و خمیری بود,3280132
p624mo,10,HAPPY,"همه چیز عالی بود.
سپاسگزارم",370756
p624mo,8,HAPPY,پیتزا خیلی خوشمزه و متنوع بود,4549596
p624mo,2,SAD,واقعا بسیار بد طعم بود، به زور تونستم تمومش کنم,2294318
p624mo,4,SAD,بد نبود ولی حجمش با اون قیمت بالا بود نمیصرفه ,9790901
p624mo,10,HAPPY,خوب بود . فقط استرامبولی یه کم زیادی شور بود ولی در کل خوب بود . ممنون,7808663
p624mo,8,HAPPY,با سلام ارسال و کیفیت خوب بود فقط پیتزا مخلوط روش سوخته بود کاملا، لطفا رسیدگی کنید این مورد رو ممنون,193120
p624mo,10,HAPPY,کیفیت غذاتون عالی بود,3415498
p624mo,10,HAPPY,"باکیفیت و عالی، به موقع رسید.
امیدوارم همیشه باکیفیت بمونید",3251008
p624mo,8,HAPPY,گریل چیکن خیلی تند بود ، فقط مزه فلفل میداد,1102799
p624mo,8,HAPPY,سایز نان سیر بزرگترو موادش بیشتر باشه بهتره ,690456
p624mo,2,SAD,غذا یخ بود اصلا قابل خوردن نبود,535028
p624mo,10,HAPPY,در کل غذاهای رستوران شیلا از کیفیت قابل قبولی برخوردار هستن اما استرامبولی هاش یچییییییز دیگه‌ست,929942
p624mo,10,HAPPY,عالی فقط یکم چرب,3153784
p624mo,10,HAPPY,"مرغ و زرشک عالیه 
بادمجان هم خوبه فقط کمی طعم تلخی میداد ولی در کل خوبه مرسی",5586677
p624mo,8,HAPPY,خیلی گرون,6849676
p624mo,6,HAPPY,همه چیز متوسط و خوب بود,11709247
p624mo,10,HAPPY,عالی و خیلییییی زود ,1165049
p624mo,8,HAPPY,کِشش داااار نبود ولی خوشمزه بود ,6337993
p624mo,4,SAD,من همیشه این مدل هات داگ رو سفارش میدادم بخاطر طعم متفاوت هات‌داگش که فکر میکنم دست ساز باشه اما ایندفعه سس روی ساندویچ بشدت زیاد بود و کل باکس ساندویچ سسی شده بود من که پنیر گودایی روی هات داگ ندیدم نسبت خیارشور و گوجه هم مثل دفعات پیش نبود. از شیلا انتظار نداشتم.,3571706
p624mo,10,HAPPY,در یک کلام همه چیز عالی بود واقعا چسبید. ,3405729
p624mo,4,SAD,غذا شور بود و فقط سس خالي بود كه سس هم اصلا مزه ي آلفردو نبود ,6332519
p624mo,10,HAPPY,بسته بندی خوب بود طعم پیتزا هم عالی بود,867891
p624mo,8,HAPPY,خوب بود ممنونم از شما,2861302
p624mo,10,HAPPY,واقعا خوشمزه بود مرسی,3466467
p624mo,8,HAPPY,"حجم غذا ها خیلی کم شده، تعجب میکنم ،
غذا کیفیت خوبی داره ولی اگر قرار بشه حجمش کم بشه .... چی بگم",10047024
p624mo,8,HAPPY,استرامبولی مرغ و زرشک رو دوست نداشتم ولی گوشت و پنیر خوب بود ,315698
p624mo,10,HAPPY, عالی مثل همیشه ! ,4765918
p624mo,10,HAPPY,همه چیز خیلی عالی و با کیفیت بود. همچنین پیگیری محترمانشون و رفتار محترمانه پیک. فقط یکی از دلستر های استوایی ارسال نشده بود.,3685958
p624mo,2,SAD,اصلا با عکسی که گذاشتند مطابقت نداره خیلی هم سرد بود کیفیت هم بسیار پایین بود ,12523402
p624mo,8,HAPPY,سلام به جای ماالشعیر که سفارش داده بودم نوشابه ارسال شده کیفیت غذا خوب پیک عالی,794292
p624mo,10,HAPPY,حرف نداره,5823793
p624mo,10,HAPPY,"کیفیت غذا،بسته بندی، زمان تحویل ،برخورد پیک بسیار عالی 
فقط اون مبلغ مالیات بسیااار جالب بود برام !!!
",4333968
p624mo,10,HAPPY,"همه چیز عالی
غذاگرم و خوشمزه",8499611
p624mo,8,HAPPY,خوب بود,8053958
p624mo,10,HAPPY,با سلام واقعا پیتزای لذیذ و با کیفیتی است ولی اندازه سالاد کلم کوچک بود,4925604
p624mo,10,HAPPY,عالی بود,10629199
p624mo,10,HAPPY,عالی و خوشمزه,7899904
p624mo,10,HAPPY,کیفیتش خیلی خوبه ,13332994
p624mo,10,HAPPY,همه چی خوب بود، ممنون.,10599511
p624mo,10,HAPPY,پنیر به اندازه بود.بسته بندی خوب بود.اندازه پیتزا خوب بود.هر سه غذا لذیذ بود,4336452
p624mo,8,HAPPY,طعم پیتزا متوسط بود ,13217008
p624mo,4,SAD,پیتزا شور بود و طعم خوبی نداشت,11317537
p624mo,10,HAPPY,عالی,3624193
p624mo,10,HAPPY,"خوشمزه و داغ 
ارسال سریع",6308824
p624mo,10,HAPPY,دونر استیک و پنیر و پیتزا سبزیجات هر دو بسبار عالی بودند تشکر ,1059600
p624mo,10,HAPPY,هم پیتزا داغ بود هم پیک مودب و محترم,1861626
p624mo,10,HAPPY,برخورد پیک های رستوران خیلی خوبه. کیفیت غذا هم خوب بود ,1248021
p624mo,10,HAPPY,طعم پیتزا فیله مرغ عالییییی  و نسبت به قیمتش  بسیار پرحجم و خوش مزه بود,7799579
p624mo,10,HAPPY,مثل همیشه هم زود رسید هم خوشمزه، به اندازه کافی هم گرم بود,157045
p624mo,10,HAPPY,اصلا خوب نبود،انگار داشتی پنیر پیتزا با نون میخوردی،به هیچ عنوان سفارش ندید,9403577
p624mo,10,HAPPY,ممنون عالی تازه داغ  وفوق العاده خوشمزه وبه توضیحات هم دقت کرده بودن وپیک هم عالی وسریع اورد,748180
p624mo,10,HAPPY,مثل همیشه عالی و با کیفیت,9796741
p624mo,10,HAPPY,kamelan be moqe va ba keyfiat be dastemon resid ,1980520
p624mo,10,HAPPY,کیفیت خوب بود و سریع فرستادن ,224753
p624mo,10,HAPPY,کیفیت غذا را دوست داشتم,7499906
p624mo,8,HAPPY,"طعم پیتزا عالی
اما دو مرتبه تا حالا سفارش دادم ،و هر دو بار،دیر به دستم رسید",5569430
p624mo,10,HAPPY,عالی به موقع و با قیمت مناسب .... موفق باشید,8923106
p624mo,8,HAPPY,گزینه نان به منو اضافه کنید خواهشا ,1278733
p624mo,2,SAD,پیک به آدرسی اشتباه رفته و بعد 20دقیقه غذای سرد تحویل گرفتم,7947162
p624mo,10,HAPPY,"طعم عالی داشت
با تشکر از پیتزا شیلا",1730494
p624mo,10,HAPPY,همه غذا ها عالی و با بهترین کیفیت مثل همیشه،ممنون,5309358
p624mo,10,HAPPY,پیک پروتکل های بهداشتی را رعایت کرده بود.,11578730
p624mo,10,HAPPY,مثل همیشه عااالییی و خوشمزه,7513413
p624mo,10,HAPPY,عالی هستید بهترین کیفیت,10513633
p624mo,10,HAPPY,مثل همیشه عالی,7528907
p624mo,10,HAPPY,استامبولی و پیتزا عالی بود، قیمت پیتزا به نسبت حجم کمی بالاست. ,5645406
p624mo,10,HAPPY,کیفیت پیتزاها خوب بود، جالبه که همیشه ۳۰ سانتی میگرفتم اینبار که ۲۰گرفتم دیدم در یک نوع یکسان، ۳۰ سانتی ها بهتر از ۲۰ سانتی‌ها بودن! چرا واقعا؟! در کل از سفارش راضی ام ممنون.,9323175
p624mo,8,HAPPY,دونر استیک برای من مرغ ارسال کردید,1521979
p624mo,10,HAPPY,پیتزای گرم و خوشمزه تون به دستم رسید ممنونم,6413267
p624mo,10,HAPPY,"تنها فست فودی هست که با خیال راحت سفارش میدم بدون افت کیفیت
امیدوارم همینجور متعهد باکیفیت بمونه، 
",7569059
p624mo,6,HAPPY,کیفیت معمولی بود به نسبت قیمت به نظر من هم خوانی نداشت,13152720
p624mo,10,HAPPY,"طعم پیتزا عالی بود .حجم پیتزا خوب بود
طعم دونر خوب بود فقط یکم حجمش کمه و یه آقا سیر نمیشه",6668670
p624mo,10,HAPPY,بسته بندی عالی، زودتر از موعد تحویل به دستم رسوندن، طعم غذا فوق العاده، کلی هم سیب زمینی همراهش بود من سفارش نداده بودم اما خودشون رو سفارش داده بودن و واقعا خوب بود. خلاصه همه چی خووووووووب,10796068
p624mo,10,HAPPY,خوب بود . سریع رسید . پپرونیش تندیش خیلی خوب بود . در کل راضی بودم ,7909891
p624mo,10,HAPPY,پیتزا خیلی خوش طعم بود با اینکه من آخرین تایمتون سفارش دادم خمیر پیتزه تازه و گرم و سیب زمینی هم خوش طعم بود . ممنونممممممم,8579006
p624mo,10,HAPPY,"خیلی عالی بود طعم خیلی خوبی داشت 
غذا ب موقع و سریع و گرم و داغ تحویل داده شد واقعا ارزششو داره ب شما حتما پيشنهاد میکنم ",12418396
p624mo,10,HAPPY,عالی بود,2367123
p624mo,10,HAPPY,عالی بود و خوشمزه. ارسال هم سریع بود. ممنون ,1299471
p624mo,4,SAD,به جای آلفردو چیز فرایز ، هات داگ چیز فرایز فرستادید,3572674
p624mo,2,SAD,کاملا سرد و بی کیفیت به دستمان رسید.اصلا راضی نیستم,9838545
p624mo,10,HAPPY,بی نظیر بود و راننده عالی و بموقع,9019198
p624mo,8,HAPPY,غذا ها خوب بودن ,575412
p624mo,10,HAPPY,خوب بود، برای بار دوم سفارش دادم، مزه‌اش جالبه. فقط کاش به جای یک سس سیر، دو تا میذاشتن ,704818
p624mo,10,HAPPY,به نظرم قیمت پیتزاهای شیلا به نسبت متریالی که استفاده میکنه و سایزش خیلی زیاده.ولی مزه پیتزاهاش خیلی خوبه ولی تو پیتزا کویین به نسبت قیمتش گوشت زیادی استفاده نشده این قیمت برای اون متریال خیلی بالاست.,3611821
p624mo,8,HAPPY,خیلی خوب بود.فقط اگه پنیر پیتزا بیشتر بود عالی میشد.,4818587
p624mo,6,HAPPY,متاسفانه سفارش من بیشتر از یکساعت طول کشید تا تحویل بشه ,4968771
p624mo,10,HAPPY,چیکن استریپس واقعا به اندازه و عالی بود، گرم رسید و طعم خوبی داشت، سس سالاد کلم یکمی شیرین بود اما خوب بود متشکرم از شیلا  ,4960640
p624mo,10,HAPPY,خیلی مرتب داغ و با سلیقه ممنون,9827529
p624mo,10,HAPPY,کیفیت غذا خیلی عالی بود,10520267
p624mo,10,HAPPY,بسیار عالی و باکیفیت,1423347
p624mo,10,HAPPY,بنظرم‌کیفیتش خوبه نسبت به قیمت مناسبی که دارین ,8814670
p624mo,8,HAPPY,نوشابه اسپرایت خواسته بودم کوکا فرستادن و سیب زمینی روی پیتزا هم کمی کهنه بود ,3503757
p624mo,10,HAPPY,عالی ,12870055
p624mo,10,HAPPY,خیلی عالی بود و خیلی به موقع رسید و خیلی خوب برخورد کردن عالی بود ,8714054
p624mo,10,HAPPY,سریع و گرم و همه چیز بسیار مرتب و عالی بود,821910
p624mo,10,HAPPY,عالی بود از همه لحاظ,5146322
p624mo,10,HAPPY,مثل همیشه عالی بودید ,8030739
p624mo,10,HAPPY, از شما به خاطر  بسته بندی و کیفیت مناسب  پیتزا ممنونم,8969908
p624mo,10,HAPPY,مثل همیشه عالی,11646365
p624mo,10,HAPPY,عالی,3113008
p624mo,8,HAPPY,برخورد پیک عالی,6110811
p624mo,6,HAPPY,شیلا نسبت به قبل خیلی افت عجیبی پیدا کرده!,2201882
p624mo,10,HAPPY,بسیار عالی بود و فورا تحویل داده شد.,2374518
p624mo,10,HAPPY,"برخورد مناسب پیک
کیفیت خوب پیتزا",1353569
p624mo,2,SAD,مواد استفاده شده با کیفیت اما مزه خاصی نداشت تو خونه هم میشه همینو پخت,6599391
p624mo,10,HAPPY,همه چی عالی بود ممنون از شما,7087504
p624mo,10,HAPPY,"همه چی خوب بود مثل همیشه
فقط کاش کارد هم بزارید",7723900
p624mo,10,HAPPY,"بسته بندی خوب
غذا خوشمزه
فقط قیمت کمی بالاء",5424467
p624mo,2,SAD,اسفناج استفاده شده بشدت مزه ی بدی میداد,5223188
p624mo,6,HAPPY,فقط یک نوشابه به ما تحویل شد. شماره تماس روی رسید هم به دلیل بدهی قطع اعلام میشد,2822742
p624mo,10,HAPPY,بسیار خوشمزه بود,4863804
p624mo,10,HAPPY,خیلی خوب مثل همیشه عالی گرم و خوشمزه,3704583
p624mo,10,HAPPY,"غذا داغ و با کیفیت بالا مثل همیشه 
خیلی خوبه که پیک مجموعتون دارید این باعث میشه غذا به موقع و داغ برسه ",2919559
p624mo,10,HAPPY,خیلی خوب بود. عااالی,7019204
p624mo,10,HAPPY,طعم عالی که مشخصه به خاطر کیفیت مواد و همچنین ادویه های به کار رفته شون هستش. خیلی سریع هم رسید و پیک هم بسیار محترم بودند. ممنون و متشکر از شیلا و اسنپ فود ,419833
p624mo,10,HAPPY,"سلام 
عاااالی بود عاااالی گرم و باکیفیت و بی نهایت خوشمزه،",2612077
p624mo,10,HAPPY,"مشتری پر و پا قرص  شیلا هستم
مثل همیشه به موقع و غذای با کیفیت  ممنون از مدیریت و کارکنان شیلا و اسنپ که  جزئی از خانواده ما شده ",3353922
p624mo,6,HAPPY,پیتزا خوب بود ولی طعم دونر استیک پنیری رو نپسندیدم,2579746
p624mo,10,HAPPY,"مثل همیشه عالی و داغ و به موقع بود.
استرامبولی گوشت و پنیر خیلی خوب هست. ",791190
p624mo,8,HAPPY,حجم پيتزا كم بود اما خوشمزه بود,8053958
p624mo,10,HAPPY,واقعا عالی بود هم کیفیت هم طعم و هم سرعت,7979209
p624mo,10,HAPPY,"من دومین بار که سفارش میدم و واقعا در کل خیلی عالی هستش.
فقط بار دوم یه نمه کامل گرم نبود. وگرنه مزه و طعمش خوب بود.",11122369
p624mo,10,HAPPY,عالی ,6535643
p624mo,8,HAPPY,حجم خوب بود و کیفیت هم عالی و خیلی پریود سر وقط هم اوردن خلاصه عالی,8876360
p624mo,10,HAPPY,كيفيت غذاتون واقعا منو تحت تاثير قرار داد ، ممنون كلى. ,7867287
p624mo,10,HAPPY,غذا گرم و خوشمزه بود ,11268451
p624mo,10,HAPPY,واقعا رستوران با شخصیت و کار بلد بعد دریافت غذا پیگیری رضایت مندی مشتری انجام میدن ایشالا هر روز پیشرفت کنید غذا عالیه که همیشه سفارش میدم ,5579429
p624mo,10,HAPPY,"پیتزا سبزیجات عالیه و سفارش همیشگیم
سیب زمینی آلفردو خوشمزه و حجمش هم زیاد",11707799
p624mo,10,HAPPY,کیفیت غذا عالی بود پیک خیلی مودب و ارسال غذا خیلی سریع بود,10411920
p624mo,10,HAPPY,واقعا عالی بودش ,3904307
p624mo,2,SAD,کیفیت پیتزا اصلا خوب نبود. دوراش سوخته بود. پیتزا خیلی خشک بود. پنیرش خیلی کم بود. اصلا مواد روی پیتزا بهم نچسبیده بودن. تقریبا اصلا پنیر نداشت. ,736360
p624mo,6,HAPPY,"واقعا غذاهای خوبی بودن
مخصوصا پیتزاش
یکی از بهترین پیتزا مخلوط هایی بود که تاحالا خوردم اما پیتزا کویین کمی شور بود و احتمالا برای مواد اولیه ای بود که استفاده شده و همچنین هات چیز فرایز خیلی خوب نبود. سسی که داخلش استفاده شده بود به نظر من خوشمزه نبود.",10220992
p624mo,10,HAPPY,خیلی با کیفیت و خوشمزه بود ممنون,6280407
p624mo,10,HAPPY,سلام . ممنون از شیلا بابت پیتزای خوشمزشون . مثل همیشه عالی,1510671
p624mo,8,HAPPY,کیفیت خیلی خوب بود فقط کمی از سفارش قبلیم احساس میکنم کوچکتر شده بود,5997019
p624mo,10,HAPPY,من مشتری ثابت شیلا هستم هر غذاییش را که امتحان کردم فوق العاده بود,1618028
p624mo,10,HAPPY,ممنون از غذای خوشمزه و گرمی که ارسال کردین. هردو عالی بود حتما سیب زمینی و امتحان کنید ,2810001
p624mo,6,HAPPY,"پیتزا گوشت و قارچ جالب نبود و مزه ی زیاد خوبی نداشت
نان سیر هم همینطور",130817
p624mo,6,HAPPY,در کل خوب بود پیتزا گوشت و قارچ خوشمزه اما پیتزا سبزیجات بد بود و از گوجه های بی کیفیت استفاده شده بود، نسبت به بقیه رستوران ها کیفیت پیتزا سبزیجاتش پابین بود ,8359030
