restaurant_code,rating,feeling,commentText,customerId
p624mo,10,HAPPY,بسیار عالی و با کیفیت سپاس,10804427
p624mo,8,HAPPY,خوب و خوشمزه بود و خیلی زود از زمان مقرر به دستم رسید و برخورد پیک شون خیلی عالی بود ,11735460
p624mo,10,HAPPY,گرم و خوشمزه ممنون,2492554
p624mo,8,HAPPY,متاسفانه سرد به دستم رسید ,9969843
p624mo,10,HAPPY,عالی بود ممنونم ,3802935
p624mo,10,HAPPY,مثل همیشه عالی,9338819
p624mo,10,HAPPY,"مثل همیشه عالی و گرم.
",178649
p624mo,10,HAPPY,عالي از همه نظر,2111884
p624mo,10,HAPPY,خوشمزه,174088
p624mo,10,HAPPY,عالي,3229063
p624mo,8,HAPPY,نان های پیتزا شیلا تغییر کرده و کیفیت قبلی ها بهتر بود,11292261
p624mo,8,HAPPY,پیتزا سرد بود,7080556
p624mo,10,HAPPY,كيفت مناسب - توجه به توضيحات مشتري - بسته بندي بهداشتي و عملكرد خوب پيك محترم,3076632
p624mo,8,HAPPY,پیک بسیار عالی و مودب بودند,1310163
p624mo,10,HAPPY,"شیلا همیشه انتخاب مطمئنی هست
پیتزا و نان سیر ، داغ ، با مواد تازه و خوشمزه
ایده سیب زمینی فرایز روی پیتزا عالی بود
تحویل سریع و زیر ۲۵ دقیقه",2313371
p624mo,10,HAPPY,خیلی خوشمزه و رضایت بخش بود غذا,3415206
p624mo,10,HAPPY,کیفیت خوب مثل همیشه. ,7793427
p624mo,6,HAPPY,میزان بادمجان خیلی زیاد بود و تک و توک فیله مرغ وجود داشت. بهتر بود استرامبولی بادمجان اسمش را می گذاشتید!!,3000418
p624mo,10,HAPPY,عالی,2821785
p624mo,10,HAPPY,مثل همیشه عالی ,7342632
p624mo,4,SAD,برعکس همیشه که عالی بود، این بار هر دوتا سفارش سوخته بود ,7914314
p624mo,10,HAPPY,عالي و خوش طعم مثل هميشه ,378744
p624mo,10,HAPPY,عالی,3947007
p624mo,10,HAPPY,مثل همیشه بسیار عالی بود و غذا هم گرم رسید ممنون از شیلا ,1510671
p624mo,10,HAPPY,پیک بسیار مودب و سریع غذا رو رسوند ممنون,3413772
p624mo,10,HAPPY,کیفیت عالی که همیشه شیلا داره ممنون,4131883
p624mo,10,HAPPY,خیلی خوب بود,501728
p624mo,10,HAPPY,عالی بود ,8374653
p624mo,10,HAPPY,خیلی خوبه همیشه و خیلی سریع,6115977
p624mo,10,HAPPY,کاش امتیاز ۱۰ هم میشد ثبت کرد ,520695
p624mo,10,HAPPY,مثل همیشه عالی,4389585
p624mo,10,HAPPY,همیشه تمیز و مرتب و تازه ,3243405
p624mo,10,HAPPY,عالی مثل همیشه ,4975496
p624mo,6,HAPPY,"حجم سالاد بسیار کم بود
هات داگ چیزفرایز، کیفیت پایینی داشت انگار سوسیس بندری رو ریختن تو ظرف، رب و سیب زمینی و روغن
با اینک منزل ما خیلی نزدیک بود، خیلی طول کشید تا بیارن",8475818
p624mo,8,HAPPY,پیتزا و الفردو چیز فرایز فوق العاده بود ولی چیکن استریپس اصلا خوب نبود و اصلا پودر سوخاری نداشت، بیشتر مرغ پخته بود‌,649419
p624mo,0,HAPPY,همه چیز خوب بود فقط من در توضیحات سفارش خواهش کرده بودم که ژامبون مرغ داخل پیتزای مخلوط ما ریخته نشود ولی متاسفانه توجهی نشده بود.,131801
p624mo,10,HAPPY,خوب بود ممنون ,1510671
p624mo,10,HAPPY,عالی بود ,9545773
p624mo,10,HAPPY,خوب بود تشکر,12402685
p624mo,6,HAPPY,در سایت 5 تکه زده اما سه تکه بود گرچه کیفیت خوبی داشت. ,9229976
p624mo,10,HAPPY,مثل همیشه خوب بوده,178649
p624mo,10,HAPPY,خیلی خوب بود. تازه و داغ هم به دستمون رسید,125748
p624mo,10,HAPPY,عالی بود,5120354
p624mo,10,HAPPY,طعمش عالی بود,9486032
p624mo,8,HAPPY,سیب زمینی روی پیتزا هر بار داره کمتر میشه.,309170
p624mo,10,HAPPY,ارسال بسیار سریع و کیفیت عالی,7777388
p624mo,8,HAPPY,نمیگم عالی، اما خوب و قابل قبول بود. مزه‌اش فوق العاده نبود ولی خوشمزه بود. حالا دیگه تصمیم با خودتون,704818
p624mo,8,HAPPY,عالی ولی چرا انقد گرون اخه,8550759
p624mo,10,HAPPY,در کل کیفت قابل قبول بود,3731176
p624mo,10,HAPPY,با سلام، غذا مثل همیشه عالی و خوشمزه بود... سرعت در پخت و ارسال هم خیلی خوبه,6765011
p624mo,10,HAPPY,مثل همیشه عالی,8098727
p624mo,4,SAD,من همیشه از اینجا میگیرم و همیشه راضی بودم ولی این دفعه واقعا کیفیت اومده بود پایین.,5716220
p624mo,10,HAPPY,مثل همیشه عالی,7232887
p624mo,10,HAPPY,شما که فوق العاده یین,8058780
p624mo,10,HAPPY,عالی,8638901
p624mo,10,HAPPY,کیفیت غذا خیلی خوب بود,8955442
p624mo,10,HAPPY,"همه چی مث همیشه عالی :)
فقط لطفا کیفیت سالاد سزار هم ببرین بالا که سفارش بدیم ",9814896
p624mo,10,HAPPY,"پیتزا دونر عالیه...
پیک برخورد خیلی خوب و محترمانه ای داره
ممنون از مدیریت اسنپ فود بابت پیگیری و مشتری مداری عالی",11335967
p624mo,10,HAPPY,عالی، سریع حرفه ای,9168358
p624mo,10,HAPPY,مثل هميشه عالى,4442050
p624mo,10,HAPPY,ممنون خوب بود همه چی,4680325
p624mo,4,SAD,"غذا سرد بود
پیتزا کیفیت سابق رو نداره و سیب زمینی وسطش خیلی کم شده که شکل خوبی نداره 
ساندویچ خوب بود",1721529
p624mo,4,SAD,واقعا خيلى خيلى بى كيفيت بود وسط فيله ها خام و صورتى بود اصلا انتظار اين بى كيفيتى نداشتم بار اخر بود خريد كردم,4077079
p624mo,10,HAPPY,مثل همیشه عالی,8702207
p624mo,10,HAPPY,"بسیار بسیار عالی و خوش مزه بود
ممنون ",4876423
p624mo,6,HAPPY,"باعث ناراحتیه که فست فود شیلا داره خاطرات خوب این چند وقتمون ازش رو خراب می‌کنه
نان ساندویچ بسیار بیات بود",1721529
p624mo,2,SAD,اصلا شبیه به غذاهای شیلا نداشت پیتزا سرد سیب زمینی مونده یخ کلا افتضاح از شیلا بعید بود والا,11254264
p624mo,10,HAPPY,عالی ,11098278
p624mo,6,HAPPY,مزه میشه گفت اکی بود ولی واقعا بی کیفیت بودن مواد اولیه رو میشد حس کرد ,4971601
p624mo,0,HAPPY,عالی همیشه بهترین,1307625
p624mo,10,HAPPY,کیفیت غذاتون فوق العادست ممنون,10352614
p624mo,6,HAPPY,واقعا انتظار نداشتم همچین چیز برگری دستم برسه .من از مشتریهای همیشگیتون هستم .کلا نان چیزبرگر خمیر شده بود,9129562
p624mo,10,HAPPY,عالی ممنون,1101199
p624mo,10,HAPPY,حلالتون . عالی,3817529
p624mo,10,HAPPY,از کیفیت راضی هستم و مشتری دائم شیلا شدم.امیدوارم همین فرمون پیش برید,9690699
p624mo,6,HAPPY,خوب بود، پپرونی نباید قارچ داشته باشد، چرا آخه قارچ میذارید ,4319111
p624mo,8,HAPPY,"خوش طعم تازه و به موقع هم رسید
سپاس",3332881
p624mo,10,HAPPY,طعم پیتزا عالی ... برخورد پیک  بسیار محترمانه و مودب ,11335967
p624mo,10,HAPPY,عالی و خوشمززززه,11008913
p624mo,10,HAPPY,کیفیت خوب، تحویل زود,1440881
p624mo,4,SAD,۲ تا غذا سفارش دادیم یکیش داخل پاکت بود اون یکی بیرون پاکت و اینکه یکی از غذاها نونش بیش از حد برشته شده بود که کفش به سوختگی‌ می زد داخل پک ها هم اصلا سوس نبود بار اول و آخرین بارم بود که از این رستوران سفارش دادم ,4949528
p624mo,10,HAPPY,کیفیت غذا عالی بود ، داغ و به موقع به دستمون رسید، خلاصه که مرسی از کیفیت بالا,3353020
p624mo,10,HAPPY,سفارش خیلی دیر رسید. ولی خداییش گرم و با کیفیت بود ,7859100
p624mo,10,HAPPY,غذا خیلی زود اومد داغ بود و بسیار لذیذ پیک خیلی مودب و با شخصیت بود زودتر از زمان اعلام شده بدستمون رسید ,3442873
p624mo,10,HAPPY,عالی مثل همیشه,5146322
p624mo,10,HAPPY,۱.ارسال سریع ۲.کیفت غذای عالی ۳.بسته بندی مناسب ۴.پلمپ کردن غذا برای شرایط کرونا و ...,7189441
p624mo,10,HAPPY,بسیااار عالی و گرم و به موقع.,7947442
p624mo,10,HAPPY,مثل همیشه خوشمزه و باکیفیت.,4351565
p624mo,10,HAPPY,عالی خوشمزه سریع و گرم رسید امیدوارم همینجوری بمونه,1237649
p624mo,8,HAPPY,خوب بود و به موقع ,4791923
p624mo,10,HAPPY,"کیفیت غذا خوب بود.خیلی سریع به دستم رسید

",9246409
p624mo,10,HAPPY,ممنون عالی بود امیدوارم همیشه کیفیت غذاها رو حفظ کنید,1108417
p624mo,10,HAPPY,پیک خیلی زود رسید غذا هم خوب بود,7394304
p624mo,8,HAPPY,"غذا خیلی خوب بود
زود رسید، برخورد پیک عالی و خیلی متشخص بود
ممنون",312250
p624mo,10,HAPPY,عالی بود.دومین باره که سفارش میدم و هر دوبار فوق العاده خوشمزه بود.فقط جای قارچ سوخاری تو منوتون خالیه ممنون,8450493
p624mo,10,HAPPY,"بسیار عالی 
خدمتات بی نظیر ",1120213
p624mo,10,HAPPY,"پیتزا خوشمزه‌ای بود.
بسته بندی غذا هم واقعا خوب بود.
مرسی از پیتزا شیلا",2723959
p624mo,10,HAPPY,مثل همیشه همه چیز عالی بود  سریع رسید داغ بود بسته بندی مرتب و عالی خلاصه که دست شما درد نکنه ,755034
p624mo,10,HAPPY,پيك عالي، برخورد عالي بود,291763
p624mo,10,HAPPY,بسيار خوشمزه و با كيفيت,3986672
p624mo,10,HAPPY,غذا مثل همیشه خوشمزه بود و داغ به دستمون رسید. ممنون,4286697
p624mo,10,HAPPY,خیلی سریع ارسال شد هنوز غذا گرم بود کیفیت هات داگ واقعا خوب بود ,4583894
p624mo,10,HAPPY,پیک بسیار مودب و سریع سفارش تحویل داده شد،غذا هم عالی,899403
p624mo,10,HAPPY,خوشمزه سریع مودب مشتری مدار,622788
p624mo,10,HAPPY,یکی از بهترین پیتزا هایی که از اسنپ فود سفارش دادم,1154977
p624mo,10,HAPPY,خیلی عالی و با کیفیت,1287591
p624mo,10,HAPPY,چیکن استریپس و پیتزا پپرونی خوب بود تقریبا یک ساعت بعد از ثبت سفارش رسید در کل کیفیت خوبی داشت ممنونم از شیلا,2025355
p624mo,10,HAPPY,پیک به موقع سفارش را تحویل داد,724536
p624mo,10,HAPPY,عالیی بود مثل همیشه ، خوشمزه بود ، داغ بود زود رسید ، برخورد پیک هم عالییی بود ,10781459
p624mo,10,HAPPY,"بسیار عالی و خوش مزه ، سیب زمینی های تازه بود 
علیرغم ساعت غیر متعارف کاملا گرم به دستم رسید 
پیک بسیار مودب بود
ممنون ازتون ",309134
p624mo,10,HAPPY,خوشمزه و داغ بود,163085
p624mo,10,HAPPY,غذا سریعتر از مورد رسید و کاملا داغ و خوشمزه بود.,3259973
p624mo,10,HAPPY,خیلی خوب بود ، پیک واقعا انسان قابل احترامی بود,3348433
p624mo,10,HAPPY,سلام خیلی خوب بود رفتار پیک عالی بود مرسی,3494917
p624mo,10,HAPPY,خیلی خوب بود ممنون ,978537
p624mo,10,HAPPY,پیتزاتون گرم به دستم رسید کیفیت عالی,4508654
p624mo,10,HAPPY,کیفیت غذا عالی بود. غذا زود تحویل داده شد.,2708086
p624mo,10,HAPPY,عالی بود,3483070
p624mo,10,HAPPY,رفتار پیک عالی و غذا مثل همیشه خوشمزه ,1010115
p624mo,10,HAPPY,پیک خیلی زود رسید و غذا عالی بود,187401
p624mo,10,HAPPY,عالی ،رفتار و ساعت پیک بسیار عالی ,4843740
p624mo,6,HAPPY,متاسفانه بجاي نوشابه زيرو - كوكاي معمولي ارسال گرديد - برخورد و رفتار مناسب پيك محترم شايسته ي تقدير ميباشد.,3076632
p624mo,10,HAPPY,پیتزا فیله مرغ، داغ و تازه رسید، کیفیت و طعم در سطح بالا بود، ممنون از شیلا ,948290
p624mo,10,HAPPY,خوشمزه و باکیفیت، نان سیر فوق العاده بود. مرغ و اسفناج از دونر استیک بهتر بود. پیتزا هم بخوبی پخته بود. مرسی که روی پیتزا سبزیجات ذرت نریخته بودین، خیلی خوب بود.,130204
p624mo,10,HAPPY,برخورد پيك بسيار محترمانه و مودبانه بود و سفارش من به موقع به دستم رسيد. ممنون از شيلا و اسنپ فود,7819879
p624mo,10,HAPPY,واقعا خوشمزس. دست شما درد نکنه بابت کیفیت خوب غذاها,4168521
p624mo,10,HAPPY,مثل همیشه عالی ,5130353
p624mo,10,HAPPY,عالی بود همه چیز ممنون از سرویس دهی خوب و به موقع ,4026994
p624mo,10,HAPPY,عالی وگرم بود ممنون ,3709866
p624mo,10,HAPPY,خیلی خوب بود ممنونم از پیگیری شما,8686243
p624mo,10,HAPPY,عالی بود,7650839
p624mo,8,HAPPY,شهر عجایب نبود اما خوب بود ,12915814
p624mo,10,HAPPY,گرم و خوب بود,2289983
p624mo,10,HAPPY,فست فود شیلا همیشه خوب بوده و هست,7704824
p624mo,10,HAPPY,خیلی عالی و خوشمزه ,9509491
p624mo,10,HAPPY,مثل همیشه عالی بود,1317345
p624mo,10,HAPPY,خوشمزه بود ,3581607
p624mo,10,HAPPY,عالی بود,4525596
p624mo,10,HAPPY,"همه چيز بسيار عالي 
استرامبولي عاليييي",4274774
p624mo,10,HAPPY,طعم عالی ولی سرد رسید!,1443149
p624mo,10,HAPPY,با تاخیر ارسال شد اما بسیار با کیفیت و خوش طعم بود,4436016
p624mo,10,HAPPY,بسیار عالی و با کیفیت، یه مشکل کوچک تو ارسال به وجود اومد که مسئولین رستوران سریع پیگیری و رفع و رجوع کردند. ممنون هم از کیفیت غذا و هم پاسخگویی و برخورد دوستانه مجموعه شیلا,2278898
p624mo,10,HAPPY,گرم و به موقع رسید دستم ,3837419
p624mo,10,HAPPY,کوئین خیلی با کیفیت و خوش طعم بود مواد درجه یک بود یکم کوچیکه,4809936
p624mo,10,HAPPY,غذاها خوشمزه و با کیفیت بود. تقریبا هم گرم به دستمون رسید. من اولین بارم بود که از این شعبه شیلا سفارش میدادم و چون از کیفیت غذاها راضی بودم، بازهم برای دوره‌همی و مهمونی بهشون سفارش خواهم داد.,267712
p624mo,10,HAPPY,"کیفیت خوب و بسته بندی کاملا بهداشتی
و خوشمزه",3515820
p624mo,10,HAPPY,عالی بود، خیلی رضایت بخش بود کیفیتش. مرسی از شما.,10120393
p624mo,2,SAD,سرد بودن پیتزا,4539761
p624mo,10,HAPPY,"عالی مثل همیشه سوخاری ترد گرم با طعم عالی و به موقع رسید 
استامبولی بافت داخلش عالیه گرم و حجم مناسب با برخورد خوب و عالی ممنونم پیشنهاد میکنم حتما سوخاری امتحان کنید .فقط ای کاش شرق تهران هم شعبه داشتید .عالی هستید ",9183995
p624mo,10,HAPPY,ممنون عالي بود مثل هميشه,4104974
p624mo,10,HAPPY,عالى بود پيتزادمخلوط,5479986
p624mo,10,HAPPY,عالي مثل هميشه,378744
p624mo,8,HAPPY,كيفيت غذا خوب بود ولي سالاد با اون قيمتي كه داشت خوب نبود. فقط كاهو بود و سس,1701993
p624mo,10,HAPPY,مثل همیشه عالی بود,2732305
p624mo,10,HAPPY,مثل همیشه عالی بود,9509491
p624mo,10,HAPPY,مثل همیشه عالی,9509491
p624mo,10,HAPPY,مثل همیشه عالی بود,4484418
p624mo,10,HAPPY,"استرامبولی شیلا، قوت غالب ما در محل کار.
",3990862
p624mo,8,HAPPY,حجم غذا با قیمت اون متناسب نیست,6773570
p624mo,8,HAPPY,خوب بود ,7340029
p624mo,10,HAPPY,مثل همیشه عالی,3989222
p624mo,8,HAPPY,مزه مرغ و اسفناج با همیشه فرق داشت,276501
p624mo,8,HAPPY,نان سیر بی مزه و حجم سیب زمینی خیلی کم بود. اما پیتزا خیلی خوب بود.,5246935
p624mo,10,HAPPY,همه چيز خوب بود ممنون,2558899
p624mo,10,HAPPY,پپرونی واقعا خوب بود,11709247
p624mo,10,HAPPY,مثل همیشه عالی بود ,8069166
p624mo,10,HAPPY,غذا گرم و عالی بود بسته بندی عالی و تحویل به موقع فقط پیتزا به نظرم تند بود و اینکه مالیات ۲۰ تومن واقعا به نظرم زیاده ,3117188
p624mo,10,HAPPY,همیشه زودتر از زمان تعیین شده میاد و داغ داغ و خیلی لذیذ و خوشمزه مررررسیییییی,8886605
p624mo,10,HAPPY,مثل همیشه عالی بود,4484418
p624mo,10,HAPPY,عالی بود مثل همیشه,6938667
p624mo,10,HAPPY,"از همه نظر عالی، مخصوصا پیگیری سفارش و نظرسنجی ، این برای بنده خیلی ارزش داشت
سپاس",9816058
p624mo,8,HAPPY,چیکن کریسپی عالی بود- پیتزا سرد شده بود!,1010889
p624mo,8,HAPPY,سلام خدمت دوستان ، تنها موردی که فوق العاده بود از نظر بنده کار پیک بود ، که خیلی سریع سفارش رو تحویل دادن . ,6428484
p624mo,10,HAPPY,عالی مثل همیشه,3432966
p624mo,6,HAPPY,سرد بودن غذا ,5266373
p624mo,10,HAPPY,خیلی به موقع رسید و کیفیت تمامی غذاها عالی بود امیدوارم همین کیفیت حفظ بشه,3432966
p624mo,10,HAPPY,بسیار عالی,10455268
p624mo,10,HAPPY,واقعا خدا قوت بهتون میگم، چند بار که از شما غذا گرفتم همشون عالی بود. امیدوارم همیشه کیفیت غذاهاتون همینجوری بمونه. سپاس از شما و تیمتون,5647716
p624mo,10,HAPPY,"هات داگ چیز فرایز طعم خیلی خوبی داره من مشتری ثابت شیلام 
مخصوصا این شعبه که حجم پنیرشم خیلی زیاده 
پیکم همیشه خوب بوده 
امیدوارم کیفیتتون همینطور بمونه",3941190
p624mo,10,HAPPY,غذا خوشمزه و با کیفیت فقط حجم غذا کم بود در کل راضیم عالی بود ,4994774
p624mo,10,HAPPY,به موقع رسید و پیتزا گرم بود خیلی خوشمزه و خوب بود ,3944932
p624mo,6,HAPPY,چند باری که همین چیکن استریپس رو سفارش دادیم همیشه یک طعم و خوب و خوشمزه و تازه بوده اما همیشه تقریبا ولرم بدسمتون رسیده که مجبور شدیم گرمش کنیم که کیقیتش میاد پایین. به نظرم باید در ارسال سریع و نوع بسته بندی یک بررسی مجدد بشه. ممنون,318406
p624mo,10,HAPPY,همه چی عالی بود ,3944437
p624mo,8,HAPPY,هم غذا گرم بود ، هم خوشمزه ، فقط  نون خیلی شبیه بربری بود:),4296625
p624mo,8,HAPPY,سرد‌بود خیلی,12225722
p624mo,10,HAPPY,غذا زودتر از زمان اعلامی وداغ رسید و خوب بود,6249901
p624mo,10,HAPPY,همه چی عالی بود,6194511
p624mo,10,HAPPY,خیلیییییییییی خوشمزه بود، کلی کیف کردیم، سر تیکه‌های نون پیتزاش دعوا بود.,9274227
p624mo,10,HAPPY,خوب بود ، و کیفیت هم عالی ، ممنون ، فقط یکمی سریعتر برسه همچی پرفکت میشد .,2208665
p624mo,2,SAD,"مواد پیتزا خیلی خیلی کم بود انگار نان خالی داریم میخوریم
افتضاح بود",3685598
p624mo,10,HAPPY,پیتزا پپرونی سفارش داده بودم و مثل همیشه واقعا با کیفیت و خوشمزه بود,4754688
p624mo,10,HAPPY,پیتزا خوب و خوشمزه بود ممنون ,6356495
p624mo,10,HAPPY,"پیتزا گرم و خوب بود، و از زمان تعیین شده‌هم یک ربع زودتر رسید
از لحاظ کیفیت و خوشمزگی هم خیلی خوب بود.",11082603
p624mo,10,HAPPY,خوشمزه,5357560
p624mo,2,SAD,سریع امد,6241704
p624mo,10,HAPPY,برخورد پیک خیلی خوب و مؤدبانه بود,1238501
p624mo,10,HAPPY,عالی بود.,12224557
p624mo,10,HAPPY,خیلیییی خوشمزه و داغ و به موقع ,796976
p624mo,10,HAPPY,عالی و گرم سپاس,2232632
p624mo,10,HAPPY,عالی مثل همیشه با کیفیت,4363805
p624mo,10,HAPPY,عالی,4363805
p624mo,10,HAPPY,مثل همیشه واقعا عالی,7956433
p624mo,10,HAPPY,خیلی سریع ارسال کردن,11696218
p624mo,10,HAPPY,اگر خیارشور بیشتر بود خیلی خوشمزه تر میشد,10592657
p624mo,6,HAPPY,با این که توی توضیحات گفتم سرد نباشه لطفا، ولی ولرم هم نبود یخ بود.,7040108
p624mo,10,HAPPY,خيلي عالي،گرم، سريع و خوشمزه ,5085684
p624mo,10,HAPPY,کیفیتش واقعا عالی هست ، تا حالا هر چی سفارش دادم عالی بوده ,8446769
p624mo,6,HAPPY,"سلام وقتتون بخیر 
من ۴ تا رست بیف سفارش داده بودم که اشتباه ۱ دونه دونر پیتزا واسم آورده بودن ",5689871
p624mo,2,SAD,"بیشتر از یک ساعت تاخیر واقعا قابل تحمل نیست. 
غذا رو سرد تحویل گرفتیم! تجربه‌ی بسیار بد. دیگه سفارش نمیدم از شیلا!",294087
p624mo,10,HAPPY,فاصله زمانی سفارش تا تحویل، کمی بالا بود,7904032
p624mo,10,HAPPY,خیلی خوش طعم و عالی بود,12117101
p624mo,2,SAD,پیتزا یه طرف سوخته یه طرف خام و کاملا غذا سرد بود و بی کیفیت,1979590
p624mo,10,HAPPY,استرامبولی ها واقعا لذیذ هستن . به دوستانم هم معرفی کردم همه خوششون اومد . ,9087385
p624mo,2,SAD,خیلی دیر رسید,256802
p624mo,8,HAPPY,پیتزا داغ و به موقع به دستم رسید و طعم خوبی هم داشت،ممنون از فست فود شیلا,1007055
p624mo,10,HAPPY,بسیار عالی و لذید بود، من واقعا لذت بردم،نسبت به بقیه فست فودی ها شیلا بهترین هستش و اینم بگم که تایم اماده سازی ۴۰ دقیقه زده بود ولی ۱۰_۱۵ دقیقه بیشتر طول نکشید اوردن برام،غذا گرم و بسیار خوب بود، یکی دیگه از نکات مثبت این بود که سیب زمینی خیلی زیاد ریخته بود و همینطور سالاد رایگان،من که واقعا راضی بودم،,8049836
p624mo,8,HAPPY,طعمش عالي و بينظير بود،ولي از حجمش خيلي كم شده،قبلا حجم غذا بيشتر بود اين سري كه سفارش دادم خيلي كمتر شده بود حجمش،و قيمتش نسبت به حجمش خيلي بالا بود,8501281
p624mo,10,HAPPY,خیلی خوب بود ,5373195
p624mo,10,HAPPY,از پیک شما بسیار متشکرم,1249221
p624mo,10,HAPPY,"عالی مثل همیشه
",3928496
p624mo,8,HAPPY,"پیتزا کاملا قابل قبول بود و نیم ساعته هم آوردن. 
ولی سالادش جالب نبود",11575123
p624mo,10,HAPPY,پیتزا دونر استیک. حرف نداره ,7904357
p624mo,10,HAPPY,"بسیار عالیه, کیفیت سیب زمینی سرخ کرده ها فوق العاده خوب بود, دلم میخواست پیتزاش کمی برشته تر باشه, ولی در کل راضی بودم از دوبار سفارشی که تحویل گرفتم",8634262
p624mo,10,HAPPY,عالیییی,7257876
p624mo,10,HAPPY,همیشه عالی,10942163
p624mo,6,HAPPY,کیفیت خوب بود ولی یخ یخ بود ساندویچ,200485
p624mo,0,HAPPY,پیتزا ها فوق العاده خوب هستن، همبرگر متاسفانه نونش از این بسته بندی ها (آماده) بنظر میاد و معمولیه، خیلی همبرگر خاصی نیست (بنظرم) جاهای دیگه همبرگر بهتر خوردم، ولی در کل خوبه,253684
p624mo,10,HAPPY,طبق معمول همه چی عالی. غذا با کیفیت و گرم به دستمون رسید و چیزی کم نداشت,274376
