restaurant_code,rating,feeling,commentText,customerId
p5ddx0,6,HAPPY,مرغ های سالاد سزار به قدری سفت و خشک و مونده بود که احساس میکردم چوبه. ,1211443
p5ddx0,6,HAPPY,ديگه غذا كيفيت قبل رو نداره و يك لايه مثل كاغذ استيك گذاشتيد,7381498
p5ddx0,6,HAPPY,سوپ پوره شده بود و تلخ بود پیتزا هیچ طعمی نداشت سربود و بسیار پنیر کنی داشت ,1100827
p5ddx0,2,SAD,خیلی بد,3349266
p5ddx0,8,HAPPY,سفارش ما خیلی سریع رسید فقط مثل دفعه های قبل استیک روی پیتزا اسفناج نرم و خوش طعم نبود اصلا استیک ها رو نتونستیم بخوریم و از روی پیتزا جدا کردیم,6728804
p5ddx0,8,HAPPY,کمی سرد بود و گوشت سفت بود,985008
p5ddx0,8,HAPPY,سوپ سرد به دستمون رسید و کمی شور بود به نسبت همیشه که همین سوپ رو سفارش می‌دادیم، طوری که دل رو می‌زد.,1381707
p5ddx0,8,HAPPY,"ظاهرا برگر در فر گذاشته میشه چون همه اجزا به شکل غیر عادی داغ بود ‌پخته شده 
سس رنچ فراموش شده بود ",7944663
p5ddx0,2,SAD,"با سلام 
در خصوص سفارش ارسالی متاسفانه متاسفانه و متاسفانه پیتزا تحویل داده شده سرد و قابل خوردن نبود و چون داخل پاکت گذاشته می شود وقتی متوجه شدم که دیگه کاری نمیشد کرد فاصله منزل تا رستوران دو چهار راه است چرا اینقدر ضعیف عمل میکنید متاسفانه جز ناراحتی برای من و خانواده و دور ریختن نصف بیشتر پیتزا چیزی بهمراه نداشت من چند سالی ست که خرید داریم و این آخرین بار بود",10752552
p5ddx0,6,HAPPY,کیفیت سالاد که واقعا پایین بود، مرغ نپخته و طعم بد، نسبت به قیمتش کاملا آماتور بود. طعم پیتزا نسبتا اکی بود ولی اونم جا داشت بیشتر تو فر باشه ولی رو هم رو رفته پیتزا قابل قبول بود,898806
p5ddx0,8,HAPPY,خوب,939548
p5ddx0,8,HAPPY,سیب زمینی ها خرابی داشتن همچنین از نظر پخت طعم و ادویه ضعف داشت. ,1011369
p5ddx0,2,SAD,"غذا بسیار بی کیفیت بود و هر بار که از این رستوران سفارش میدهیم ، هر دفعه بدتر از سفارش قبلی است، این بار که پیتزا مرغ پستو سفارش داده بودم، تنها چیزی که در پیزا نبود مرغ آن بود. در هر قسمت. پیزا (یکی در میان) یک تیکه بسیار کوچک مرغ بود. این دفعه آخرین بار خواهد بود که به آنجا سفارش خواهیم داد. 













",2557081
p5ddx0,10,HAPPY,"طعم و کیفیت غذا عالی بود 
اما سوپ بدون نان سرو شد",3529364
p5ddx0,8,HAPPY,نسبت به سابق کیفیت نداشت به نظرم امیدوارم مدیر رستوران در نظر بگیرد,12688246
p5ddx0,10,HAPPY,"بطور حتم مختار هستید recipe آیتم‌ها را مطابق میل و نظر خود تغییر دهید، با اینحال از تعاریف عرف هم نمیتوان گذشت.
۱- هرجا صحبت از اگ بندیکت می‌شود، منظور تخم مرغ بصورت poached است، نه تخم مرغ عسلی.
۲- حجم و اندازه‌ی محتویات مافن به مراتب از آنچه شما تعبیه میفرمایید، کمتر باید باشد.",155293
p5ddx0,10,HAPPY,بسته که پاکت بود پاره بود و باز ,7904073
p5ddx0,8,HAPPY,غذا نسبتا خوب بود اما کیفیت گذشته رو در کل نداشت!,12688246
p5ddx0,10,HAPPY,فوقالعاده عالی بود ,3961517
p5ddx0,6,HAPPY,نسبتا سرد،سس رقیق تا حدی چرب و مرغ خیلی خوب نبود,1126547
p5ddx0,6,HAPPY,کیفیت غذا خیلی پایین بود این سری و خیلی تعجب کردم .. امیدوارم کیفیت بالای غذاتون حفظ بشه,886221
p5ddx0,10,HAPPY,خیلی خوشمزه بود .,2695129
p5ddx0,8,HAPPY,پیتزا گرچه سرد بود اما خوشمزه بود اما سالاد معمولی بود,6559963
p5ddx0,10,HAPPY,"خیلی خوشمزه است سسش طعم بهشت میده
",5745348
p5ddx0,8,HAPPY,نون پنیر. معمولی بود,7875835
p5ddx0,8,HAPPY,سوپ اسفناج خیای شور بود من ادم نمک خوری هستم  پیتزا پنیرش خبلی کمه تقریبا هیچی حس نمیشه,7192425
p5ddx0,10,HAPPY,مثل همیشه عالی بود,6728804
p5ddx0,10,HAPPY,سفارش به موقع با کیفیت عالی به دستم رسید ,7438197
p5ddx0,4,SAD,غذا سرد سرد رسید به دستم و دوباره گرمش کردم. در توضیحات سس رنچ هم خواسته بودم که تماس گرفتند و گفتند ۱۵ هزار تومن هزینه ۱۰۰ سی‌سی سس رنچ هست، اگه میخوام پرداخت کنم!,3386360
p5ddx0,8,HAPPY,خوب بود فقط دیر رسید و سرد بود ,12063227
p5ddx0,10,HAPPY,عالی بود .,1474103
p5ddx0,2,SAD,به نسبت قیمتی که پرداخت کردیم اصلااا نمی ارزید!! قد کف دست هم نمیشد! سیب زمینی ها انقدر شور و باریک بودن که نمیشد فهمید چیه! غذا کاملا سرد به دستمون رسید!! پول پیک ۲۰ تومن بود، و واقعا قیمت زیادیه واسه ی من که خونه م نزدیکه! اصلا پیشنهاد نمیکنم.,3579033
p5ddx0,10,HAPPY,پیتزا استیک‌خیلی خوب بود ولی ساندویچ‌کمی‌پیاز‌کاراملیش بیش از اندازه زیاد بود,7626369
p5ddx0,10,HAPPY,بسیار سبک و عالی,797766
p5ddx0,10,HAPPY,عالی از همه نظر,985008
p5ddx0,4,SAD,جوجه كباب بسيار بي مزه بود,3833130
p5ddx0,8,HAPPY,متاسفانه کیفیت این رستوران نسبت به قبل بسیار پائین اومده است,419023
p5ddx0,10,HAPPY,عاشقشم.,8739550
p5ddx0,10,HAPPY,خوب بود,8088710
p5ddx0,10,HAPPY,خیلی عالی بوووود,7062783
p5ddx0,10,HAPPY,خوشمزه بود دوسش داشتم,6130607
p5ddx0,10,HAPPY,با کیفیت و سالم,3587118
p5ddx0,10,HAPPY,مثل همیشه با کیفیت,3213432
p5ddx0,10,HAPPY,مثل همیشه عالی,4763215
p5ddx0,10,HAPPY,عالی کیفیت خیلی درجه یک,623920
p5ddx0,10,HAPPY,مثه‌همیشه عالی,5261734
p5ddx0,8,HAPPY,لازانیا در ظرف مناسبی سرو نشده بود. و وقتی به دستم رسید از گوشه های ظرف المینیومی ریخته بود و حتی پاکت کاغذی حمل رو هم خیس و پاره کرده بود .,3387936
p5ddx0,10,HAPPY,صبحانه عالي بود,3154468
p5ddx0,10,HAPPY,فقط سس سیب زمینی خیلی کم بود نسبت به حجم سیب زمینی و‌ من عاشق سیب زمینی و سسش هستم عالییهههه,7435055
p5ddx0,10,HAPPY,جو همواره بهترینه,2437973
p5ddx0,10,HAPPY,جو که خفنه کلا,8456879
p5ddx0,10,HAPPY,کیفیت عالی، قیمت بالا,1895966
p5ddx0,10,HAPPY,واقعا خوشمزه,4483790
p5ddx0,6,HAPPY,حجم مرغ نسبت به همیشه کمتر بود,12618486
p5ddx0,2,SAD,یک بسته خالی سوپ سبز در جعبه من بود که من سفارش نداده بودم. مستقیم رفت سطل زباله,3745249
p5ddx0,8,HAPPY,سوپ ولرم‌بود,8981780
p5ddx0,10,HAPPY,برگر خیلی خوب بود. ممنون,402895
p5ddx0,10,HAPPY,همه چیز خوب بود,181980
p5ddx0,10,HAPPY,واقعاااا عالی ,2536307
p5ddx0,10,HAPPY,سالاد مرغ و گردو مثل همیشه عالی,4050445
p5ddx0,10,HAPPY,با کیفیت و عالی ,11364569
p5ddx0,10,HAPPY,مثل همیشه لذیذ و خفن,406621
p5ddx0,10,HAPPY,سالاد و سس آن بسیار خوشمزه بود.امیدوارم که روز به روز هم بهتر بشه.,260774
p5ddx0,10,HAPPY,کیفیت عالی,4763215
p5ddx0,10,HAPPY,عالی بود ممنون,331142
p5ddx0,10,HAPPY,خوشمزه بود من دوست داشتم,6559963
p5ddx0,10,HAPPY,همه چی عالی واقعا یکی از بهترین ها,985008
p5ddx0,10,HAPPY,مثل همیشه عالی,4763215
p5ddx0,10,HAPPY,باترچیکن عالیه,224341
p5ddx0,10,HAPPY,طعم و کیفیت مناسب,13445877
p5ddx0,10,HAPPY,عالی,985008
p5ddx0,10,HAPPY,برگرها همگی خوش طعم و عالی و بسیار مواد باکیفیتی استفاده شده بود و بسته بندی مناسبی داشت,980934
p5ddx0,10,HAPPY,دیگه بهتر ازاین از کیفیت مزه و همه چیز ممکن نیست ,3707074
p5ddx0,2,SAD,من همیشه طرفدار غذاهاشون بودم ولی جدای از ابنکه با تاخیر اعلام شد پیترا قابل تحویل نیست، ساندویچ مرغ پستو شامل مرغ نپخته و تعدادی ریحون بود با سس سفید!!!!,9353343
p5ddx0,10,HAPPY,به به فقط میتونم بگم,8456879
p5ddx0,10,HAPPY,مثل همیشه غذا عالی و پیک هم زود اومد,2437973
p5ddx0,10,HAPPY,غذاش خوب بود. ارسالش طولانی شد ولی سیب زمینی اضافه جبرانش کرد. پنج تا ستاره رو به خاطر مشتری مداری میدم.,5128176
p5ddx0,10,HAPPY,تاخیر در ارسال بود. کیفیت خیلی خوب بود.,10368050
p5ddx0,6,HAPPY,به جز پیتزا و سالاد و سیب زمینی غذای دیگه می گیرم پشیمان میشم بخاطر مزه و کیفیت,1284681
p5ddx0,10,HAPPY,اولین‌بار بود صبحانه سفارش میدادم و عالی بود,130338
p5ddx0,10,HAPPY,عالی,4551127
p5ddx0,10,HAPPY,فوق العاده تازه و با کیفیت بود,7679518
p5ddx0,10,HAPPY,عالی بود,7056279
p5ddx0,10,HAPPY,"من همیشه غذاشو دوست دارم 
البته نسبت به مواد داخل خیلی گران شده و همچنین به خاطر بسته بندی خاصش هزینه اش رو از شما می گیرند که چاپ ابنهمه پاکت برای داستان های مختلف هزینه بر است و یک فکری باید بکنند",150349
p5ddx0,2,SAD,خیلی خیلی سیر و پیاز داشت,1211761
p5ddx0,10,HAPPY,عالي بود ممنون,207955
p5ddx0,10,HAPPY,عالی,5097586
p5ddx0,10,HAPPY,عالی,3287674
p5ddx0,10,HAPPY,عالیییییی,11469728
p5ddx0,10,HAPPY,ممنون. پیک عالی و غذا عالی ,402895
p5ddx0,10,HAPPY,بهترین تجربه صبحانه از اسنپ فود,3745429
p5ddx0,10,HAPPY,سالاد مورد علاقه من   ممنون,948164
p5ddx0,6,HAPPY,ما هفته پیش همین سفارش رو با ۴۰ درصد قیمت ارزان تر سفارش دادیم، و امروز با تخفیف چهل درصدی قیمت هفته پیش شده بود، و تاخیر هم در ارسال وجود داشت.,181786
p5ddx0,10,HAPPY,عالی بود,1180593
p5ddx0,10,HAPPY,خیلی کیفیت خوبی داره غذاتون,4121726
p5ddx0,10,HAPPY,پیتزای خوبیه واقعا,131784
p5ddx0,10,HAPPY,کیفیت سوپ عالی و خوشمزه ,394279
p5ddx0,10,HAPPY,پيتزا سرد بود,2342139
p5ddx0,10,HAPPY,"غذا یه کوچولو سرد بود 
ولی غیر از اون عااالی بود",6463011
p5ddx0,10,HAPPY,پیتزاهای جوگریل خداییش عالیه، جز بهترین پیتزاهای مملکته,1791102
p5ddx0,10,HAPPY,مثل همیشه عالی ,156586
p5ddx0,10,HAPPY,عالی,7573509
p5ddx0,10,HAPPY,عالی، حتما تست کنید.,1382027
p5ddx0,8,HAPPY,خوشمزه و گرم بود فقط دیر تحویل شد,1082087
p5ddx0,8,HAPPY,"نان ساندویچ‌ها عالی مخصوصا چاباتا ولی استیک سفت بود کمی
دیپ گوجه هم عالی بود",231730
p5ddx0,10,HAPPY,هم کیفیت عالی هم زمان ارسال عالی بود,193270
p5ddx0,6,HAPPY,بسیار با تاخیر زیاد تحویل پیک شد,7544049
p5ddx0,8,HAPPY,خوشمزه بود ,4920143
p5ddx0,10,HAPPY,عالی,2791393
p5ddx0,8,HAPPY,غذا سرد بود,3773966
p5ddx0,10,HAPPY,عالی مثل همیشه,882612
p5ddx0,8,HAPPY,لطفا آپشن سفارش سس اضافه رو اضافه کنید ,3542524
p5ddx0,4,SAD,گوشت پیتزا بشدت سفت بود,783808
p5ddx0,10,HAPPY,یعنی سالاداتون عشقن,2244932
p5ddx0,10,HAPPY,سالسیجا خیلی خوب بود,3604388
p5ddx0,10,HAPPY,عالی بود,13763035
p5ddx0,10,HAPPY,عالی,11216488
p5ddx0,10,HAPPY,عالی بود ,3386839
p5ddx0,10,HAPPY,عالی,12292835
p5ddx0,10,HAPPY,"من عاشق سس سبز سالاد مرغ و گردوم عالیه
غذا هم خوب بود",7922165
p5ddx0,10,HAPPY,خوب بود ,3604388
p5ddx0,10,HAPPY,Ok,3548272
p5ddx0,10,HAPPY,عالی بود ,5224881
p5ddx0,8,HAPPY,سالادمثله همیشه عالی اما مرغ چیز خاصی نبود,7062783
p5ddx0,10,HAPPY,یکی از با کیفیت‌ترین رستوران‌های تهران که همیشه کیفیت خوبش رو حفظ کرده.,724386
p5ddx0,10,HAPPY,غذای سالم ‌تازه واقعا عااالی,6191768
p5ddx0,10,HAPPY,حرف نداره,172075
p5ddx0,10,HAPPY,عالی ,7573509
p5ddx0,10,HAPPY,همه چی عالی بود,3759224
p5ddx0,2,SAD,"غذا کاملا سرد بود
سیب زمینی ها ماسیده بود از سرما
فاصله جو تا خونه ما ۲ دقیقه است",330656
p5ddx0,10,HAPPY,خیلی خوشمزه بود ,4157517
p5ddx0,10,HAPPY,عالی,6218853
p5ddx0,10,HAPPY,غذاها بسیار خوشمزه بودند,7019922
p5ddx0,6,HAPPY,پیتزا ها سرد شده بودند و قابل خوردن نبودن,746530
p5ddx0,10,HAPPY,خوب بود ,2358774
p5ddx0,2,SAD,رستوران خوبیه ولی این غذارو کلا حذف کنید فلفل و پیازچه هم نداشت ,1284681
p5ddx0,10,HAPPY,سس پستو عالی بود ساندویچ هم تازه و خوب بود.,4806115
p5ddx0,2,SAD,"سالاد سزار نبود اصلا!
یه سالاد دیگست اینی که فرستادین!!
مرغ یخ زده توش بود!
پیتزا هم که خمیرش قابل خوردن نبود اصلا!!
امتیاز ۱ هم زیاده برای این غذاهای به شدت بد!!!",4570285
p5ddx0,2,SAD,زمان آمدن سفارش تقریبا دوساعت بود و در آخر سرد سرد رسید واقعا افتضاح دیگر اصلا گرسنه نبودیم!!,1315077
p5ddx0,6,HAPPY,غذا بسیار سرد بود,4318749
p5ddx0,4,SAD,بعد از ۲ ساعت یه غذای یخ تحویل گرفتم,260574
p5ddx0,2,SAD,مرغ خیلیی سوخته و زغال بود و طعم سس و تمام سبزیجات هم افتضاااح بود، من قبلا چند بار این غذا رو سفارش دادخ بودم، اما اینبار مستقیم انداختم تو سطل زباله,7233228
p5ddx0,2,SAD,۱۰۰ هزار تومن پول یه دونه پیتزاتونه که با دو ساعت تاخیر و یخ تحویل بشه,3277914
p5ddx0,10,HAPPY,عااالی,7883256
p5ddx0,10,HAPPY,عالیییی,346634
p5ddx0,10,HAPPY,همه چی خوب بود فقط درخواست سس سالاد داشتم که فراموش شده بود ,1269245
p5ddx0,0,SAD,غذا به موقع و مرتب رسید. طمع سوپ اسفناج مثل همیشه بود اما متاسفانه نه تنها پیتزا کاملاٌ سرد بود (از نظر سر بودن مشکلی نیست چون در شرایطی قرار داریم که تمام غذاها باید مجدد گرم شود)، من مشتری همیشه هستم پیتزا از لحاظ طعم اصلاٌ کیفیت سابق را نداشت و طعم مونده می داد.,7443390
p5ddx0,8,HAPPY,گوشت استیک سفت بود پیاز زیاد داشت ولی نان بسیار خوشمزه بود ولی ساندویچ‌خیلی کوچک وقیمت بالا,7736087
p5ddx0,10,HAPPY,خیلی عالی بود,3387001
p5ddx0,10,HAPPY,کیفیت عالی ولی گرون,184728
p5ddx0,2,SAD,حقتون نمره ی صفر بود با این ارسالتون,4371694
p5ddx0,8,HAPPY,غذا خیلی سرد بود... سیب زمینی ها انگار از ساعت ها پیش مونده بودن.,466513
p5ddx0,8,HAPPY,خوشمزه و قابل قبول بودن. ,8014249
p5ddx0,2,SAD,کاملا سرد شده بود ,1000329
p5ddx0,4,SAD,پیتزا روکولا واقعا چند جور پنیر نبود. مثل یه تکه نون لواش خشک با یه کم پنیر بود. خیلی کوجک و خیلی بی طعم و واقعا ارزش این رقم رو نداشت. البته پیتزا استیک مثل همیشه خوشمزه بود. ,4445376
p5ddx0,2,SAD,غذا کاملا سرد تحویل شد ,150783
p5ddx0,4,SAD,پنه ها کاملا خام بودن مقدارش خیلی کم بود وهمچنین دریغ از یک مقدار کم سس پاستا خشک خشک ,3322809
p5ddx0,2,SAD,"اگر میشد صفر ستاره میدادم، با تاخیر بیشتر از یک ساعت و نیم درنهایت پیک رستوران سفارش رو آوردن
",161073
p5ddx0,4,SAD,متاسفانه خوشمزه نبود و بنظرم از ديروز مونده بود,941591
p5ddx0,6,HAPPY,از نظر كيفيت غذاها عالى اما خيلي باتاخير دريافت شد و خيلي هم سرد بود,708340
p5ddx0,8,HAPPY,برگر خوب بود ولی سیب زمینی سرد و مونده بود!!,2548378
p5ddx0,2,SAD,ماهی سالمون سفارش داده شده ولی ماهی سالمون ارسال نشده، ماهی دیگه ای که هیچ ارتباطی به سفارش نداره ارسال شد,3441502
p5ddx0,4,SAD,غذا سرد بدستم رسيد كه مجبور شدم گرم كنم ، كيفيت غذا نسبت به قبل كمى پايين امده متاسفانه,2639374
p5ddx0,10,HAPPY,عالی و باکیفیت,2437973
p5ddx0,10,HAPPY,عالی بود تشکر,10752552
p5ddx0,10,HAPPY,بسیار عالی و خوشمزه،ممنون از جو.من اولین بار بود که از این رستوران غذا سفارش دادم،واقعا از انتخابم خوشحالم و حتما از مشتری های ثابتتون خواهم شد،هم خوشمزه و هم با کیفیت,2452424
p5ddx0,10,HAPPY,بسيار راضي هستم، فقط اگه ممكنه دوباره پوره سيب زميني رو به منو اضافه كنيد ,6531573
p5ddx0,2,SAD,غذا کاملا سرد تحویل شد,883188
p5ddx0,6,HAPPY,"برای دو عدد سالاد و یک ‌سیب زمینی یک ساعت و نیم معطل شدیم.
تاخیر این رستوران نقطه منفیش به حساب میاد. همیشه با تاخیر ارسال میشه و خیلی طولانیه زمان آماده سازیش",3372167
p5ddx0,10,HAPPY,عاااااالی,6768394
p5ddx0,0,SAD,پیتزا کاملا مچاله و به هم ریخته دریافت شد. عکس موجود است.,158315
p5ddx0,6,HAPPY,"به علت تاخیر خیلی زیاد
البته دلم نیومد کمتر بدم",4371694
p5ddx0,8,HAPPY,خوشمزه و با کیفیت فقط کوچیکه ,10552778
p5ddx0,8,HAPPY,طعم و‌ مزه عالی فقط تو رو خدا انقد روغن رو پیتزا نریزید، پیتزا به اندازه نازک هست، روغن هم روش میربزید خیلی چرب میشه، حتی کاغذ زیر پیتزا هم چرب میشه,146065
p5ddx0,0,HAPPY,پیتزا استیک بسیار خوشمزه بود.,3488995
p5ddx0,4,SAD,خيلي معمولي بود و خشك شده بود سيب زميني ,1590015
p5ddx0,10,HAPPY,خیلی به موقع و زود و کاملا گرم رسید فقط خیلی نسبتا گرون بود ب حجمی ک داشت,4330187
p5ddx0,6,HAPPY,پيتزا خيلي خيلي خيلي سرد بود.,7833392
p5ddx0,2,SAD,پیتزا خمیر و زمانی که به دستم رسید مثل ساندویچ لقمه تحویل گرفتم. کاملا در جعبه بهم ریخته بود و مچاله شده بود,178413
p5ddx0,2,SAD,سرد بودن پيتزا مثل هميشه,6283732
p5ddx0,2,SAD,به علت تاخیر در ارسال بار آخری هست که سفارش با اینکه بیشتر از صد بار سفارش داده بودم و‌ فکر کنم شما ثابت ترین مشتریتون رو از دست دادید,4371694
p5ddx0,2,SAD,سرد بودن پيتزا مثل هميشه,6283732
p5ddx0,10,HAPPY,حلالتون باشه.,2037721
p5ddx0,10,HAPPY,"تازگی سه بار سفارش دادم دوبار واقعا عالی بود. یکبار ظاهرا زیاد مونده بود پیتزا و یکم سوخته بود و طعم عالی همیشگی رو نداشت. یکبار دیگه هم میگیرم اگر مثل همیشه بود که مشتری میمونم اگر نه که دیگه خداحافظی میکنیم
ولی اگر مثل همیشه باشه این گیتزا یکی از لذیذ ترین پیتزاهاییه که خوردم",717148
p5ddx0,2,SAD,سفارش بیشتر از یک ساعت زمان برد اماده بشه و بعد از پیگیری که نوشته شد پیک در حال آمدن است هم مسیر ۳ ۴ دقیقه ای را تقریبا نیم ساعت زمان برد برسه، از بابت کیفیت غذا هم پیتزا به درستی برش نخورده بود و هر یه تیکه ای که بر میداشتیم به سختی باید باز با چاقو جدا میکردیم و شدیداً هم سرد شده بود غذا,2325824
p5ddx0,2,SAD,پیک شما ماسک نداشت و بنابر مقررات اجازه ورود به برج ما را نداشت و با توجه به شرایط خاصی که داشتم تحویل غذا دم در ورودی برج از ایشان برای من واقعا سخت بود.,4262426
p5ddx0,10,HAPPY,همه چیز خوشمزه و عالی بود,992877
p5ddx0,10,HAPPY,باسلام مثل همیشه عالی.فقط پول پیک خیلی زیاده.تشکر,8103238
p5ddx0,6,HAPPY,درب سالاد باز شده بود و موادش ریخته شده بود تو کیسه,3506413
p5ddx0,6,HAPPY,"سالاد خوب بود
اما پیتزا واقعا مرغ و بقیه موادش خیلی کم بود. ",3305420
p5ddx0,8,HAPPY,خوشمزه بود مرسی ولی یادمه خیلی از این بهتر بود,1796766
p5ddx0,8,HAPPY,با تاخیر نیم ساعته رسید ولی کیفیت مثل همیشه خوب بود ,5130539
p5ddx0,6,HAPPY,خیلی سرد رسید. ,3372167
p5ddx0,10,HAPPY,فقط سس سالاد . عالی عالی عالی,3506413
p5ddx0,10,HAPPY,عالی بود ممنون,4763215
p5ddx0,6,HAPPY,با تاخیر زیاد به دستم رسید,10424661
p5ddx0,10,HAPPY,مثل همیشه محشر بود,406621
p5ddx0,4,SAD,سرد بودن غذا,6283732
p5ddx0,10,HAPPY,خوشمزه و داغ,7113051
p5ddx0,4,SAD,جا افتاده نبود,1620578
p5ddx0,10,HAPPY,عال بود خوشمزه داغ و سر وقت .ممنون از شما,383604
p5ddx0,8,HAPPY,متاسفانه سفارش کمی دیر به دستم رسید و جوجو فرایز کمی سرد شده بود  ولی در کل خوب و قابل قبول بود,4371694
p5ddx0,10,HAPPY,عالی مثل همیشه,10424661
p5ddx0,10,HAPPY,مثل همیشه عالی و دوس داشتنی،  مشتری همیشه شما هستم,5370457
p5ddx0,10,HAPPY,خیلی خوب بود ,3306966
p5ddx0,8,HAPPY,"مثل همیشه خوشمزه بود 
فقط یکم سرد بود",215770
p5ddx0,8,HAPPY,عالی عالی ,7171316
p5ddx0,10,HAPPY,ممنونم از همگی شما، دست شما درد نکنه، عالی منظم مرتب,3514113
p5ddx0,10,HAPPY,درجه یک تو شهرک غرب و سعادت آباد و تهران و ایران ,663220
p5ddx0,10,HAPPY,عالی ,4902541
p5ddx0,10,HAPPY,"متشكرم واقعا زحمت كشيديد سفارش من را تغيير داديد 
سپاس ",982530
p5ddx0,10,HAPPY,عالی ,4902541
p5ddx0,2,SAD,"الان دو ساعت بعد از سفارش ،
غذا رو کاملا سرد شده تحویل گرفتم.
آنهم بعد از دوبار اعلام تاخیر.
پیک اظهار میکرد که ۱۰ دقیقه ی پیش غذا رو تحویل گرفته.
پ.ن
سوای این موضوع کیفیت غذا مثل همیشه خوب بود.",4511473
p5ddx0,10,HAPPY,کیفیت عالی بود و سفارش ها داغ داغ و سریع رسید . ممنون,6728804
p5ddx0,4,SAD,"۲امتیاز فقط برای طعم برگر
سفارش با چهل دقیقه تاخیر ارسال شد، غذا سرد شده بود، ساندویچ چیکن بسیار شور و به دلیل حجم بالای پنیر طعم خوبی نداشت",3280132
p5ddx0,8,HAPPY,"خسته نباشید
پیتزا عالی و لازانیا حجم کم
نکته منفی سیب زمینی بود ب نظرم مانده و خشک بود .خیلی خلالی بود
زمان تحویل سفارش خیلی طولانی بود",165461
p5ddx0,10,HAPPY,مزه خوبی داشت و خیلی سریع به دستم رسید,4783086
p5ddx0,8,HAPPY,عالی,8699472
p5ddx0,10,HAPPY,همه چیز عالی. مخصوصا پیتزا مرغ آلفردو خیلی خوشمزه بود. ۲۰ دقیقه زودتر هم رسید. متشکر,1093447
