restaurant_code,rating,feeling,commentText,customerId
3271je,0,SAD,دیر اومد ..قبول دارم ما هم دیر رفتیم دم در اما برخورد پیک مناسب نبود ..سالاد تقریبا خوب بود اما اون قدر هم عالی نبود ..سس هم بد نبود اما یکم زیاد بر پایه ی روغن زیتون بود و دو فاز ..کیک شکلاتی خوش مزه بود ..پر از شکلات با مقداری کینوا ..برا کیک ها قاشق باشه هم خوب_,4029027
3271je,2,SAD,پیک غذا روتحویل نگهبانی داده بود و رفته بود,530128
3271je,8,HAPPY,"نان فتوش فقط يك تكه كوچك بود در صورتيكه قبلا چند تكه نان روى سالاد بود 
اسم سالتد ، سالاد فتوش بود ولى نان فتوش ه اون خيلى كم بود",1959097
3271je,0,SAD,غذا کاملا سرد و تاخیر ,393506
3271je,0,HAPPY,همه چیز عالی، کیفیت و حجم سالاد و سس همراهش، حتی زمان تحویل ,294303
3271je,6,HAPPY,زمان ارسال که خیلی طولانی بود، حداقل انتظار از یه سالاد ساده با این قیمت متریال تازه هست، آووکادو فوق‌العاده مونده و خشک بود و رنگش به سیاهی میزد! ,3794695
3271je,0,HAPPY,"حجم سالاد عالی بود طعم سس فوق العاده بود ....
قیمت ی کم بالاست فقط
و این ک تا موقع پرداخت برای من هزینه ارسال رو 0 زده بود ولی بعدش دیدم که 5 هزار تومن هزینه ارسال داره...!
بهتره از همون اول بزنید هزینه ارسال رو نه موقع پرداخت",296068
3271je,0,HAPPY,تقريباً آووكادويى نبود تو سالاد,2347848
3271je,0,SAD,همیشه زمان بندی افتضاحه، وقتی ۱ ساعت زمان میدن برای ارسال همیشه نزدیک دوساعت طول میکشه تا بدست من برسه ، من کامنت دوستان رو هم که خوندم این مشکل تازگی نداره منتها تعجبم از اینه که چرا این نقیصه رفع نمیشه اگر مدتهاست همه از تاخیر این رستوران شاکی هستن چرا شما براشون جریمه قائل نمیشین یا حداقل اولتیماتوم نمی‌دین که رفع کنن مشکل زمانبدی رو . سپاس,252317
3271je,6,HAPPY,"حجم مرغ سالاد کم بود و اینکه فکر میکنم در صبح مرغ ها را درست میکنند بعد به سالاد اضافه میشود که زیاد تازه نبود.
مرینیت مرغ هم جالب نبود",172434
3271je,8,HAPPY,سرکه سس سالاد خیلی زیاد بود. کاهو ها تازه بودند. سریع رسید . من کیک هارو دوس داشتم ,288124
3271je,6,HAPPY,٢ساعت تحويل غذا دير نيست ؟!؟!؟,3786810
3271je,10,HAPPY,عاالی بود هم سس و هم تازه بودن سالاد,251729
3271je,2,SAD,یه سالاد افتضاح فقط اسمش سزار بود همش کاهو بود ,5028623
3271je,10,HAPPY,عالی ,1104909
3271je,6,HAPPY,بعد از ۲ ساعت بالاخره رسید ,182613
3271je,8,HAPPY,"متاسفانه این بار استیک مرغ سوخته بود. اما همیشه عالی  هست. 
البته مجددا علی رغم درخواست من قاشق یه بار مصرف نگذاشته بودند",835158
3271je,0,SAD,"
حجم سالاد نسبت به قبل خیلی کم شده ، من ظرف های قبلی این  مجموعه رو دارم و مقایسه میکنم، و سهم کاهو قالب بر کل متریال است
ضمن اینکه مرغ اصلا گریل نیست و خیلی بوی زحم میده
تمام حجم سالاد کاهو بود و چقدر عجیب که بابت این همه هم هزینه دریافت میکنید",267271
3271je,0,SAD,مرغش کهنه بود,724272
3271je,0,HAPPY,بی نظیر بود، ممنون واقعاً,154104
3271je,10,HAPPY,سالاد خوب بود و سس خوش‌طعمی داشت، مدت زمان ارسال خیلیییی طولانی بود!,3794695
3271je,10,HAPPY,خیلی خوشمزه بود و تازه ^_^,6753210
3271je,6,HAPPY,سس سالاد مثل سابق نبود و بی طعم و رقیق بود,3570167
3271je,10,HAPPY,من که مشتریش شده ام هفته ای سه بار سفارش میدم . برای همکارهام هم میگیرم .خلاصه اگه رژیم دارید و وقت ندارید ناهار برای خودتون آماده کنید سالاد های فرش باکس عالیه,1543833
3271je,0,HAPPY,مدت زمان ارسال سفارش برای یه سالاد از پیش آماده، خیلی زیاده، سس همراه سالاد برای اون حجم سالاد کمه، به طوری که فقط روی سالاد به سس آغشته شد و پایینش موند، مرغهای سالاد خوشمزه بود و خوب پخته شده بود. ممنون,718148
3271je,0,SAD,"کاهو ها برخلاف گذشته پلاسیده بود
",1346065
3271je,0,SAD,"سلام
تکه های مرغ کاملا سوخته و کهنه بود.",126936
3271je,2,SAD,افتضاح ترین طعم مرغی که تا الان چشیدم، از فرش باکس انتظار نداشتم,580092
3271je,0,HAPPY,سسش خیلی خوب نبود,894423
3271je,4,SAD,جینجر نداشتند که به جاش برام خاکشیر فرستادن که بی نهایت شیرین بود,3910884
3271je,10,HAPPY,بسيار عال,312606
3271je,4,SAD,"چهار تیکه کوچیک نان تست داشت پنیر پارمزان خیلی خیلی کم یعنی اصلا نداشت 
باتوجه به قیمت اصلا اصلا نمی ارزید
فقطمیگوها خوشمزه بود که اونم چهارتا دونه بود
کله ظرف با کاهو پرشده بود
موهیتو دستاز بود که اصلا بازش نکردم اینقد ظاهرش کثیف بود",3371490
3271je,10,HAPPY,علیرغم اینکه گرانولا بار رو انتخاب کرده بودم اما شیرینی شکلاتی ارسال شده بود.,305096
3271je,6,HAPPY,من مشتری فرش باکس هستم،ولی غیر از زمان یک ساعته برای حاضر کردن یک سالاد این بار از کم بودن حجم مرغ سالاد و یه بند انگشت فلفل دلمه ای خیلیییی ناراضی بودم,2224352
3271je,2,SAD, سوپ سبز اصلا خوب نبود ماست و گرانولا خوب بود ولی ایکاش کالری همه غذاها رو بنویسید,6754734
3271je,2,SAD,"چرا اینقدر مزه سس ها عوض و رقیق شدند !! اصلا اینبار طعم خوبی نداشت و باز هم تاخیر داشت
نمیدونم  چرا اصول مشتری مداری رعایت نمیکنید",1462265
3271je,6,HAPPY,متاسفم که فرش باکس همچنان هیچ فکری برای تاخیرهاش نکرده!!,3609953
3271je,0,HAPPY,"خوب بود در کل 
البته قبلا راضی تر بودم از لحاظ مزه",2078200
3271je,8,HAPPY,سس سبز سفارش داده بودم ولی سس سزار ارسال شد,647011
3271je,0,SAD,متاسفانه مرغ کهنه بود و غیر قابل خوردن,150613
3271je,8,HAPPY,بر خلاف جزئیات ذکر شده در منو، گوجه خشک و گوجه گیلاسی گذاشته نشده بود.,884958
3271je,0,SAD,"سس واقعا داغون بود
میگوهاشم با عکس کلا فرق داشت",349484
3271je,0,HAPPY,واقعااااااا عالی و عالی و عالی و از اون هم بهتر که این سری اسنپ هم زودتر به دستم رسوند سالاد رو ممنونممم,3625032
3271je,10,HAPPY,عالي ترين سالادي بود كه تا الان خوردم. ممنونم ازتون. من جزو مشترياي ثابتتوون شدم از الان.  حجم زياد در برابر قيمت. نوشيدني و دسر بعدش كه انتخابي و رايگان بود عالي ترش كرد.  . ,1313573
3271je,0,HAPPY,"با سلام
همه چیز عالی بود و واقعا انتقادی نیست. 
قیمت سالاد کمی بالاست که دیگر به گرانی عادت کردیم!",742692
3271je,0,HAPPY,طعم ساندویج رو دوس داشتم خوشمزه بود.,4707848
3271je,0,SAD,سالاد کینوا پر از کاهو !‌به نظرم سالاد کاهو بود با تزیین کینوا,4136931
3271je,10,HAPPY,سس سماق بسیار بد طمع بود .. گوجه ها از این گوجه بزرگا بودن ... مقدار ماهی تن موجود در سالاد هم کم بود نان پیتا روی سالاد فتوش خیس خورده بود انقدر که مونده بود توی سالاد,3380824
3271je,0,HAPPY,عالی,4968607
3271je,6,HAPPY,سلام. به جای سالاد سزار، سالاد چاینیز فرستادین. بعید بود از فرش باکس!,365397
3271je,2,SAD,افتضاح,3419262
3271je,10,HAPPY,"تاخیر بیش از حد، کیفیت خوب
",860214
3271je,2,SAD,بعد از ۲ساعت رسید،مرغ ها نپخته بود.کیفیت با قبلا خیلی فرق کرده,155480
3271je,0,HAPPY,سالاد سزار طعم خیلی خوبی داشت. ولی نوشیدنی موهیتو خوب نبود,260071
3271je,2,SAD,"واقعا باورنکردنیه بعد از دوساعت فاصله زمانی و ۴ بار اعلام تاخیر ساعت ۴ونیم سالاد به دستمون رسید !!! سس ها هم که رقیق شده و مقدار مرغ کمتر‌.. 
و در کل بدون هیچگونه عذرخواهی از طرف رستوران واقعا ناراحت کننده هست ",1462265
3271je,0,HAPPY,واقعا سالادها عالی هستن فقط باید از یک ساعت قبل سفارش بدید. برای من بیشتر از یک ساعت طول کشید تا غذا برسه,326114
3271je,4,SAD,برای چندمین بار است که نوشیدنی همراه سالاد بصورت دلخواه رستوران گذاشته می شود و نه آنچه بنده سفارش داده بودم.,6339500
3271je,8,HAPPY,خیلی خوب بود، ممنون از کوکی اشانتیون,327687
3271je,2,SAD,غذا دقیقا با ۲ ساعت تاخیر به دست من رسید . ساعت ۱۲:۴۰ دو تا سالاد سفارش دادم ساعت ۲:۵۰ به دستم رسید.,287513
3271je,0,HAPPY,قبلا سس این سالاد بهتر و غلیظ‌تر بود. الان خیلی رقیق شده بود و به خوبی قبل نبود. بقیه چیزها عالی بود.,556888
3271je,6,HAPPY,روی هم رفته بد نبود. اما سالاد و نوشیدنی هردو بسیار گرم و تقریبا داغ بودند که چندان دلچسب نبود. ,1510679
3271je,0,HAPPY,پك قاشق و چنگال فرستاده نشده بود,1167691
3271je,0,HAPPY,هر دفعه خوب بود اینسری سالاد اسفناج مخلفات داخلش کم بود و بیشتر اسفناج بود و سسش هم مثل سریای قبل نبود خیلی آبکی بود.,714902
3271je,0,SAD,سفارش من کمبو بود ولی نوشیدنی و شیرینی ارسال نشد. پیگیری هم کردم و گفتند ارسال میشه ولی چیزی ارسال نشد.,177336
3271je,0,SAD,"با توجه به اینکه بار اولی نیست که رپ مرغ از فرش باکس سفارش میدهم و دفعات قبلی کیفیت و زمان تحویل مناسب بوده.
ولی اینبار کاملا پشیمان شدم از سفارشی که دادم.
اول اینکه غذا را با تاخیر زیادی دریافت کردم که دوبار اعلام تاخیر کردم. 1ساعت و 50 دقیقه طول کشید تا یه رپ مرغ و سالاد بدستم برسه.
دوم رپ مرغ بسته بندی خیلی نامناسب بود، کاغذی که برای رپ پیچیده شده بود خیس شده بود و کاملا به نان چسبیده بود. نان بسیار نازک بود و تکه تکه شده بود که تمام مواد از نان بیرون ریخته بود و به سختی قابل خوردن بود.
خیارشور رپ بشدت شور بود و تنها طعم غالب فقط خیارشور بود. مرغ رپ هم طعم جالبی نداشت.",1563103
3271je,0,HAPPY,خیلی دیر میاد اما کیفیتش عالیه,168224
3271je,8,HAPPY,من قبلا از این رستوران سالادای مختلف رو امتحان کردم و چند سری پشت سره هم اخرین بار سالادایی بودن ک مرغ داشتن توشون و به شدت بو میداده هم سبزیجات مونده بود هم کاهو واسه همین مدتها از اینجا سالاد نگرفتم! ولی جدیدا ک سالاد یونانی بدون مرغ گرفتم خوب بوده از نظره تازگی فقط ب نظرم حجم کاهو نسبت به بقیه محتوا مثل پیاز و فلفل دلمه ای و ... خیلی بیشتره! ولی تازه بودن ، سوپ کینوا هم خیلی خوشمزه بود! امیدوارم سالادهای دگرو هم درست کرده باشن کیفیتشو! ,647011
3271je,2,SAD,هرچی مونده بود رو دستشون رو دادن اومد،بدون هیچ تماس یا هماهنگی!! جینجر لایم رو با تخم شربتی عوض کردن،گرانولا بارم با یه تیکه شیرینی! جالب بود واقعا...,156365
3271je,0,SAD,"آب دوغ خیار واقعا بیشتر از 1 ساعت؟؟؟

بعد به نظرتون نباید نون داشته باشه؟ ",152313
3271je,0,SAD,گوشت سالاد کلا چربی بود,188066
3271je,6,HAPPY,فيله كاملا سوخته بود و مزه سوختگي ميداد,7009122
3271je,0,HAPPY,کیفیت غذا و دورچین ها بد نیست. ولی مطابق بقیه کامنت ها ، سفارش خیلی دیر میرسه و کاملا سرد شده.,573716
3271je,0,HAPPY,"همه چی اندازه و خوب بود و به موقه رسید به دستم فقط اواکادو کمی تلخ بود که به نظرم باید رستوران قبلش مزه کنه 
در کل خوب بود و پیشنهاد میشه ",4822845
3271je,4,SAD,"مغایرت کامل با عکس
",234602
3271je,0,HAPPY,"با اینکه تو برنامه زده بود ۴۰ دقیقه تا تحویل اما زیر نیم ساعت پیک تحویل دادن
خود سالاد هم عالی بود. ممنون ازتون
امیدوارم کیفیت در آینده پایین نیاد.",326114
3271je,8,HAPPY,خیلی خوشمزه و عالی بود، یکم تو راه گرم شده بود که گذاشتم یخچال درست شد,1028085
3271je,0,SAD,خوشمزه نبود این سالاد اصلا !,857106
3271je,6,HAPPY,"سلام
چی بگم واقعا...سفارشم با یک ساعت تاخیر رسید. ساعت ۱۲ ثبت شد ساعت ۲ رسید دستم واقعا ناراضی بودم خیلی بده مشتری رو اینهمه منتظر میذارید. حالا هم که رسیده گوشت سالاد  سفت و به زحمت جویده میشد. پشیمان شدم از سفارشم",3653267
3271je,0,HAPPY,حاجی غذاتون خداییش معرکست. ولی خیلی دیر آماده میشه.,5778523
3271je,10,HAPPY,یه دسر پر حجم دو نفره خوش طعم,2224352
3271je,0,SAD,"من بسیار زیاد از این سالاد سفارش دادم . نزدیک یک ساله مرتب غذا گرفتم ازشون
به جرعت میگم بدترین سالادی بود که اینجا گرفتم
فکر کنم یه مدت سفارش ندم تا خاطره اش از یادم بره
",2562493
3271je,10,HAPPY,همه چیز عالی بود،فوق العاده تمیز و زود به دستم رسید،فقط اگر یک کوچولو پنیر پارمسان بیشتری داشت بهتر میشد،اما من خیلی راضی بودم،ممنون,4706684
3271je,8,HAPPY,متاسفانه سفارش من چیکن ماشروم بود که به اشتباه استیک تحویل شد. لطفا در هنگام تحویل غذا به پیک غذا با رسید چک شود که این اشتباهات پیش نیاد.,4734747
3271je,0,HAPPY,"خیلی خوب بود،بسته بندی خوب و شکیل بود،فقط سس یخورده شل بود
سپاس بیکران از شما و آرزوی موفقیت برای مجموعه خوبتون",410515
3271je,10,HAPPY,من سالاد کمبو سفارش دادم ولی آبمیوه ارسال نشد !!!!,3812910
3271je,6,HAPPY,۹۵ درصد سالاد کاهو بود  . مواد اولیه تازه و سس خوش طعم داشت.,4416782
3271je,8,HAPPY,"کوکی کرن بریزشو خیلی دوست داشتم
خود سالاد پاستا هم نسبتا خوب بود 
موهیتوش بد نبود ولی کمی ترش بود",1727857
3271je,2,SAD," خيلي دير رسيد
 غذا كامل سرد بود 
پيك يه ماسك نزده بود 
درب سالاد باز بود ",5250314
3271je,10,HAPPY,عالی,4026061
3271je,2,SAD,سس رقیق و کیفیت پایین .مرغ و زیتون سالاد مونده بود .ازخرید ناراضی ,4868009
3271je,0,HAPPY,ایندفعه از فرش باکس بعید بود زود برسونه واقعا راضیم. تازه سسش هم نسبت به قبل غلیظ تر بود و مخلفات هم خوب بود,3424550
3271je,0,SAD,واقعا نمی دونم چی بگم، چیزی که تو عکس می بینی ، چیزی که تحویل می گیری فرق داره ، کاهو مونده ، نبود پنیر ، از هر چی مونده بود کرده بودن سالاد یویانی ,483125
3271je,0,SAD,دو عدد سس یونانی اضافه در سفارش بود که یک عدد اضافه گذاشته شده بود,776924
3271je,10,HAPPY,"من تقریبا همه سس های اینجارو گرفتم خوش طعم ترینش از نظر من بادوم زمینیه کاش تو حجم های بزرگتر هم تولید کنید، سس سماق یکم سیر داره انگار؟! که من خوشم نیومد احتمالا دیگه سفارش ندم، کاش شعبه های دیگه اتونم این امکان رو داشتن من هر بار برای ۴ تا سس باید ۱۱ تومن هزینه پیک بدم
ممنون تنها جاییه که سس میتونم بخرم",795236
3271je,10,HAPPY,مثل همیشه عالی ,410515
3271je,8,HAPPY,برای چندمین بار هست که در سفارشم سس سبز اضافه میزنم ولی به جاش دو تا سزار میفرستین,173735
3271je,0,HAPPY,سالاد خوب بود اما یک ساعت  و نیم طول کشید !,4838558
3271je,0,SAD,کاهوهای سالاد سزار همه زنگ زده بود و تقریبا بیشتر از نصف سالاد قابل خوردن نبود,897831
3271je,10,HAPPY,عالی کیفیت خوب,1780258
3271je,10,HAPPY,مثل همیشه عالی بود ممنون,2847625
3271je,0,HAPPY,خیلی سالاد خفنی نبود معمولی بود,351266
3271je,0,SAD,مرغ به شدت بو میداد در حدی که اصلا نخوردم سس سالاد هم مثل همیشه نبود یه رنگ زرد عجیبی داشت ,720136
3271je,0,SAD,سفارش اشتباه ارسال شده بود و پیگ منتظر باز پس گیری سفارش نمانده بود,940040
3271je,8,HAPPY,"خیلی عالی بود. بسیار بسته بندی عالی داشت 
من فقط سالاد سزار سفارش داده بودم و سالاد پاستا هم برام فرستادم نمیندونم توی کوپن رستوران بود یا اشتباهی بود ",1103963
3271je,2,SAD,"کیفیت سالاد نسبت عکسی ک دیدم و سفارش دادم پایین بود سس خوشمزه ای نداشت و حجم سس هم خیلی کم بود.
تیکه های مرغ هم خوشمزه نبود، در کل دیگه جزو گزینه های انتخابی من نیست.",4226526
3271je,2,SAD,گوشت سالاد بو میداد و پر چربی بود. اصلا خوب نبود !,3335017
3271je,4,SAD,من همیشه از سالاد باکس سفارش میدم و همیشه راضیم  اما سالاد میگو مونده بوود و زیتون سبز ریخته بودن . اصلا راضی نبودم ! ,499497
3271je,4,SAD,واقعا راضی نبودم، از دیر رسیدن سالاد که بگذریم خیلی حجمش کم بود،سسش که اصلا سزار نبود سس زرد رنگ با یه حجم زیاد روغن مایع چند تا دونه زیتونشم به قدری شور بود که انگار چند تا گلوله نمک انداختن تو سالاد به جای زیتون.ولی از پشتیبانی اسنپ فود واقعا ممنونم خیلی پیگیری کردن.,263287
3271je,2,SAD,ساعت ۱۲ سفارش میدم ساعت ۱۴:۳۰  تحویل میگیرم  . نون خشک بخوری بهتره تا منتظر سالاد فرش باکس بمونی,190544
3271je,8,HAPPY,خوب,809779
3271je,4,SAD,"به علت عدم حمل درست سفارش توسط پیک تمام سفلرش حمص از ظرف بسته بندی بیرون ریخته بود 
پول این سفارش باید عودت داده شود و با عذرخواهی کاری از پیش نخواهد رفت.",1144871
3271je,8,HAPPY,سلام. از طعم و کیفیت راضی بودم فقط سفارش خیلی دیر رسید,1506335
3271je,2,SAD,بجای این سسی که توی عکس نشون داده روش سوپ جو پرک ریخته بودن که سینه مرغ بسیار بد مزه بود تا حالا مرغ به این بد مزه ای نخورده بودم و تعجب ام از او افرادیه که از این غذا تعریف کرده بودن,1008519
3271je,0,HAPPY,زمان ارسال برای یک عدد سوپ خیلی طولانی بود,163508
3271je,0,SAD,"سالاد ها خوب بودند. زمان رسیدن بد بود. یک ساعت و چهل و پنج دقیقه از زمان ثبت سفارشم طول کشید تا غذا رسید. 
",324606
3271je,0,HAPPY,همیشه راضی کننده بوده،فقط سس سالاد خیلی رقیق هست,410515
3271je,2,SAD,۱۲:۳۰ سفارش دادم ۱۴:۲۰ رسیده  تازه با کیفیت پایین و نون خیس خورده.,2850790
3271je,2,SAD,"1  ساعت و ربع زمان واقعا"" برای یک سالاد سزار کافی نیست ؟  
افتضاح بود ",3770778
3271je,0,SAD,به شدت کیفیت افت کرده ,3373812
3271je,0,HAPPY,ساندویچ چیکن ماشروم خوب وخوشمزه ست اما خیلییییییییییی چربه. سالاد وجی کینوا هم خوبه و در کل من راضی بودم,3285270
3271je,2,SAD,محتویات سالاد مثل بروکلی و مرغ مونده بود و دیگه از اینجا خرید نمیکنم.,4722469
3271je,4,SAD,من کینوا تایلندی با میگو سفارش داده بودم اما با مرغ فرستادن,2847625
3271je,10,HAPPY,عالی بود ممنون,2847625
3271je,8,HAPPY,کیفیت افت داشت ;),400629
3271je,10,HAPPY,همه چیز عالی و خوشمزه بود,884958
3271je,2,SAD,خیلی دیر رسید و کلا سرد بود فلفل دلمه ای و سس انقدر زیاد بود که حالت تهوع گرفتم اگه فلفل دلمه ای و سس به انداره بود عالی میشد ,2225294
3271je,0,SAD,وقتي سالاد رسيد كلا داغ بود انقد دير رسيد,461082
3271je,8,HAPPY,"سالاد خوب بود ولی بیشترش کاهو شده بود و نینوا کم بود.
سس عالی.
در کل خوبه",1780258
3271je,8,HAPPY,سس خوشمزه ای داشت ولی بادام زمینی سالاد تایلندی خیلی کهنه و بدمزه بود,785414
3271je,0,SAD,اسمشو باید بذارن مونده باکس جای فرش باکس,1042914
3271je,0,SAD,فیله مرغ گریل شده کاملا سفت و خشک و مثل چوب بود. اصلا قابل خوردن نبود,323147
3271je,10,HAPPY,مثل همیشه عالی,2224352
3271je,8,HAPPY,کیفیت غدای بسیار خوب است ولی مدت زمان ارسال بالا بوده و با تاخیر زیاد رسید.,169396
3271je,0,SAD,کیفیت مثل همیشه خوب ولی متاسفانه با ۱ ساعت تاخیر ارسال شد ,2336495
3271je,0,HAPPY,خوب بود!,1788025
3271je,4,SAD,"میگوی خشک و لاستیکی
سرکه ی زیاد سس بادام زمینی طوری که دل ضعفه گرفتم
اصلا راضی نبودم از سفارشم
",3653267
3271je,6,HAPPY,سس نداشت,5143699
3271je,0,SAD,سس خیلی بد بود,349484
3271je,10,HAPPY,خیلی خوبه، اگه سس همراه سالاد بیشتر بود، خیلی بهتر می‌شد,1048314
3271je,10,HAPPY,عالی بود,4327939
3271je,0,SAD,کیک خیلی کم بود توی عکس سایز شیشه خیلی بزرگتر نشون میده :(,4168148
3271je,0,SAD,غذا بسیااار لذیذ و دلنشین بود اما بعد از دو ساعت و 30 دقیقه به دست بنده رسید!! ( فاصله فرش باکس تا جردن!) و وقتی غذا را تحویل گرفتم، سس غذا کاملا بیرون ظرف ریخته شده بود.,323755
