restaurant_code,rating,feeling,commentText,customerId
p41d65,2,SAD,افتضاح براى يه لحظه بود،حليم مونده،متاسفم واقعا براى اين مجموعه,10505652
p41d65,8,HAPPY,"سلام 
مزه آش تند بود  کیفیتش هم خیلی رضایت بخش نبود ولی عدسی هم خوش رنگ و لعاب بود هم خیلی خوشمزه",12539208
p41d65,2,SAD,کلا گوله گوله پر بود خوب نپخته بود گوشتا بوی بد میداد ریختم دور متاسفم واقعا,12799586
p41d65,8,HAPPY,دارچین و شکر و روغن را با هم مخلوط میکنید؟,4773535
p41d65,10,HAPPY,عالی,1026696
p41d65,10,HAPPY,ممنون از اسنپ فود بابت تخفیف .لوبیا معمولی بود سرعت ارسال  خیلی خوب بود تشکر ,3890730
p41d65,8,HAPPY,نان ارسال نشده بود، هم روغن داشت هم شکر در حالی که درج کرده بودم لطفا نریزید,4773535
p41d65,10,HAPPY,معمولی و خوشمزه,769504
p41d65,4,SAD,اصلا کیفیت نداشت,3882383
p41d65,2,SAD,آش فوق العاده بدمزه و آبکی بود بعدم چرا داخل آش بجای کشک دوغ نعنایی ریخته بودین؟ حلیمم بدون هیچ شکر و دارچینی فرستادن دیگ ازینجا خرید نمیکنم,3486074
p41d65,8,HAPPY,ي حليم خيلي معمولي…يكم گوله شده بود ,9379630
p41d65,8,HAPPY,پیک خیلی سریع اومد ولی کیفیت آش زیاد خوب نبود، حبوباتش کم بود و پیازش زیاد!,10371811
p41d65,10,HAPPY,کیفیتش خوب بود، نان همراهش نبود، یه مقدار نون میفرستادند خوب بود.,180571
p41d65,2,SAD,سفارش رو که کامل ارسال نکردن،کیفیت هم انقدر پایین بود که پشیمون شدم از سفارشم.,7104688
p41d65,4,SAD,بوی شدید چربی ودنبه میداد,7028171
p41d65,8,HAPPY,خوب بود ولی یخورده برامون نمکش یه کوچولو زیاد بود تحویل بموقع و برخورد عالی و بسته بندی عالی ممنونم,13737911
p41d65,2,SAD,یکی از بدترین حلیم هایی که در عمرم دیدم بی مزه با مقدار بسیار بسیار اندک گوشت گوساله یخی ، واقعا افتضاح بود,1054347
p41d65,8,HAPPY,لطفا در ظروف بهداشتی و گیاهی ارسال نمایید,2117029
p41d65,8,HAPPY,معمولی,9009716
p41d65,10,HAPPY,فوق العاده بود خوشمزه و گرم نون تازه,4049384
p41d65,2,SAD,بسیار افتضاح بود .اصلا نمیشد خورد همشو ریختیم دور,12005019
p41d65,10,HAPPY,شکر ونان نداشت,11682206
p41d65,10,HAPPY,خوب بودو گرم بود ایشالا به برکت همین ماه مبارک هرروزکسب وکارش سکه باشه,8700381
p41d65,8,HAPPY,خوب,4010110
p41d65,8,HAPPY,اگه بوقلمون بود گوشتش بهتر بود,13723949
p41d65,10,HAPPY,بینظیر و خوشمزه نظر من درمورد حلیم برعکس شد دیگه پایه صبح جمعه شده برام‌,8800441
p41d65,10,HAPPY,عالی خیلی خوشمزه اس ممنونم,11583560
p41d65,8,HAPPY,اش عالی بود حلیم معمولی,548628
p41d65,2,SAD,کیفیت خیلی بد .بدمزه.وجانیفتاده بود.اصلا توصیه به خرید ندارم,7118405
p41d65,10,HAPPY,پیک سریع رسید، نان خیلی کم ارسال شده بود، حلیم عالی بود، ممنون که به توضیحات توجه کردید,4773535
p41d65,10,HAPPY,بسیار عالی و خوش طعم,13427178
p41d65,10,HAPPY,"باسلام عالی
ممنون",4251386
p41d65,4,SAD,جای دوستان خالی نباشه ، آش رشته ، یک غذای بی ادویه و بی نمک اما با طعم بسیار لذت بخش خاک بود ، خوراک لوبیا هم که اصلا نیاز به ادویه نداشت چون اگر هم استفاده می‌گردند،  آنقدر طعم رب ، غالب بود که طعم دیگه ای و متوجه نمیشدید ، در هر صورت ، امیدوارم دیگه گذرم به این رستوران نیوفته .,4040474
p41d65,10,HAPPY,"نسبت به قیمت عالی بود
تشکر",4562222
p41d65,10,HAPPY,خیلی خوب اینبار نان هم با سفارش فرستادن.ممنون,11111538
p41d65,10,HAPPY,خیلی خوب ممنون,11111538
p41d65,10,HAPPY,همه چیز عالی بود,6799968
p41d65,10,HAPPY,با سلام و خسته نباشید واقعا  از هر نظر عالی بود ممنون,7676515
p41d65,10,HAPPY,ممنون عالی بود,11111538
p41d65,10,HAPPY,ممنون از کیفیت خوب غذاها,11111538
p41d65,8,HAPPY,خوب بود,10135023
p41d65,10,HAPPY,خیلی عالی,11111538
p41d65,10,HAPPY,خوشمزه و داغ و پر گوشت,4774063
p41d65,10,HAPPY,عالی بود . توضیحات نوشته بودم شکر بذارن برام و خیلی با سلیقه داخل کیسه جدا بود. کیفیت هم خیلی بالا بود,4894186
p41d65,10,HAPPY,عالی و خوشمزه بودن ..خیلی خیلی دوس داشتم,11583560
p41d65,10,HAPPY,سلام خیلی عالی و تمیز ارسال شد از پیک و رستوران ممنونم مرسی که به توضیحات توجه داشتید ,12938159
p41d65,10,HAPPY,عدسی عالی بود,3406444
p41d65,10,HAPPY,"با سلام عالی بود 
ممنون",4251386
p41d65,10,HAPPY,ممنون کیفیت و مزه خوبی داره غذاهاتون,11111538
p41d65,10,HAPPY,نظرم مثبت پیشنهاد میکنم سفارش بدهید,12401793
p41d65,10,HAPPY,من ازشون شکر اضافه خواسته بودم دمشون گرم فرستاده بودن,5154576
p41d65,10,HAPPY,عالی بود ممنون,11583560
p41d65,10,HAPPY,مثل همیشه عالی کسب و کارتون پربرکت باشه,8912123
p41d65,10,HAPPY,"سلام 
لطفا امکان سفارش نان هم اضافه بفرمایید",3432141
p41d65,10,HAPPY,همه چی خوب بود فقط کمی حبوبات آش رشته سفت بود,9609968
p41d65,10,HAPPY,لوبیا عالی عدسی عالی,3432141
p41d65,10,HAPPY,خوشمزه ,232987
p41d65,6,HAPPY,خیلی خیلی شور بود،تو عکس پیاز داغ داشت در حالیکه فقط عدسی بود با سیب زمینی خیلی کم و بعید میدونم که یک کیلو بود,3465851
p41d65,10,HAPPY,سریع وخوب,10805775
p41d65,10,HAPPY,حلیم عالی بود فقط فراموش کردید روی حلیم دارچین بریزید و سری قبل هم ۵۰۰ گرم سفارش داده بودم ولی ظرف بزرگ تر بود یا دفعه قبل اشتباه ارسال کرده بودید یا اینبار بهرحال ممنون از شما,4773535
p41d65,10,HAPPY,عالی بود ممنون,11583560
p41d65,10,HAPPY,ممنونم از حلیم خوشمزه و گرمتون و ممنونم از پیک با ادب و منظمتون،ممنونم.,6799968
p41d65,10,HAPPY,خیلی خوشمزه بود عالی عالی,4042219
p41d65,4,SAD,عدسی حدود ۴۵ دقیقه طول کشید تحویلش,3328931
p41d65,10,HAPPY,عالی و بی نظیر,11830748
p41d65,10,HAPPY,"هم داغ هم خوشمزه بود،ظرف حلیم،
گیاهی بود و هر ظرف جداگانه بسته بندی شده بود،واقعا ممنونم ازتون",11830748
p41d65,10,HAPPY,خیلی خوشمزه بود و زود به دستم رسید,9450980
p41d65,10,HAPPY,"با سلام و احترام
حتما پیشنهاد میکنم.کیفیت خوب بود
فقط نکته منفی دیر ارسال شدن سفارش بود که به دلیل نبودن پیک در اول صبح جمعه بود.
قطعا باز هم سفارش خواهم داد.
باز هم تشکر",3714808
p41d65,8,HAPPY,بد نبود، ولى معلوم بود با حليم كهنه ميكس شده، مقدار و طعم گوشت خوب بود، شكر بهتره جداگونه باشه قاطى نباشه,13776137
p41d65,10,HAPPY,عالی بی نظیر,8563336
p41d65,8,HAPPY,کمی حلیم شور بود . ,9963063
p41d65,10,HAPPY,"سلام خسته نباشید
حلیم بسسسسیییار عااااالی بود. ممنونم",4219078
p41d65,10,HAPPY,عالی,11692645
p41d65,10,HAPPY,خوشمزه و عالی,4206746
p41d65,10,HAPPY,کیفیت غذا خوب است اما چرا همراه حلیم نان نگذاشتید؟,424378
p41d65,10,HAPPY,خوب بود ,9193887
p41d65,10,HAPPY,بسیار خوشمزه و عالی بود ,3752267
p41d65,10,HAPPY,البته در سفارش خواسته بودم شکر نریزند که متاسفانه زده بودند.  ,5440279
p41d65,10,HAPPY,حلیم عالی و داغ بود فقط نون نباید همراهش باشه؟,1790762
p41d65,10,HAPPY,عالی مثل همیشه,11830748
p41d65,10,HAPPY,خیلی خوب بود,11358849
p41d65,10,HAPPY,خوشمزه بود,11172753
p41d65,10,HAPPY,عالی بود و به وقت رسید,1491243
p41d65,10,HAPPY,بسیارعالی وگرموخوش مزه بود,5632228
p41d65,10,HAPPY,حلیم خوب بود عالی,12969898
p41d65,8,HAPPY,گرم و خوب بود ولی زمان آماده سازی طولانی بود,4538536
p41d65,10,HAPPY,ممنون همه چی خوب,5693475
p41d65,4,SAD,به شدت شور بود.,158613
p41d65,10,HAPPY,عالی و‌ به موقع,7933863
p41d65,10,HAPPY,داغ و خوشمزه ممنون,4784240
p41d65,10,HAPPY,عالي,3507019
p41d65,8,HAPPY,کیفیت میشه گفت متوسطه,4264094
p41d65,8,HAPPY,گرم دستم رسيد ،بازم سفارش ميدم،عالي,3507019
p41d65,10,HAPPY,حلیم خیلی خوب بود ولی ای کاش شکر نمیزدین شکرشو جدا می‌داشتیم ممنونم,9259647
p41d65,10,HAPPY,ممنونم از مجموعه خوبتون عالی بود و خوشمزه,1491243
p41d65,10,HAPPY,"خیلی تمیز و عالی بود 
ممنونم ",9432080
p41d65,8,HAPPY,خوب بود,8923692
p41d65,4,SAD,حلیم شور بود!!!! من معده حساسی ندارم اما به شدت اذیت شدم افتضاح بود,5738671
p41d65,10,HAPPY,طعم و مزه عالی بود,12324736
p41d65,10,HAPPY,عالی ممنون از شما,9075629
p41d65,10,HAPPY,عالی بودهمه مخلفاتش ب اندازه بود,11860699
p41d65,10,HAPPY,به نظرم کیفیت و طعم مطلوبی داشت ..,930116
p41d65,8,HAPPY,حلیم رو یه عده با شکر میخورن یه عده (مثل من) با نمک. بهتر بود اجازه میدادید مشتری انتخاب کنه و خودش هرکدومو خواست اضافه کنه. خودتون شکر نزنید. ولی در کل کیفیت خوب بود.,1386925
p41d65,10,HAPPY,"طعم حلیم خوب بود،گرم‌به‌دستم‌رسید،درخواست کرده بودم که شکر بیشتری برای من بریزند و زحمت کشیدند و شکر جداگانه همراه سفارش ارسال کردند
با تشکر از دقت شما",9365629
p41d65,10,HAPPY,عااالی و خوشمزه,4223028
p41d65,10,HAPPY,خوب بود ولی حجم کم بود,2136043
p41d65,10,HAPPY,دستتون درد نکنه عالی بود البته بنظرم یه تیکه نون هم باهاش باشه بهتره ولی بهرحال خسته نباشین,970665
p41d65,10,HAPPY,عالی بود,10163261
p41d65,10,HAPPY,خوشمزه بود ممنون,13157242
p41d65,10,HAPPY,عالی بود,6403636
p41d65,2,SAD,اقا من هرروز دارم خرید میکنم هرروزم مینویسم‌لطفا نون بزارین ولی بازم نون نمیزارین،،واقعا نون مگه چقدر قیمتش میشه؟ اصلا تو منو اضافه کن پولشو بگیر,6403636
p41d65,2,SAD,اقا یه نون بزار پولشم بگیر نه نون داره نه شکر نه قاشق هیچی,6403636
p41d65,2,SAD,یه تیکه نونم حتی درکنار حلیم نبود چه برسه به قاشق و دارچین و شکر و اینا,6403636
p41d65,2,SAD,شور بود وابکی وشل بود وزن کمتری داشت وبدون نان وشکر وروغن وشل وابکی ودرکل افتضاح بود. ناراضی ودیگر خرید نمیکنم. پشیمانم,6736560
p41d65,10,HAPPY,سفارش من دقیقا همون بازه زمانی مشخص شده به دستم رسید و گرم بود. پیک خیلی محترم بود. حلیم هم خیلی خوشمزه بود. ممنون.  ,4247361
p41d65,10,HAPPY,خیلی عالی بود ممنونم هم کیفیتش خوب بود هم قیمتش ,9259647
p41d65,8,HAPPY,خوراک لوبیا معمولی بود.,163348
p41d65,10,HAPPY,بهتر بود نان سنگک هم همراه حلیم بود .,8485802
p41d65,10,HAPPY,"خیلی خوشمزه بود کنجد و گوشت هم داشت 
ممنون",5573688
p41d65,10,HAPPY,بار اول بود سفارش میدادم و راضی بودم,5309379
p41d65,10,HAPPY,خوب بود ,2144581
p41d65,10,HAPPY,کیفیت عالی ارسال به موقع,8670653
p41d65,10,HAPPY,عدسی خوب بود اش هم خوب بود ولی یک مقدار روغن روی اش زیاد بود. ای کاش یک تیکه نان و یک لیمو کوچولو یا پیاز کنارش می‌گذاشت .در کل خوب بود راضی بودم. پیک هم به موقع آمد و سه طبقه بدون آسانسور اومد بالا و ملودی بود خدا قوت سرآشپز و پیک موتوری تو این سالهای بی پولی,13487204
p41d65,4,SAD,روغش زیاده در صورتی که آش رشته خییییلی کم روغن میخواد و همینطور تندم هست، به نظرم اگه فلفل نزنید و همون اش ساده رو تحویل بدید بهتره، حالا هرکی هرچی خواست تو خونه خود‌ش بهش اضافه کنه ,3385714
p41d65,10,HAPPY,خوب بود. سپاس,628284
p41d65,10,HAPPY,عالی بود,5218259
p41d65,10,HAPPY,عالی و به موقع و داغ,7130837
p41d65,8,HAPPY,با تاخیر به دستم رسید,7130837
p41d65,10,HAPPY,باسلام حلیم داغ و خیلی زود به دستم رسید مزه و کیفیت عالی خدا قوت,10293670
p41d65,8,HAPPY,بد نبود ولی خوشمزه نبود,3539745
p41d65,8,HAPPY,نون نداشت نه همراه حلیم نه تو منو,4739124
p41d65,2,SAD,مزه دنبه میداد.لوبیاها له شده بودند.بیشتر حجم آن آب و رب بود و لوبیا خیلی کم داشت,302847
p41d65,10,HAPPY,واقعا خوب وعالی بود و پیک محترمی هم داشتید مرسی,7806635
p41d65,4,SAD,پر روغن بود,5383293
p41d65,10,HAPPY,سلام عالی بود تشکر دارچین کافی بود و کنجد هم زیاد داشت و طعم و میزان گوشت عالی بود ,10697321
p41d65,10,HAPPY,"خوشمزه بود و سریع ارسال شد 
متشکرم",4303441
p41d65,10,HAPPY,خوب و گرم و به موقع,8563336
p41d65,10,HAPPY,خیلی خوشمزه بود فقط اگه یکم فلفلش کمتر باشه دیگه عالیییییی میشه,10372189
p41d65,10,HAPPY, بسیار عالی ,3895085
p41d65,2,SAD,"خیای غذاها بد بود.
جغوربغور که اصلا یه چیز دیگه بود هرچی بود سیبزمینی و پیاز و ۴تا تیکه جگر گوسفند که سوخته بود بخشیش. نتونستم بخوره. اصلا کی به این میگه جغوربغور! بابا خداقل اسمشو عوض کنید.
اش رشته هم خیلی بد بود بجای رشته اش از ماکارونی استفاده شده بود و همینطور بشدت تند بود. یه رستوران دیگه هم همینکارو کرده بود نمیدوتم همه جای تهران آش رشته اینطوره یا شانس ما بوده
اصلا پیشنهاد نمیکنم",6649078
p41d65,10,HAPPY,خیلی خوشمزه بود آش رشته,8487786
p41d65,10,HAPPY,عالی بود,11692645
p41d65,10,HAPPY,هم زود رسید هم کیفیت خوب بود ,4785633
p41d65,10,HAPPY,عالی بود خیلی خوشمزه بودرفتار پیک هم بسیار محترمانه بود کسبتون پر برکت باشه,8912123
p41d65,10,HAPPY,خیلی خوب وخوشمزه بود ,5249859
p41d65,10,HAPPY,خوشمزه و عالی,4303441
p41d65,10,HAPPY,عالی,4494964
p41d65,10,HAPPY,خیلی عالی بود ولی متاسفانه پیک توی راه خیلیش ریخته بود ,861024
p41d65,8,HAPPY,با سلام و خسته نباشید، به نظرم زیاد مزه حلیم نمی داد و بسیار بسیار کم نمک بود ولی در کل بد نبود و دستگاه گوارش رو اذیت نکرد,4540025
p41d65,8,HAPPY,خوب بود ,6632130
p41d65,2,SAD,به قدری آش رشته تند بود که نمی شد خورد,2202965
p41d65,10,HAPPY,خوب بود,495841
p41d65,6,HAPPY,خیلی خیلی خیلی چربو روغنی بود,9613880
p41d65,10,HAPPY,عالی بود و زود ارسال شد.ممنونم ,6368365
pzevzj,2,SAD,ناقص بود نان هم نبود,4831288
pzevzj,8,HAPPY,خیلی معمولی بود ولی خوشمزه,323532
pzevzj,2,SAD,واقعا انتظار این همه ضعف رو نداشتم از لانژ.کیفیت در حد افتضاح.دیگه خرید نمی کنم از شما,4414840
pzevzj,2,SAD,پیتزا سوخته بود و اصلا کیفیت قبلیو نداشت ,3705506
pzevzj,10,HAPPY,فوق‌العاده خوشمزه و پکیج مرتب و تمیز عالی بود ,11226263
pzevzj,6,HAPPY,من زیاد راضی نبودم فیله میکس مقدار گوشت و مرغش که باید مساوی باشه نبود استیک گوشتش خیلی به نسبت مرغ کم بود. دورچین در کمال تعجب همگی ترش بودن انگار داری ترشی میخوری. پیتزا کیفیت آنچنانی نداشت فقط ماکارونی خوب بود,172301
pzevzj,2,SAD,بدمزه و بی کیفیت واقعا حیف‌ پولی که دادم افتضاح بود متاسفم ,1505311
pzevzj,8,HAPPY,با سلام پیتزا مخصوص سفارش داده بودم اما پیتزایی که تحویل گرفتیم شبیه پیتزا مخصوص های قدیمی کاپیتان نبود و کیفیت سابق را نداشت.,163758
pzevzj,10,HAPPY,بهترین پیتزای یکسال اخیری بود که سفارش دادم,5965316
pzevzj,6,HAPPY,مثل نسکافه فوری بود بیشتر طعمش,175330
pzevzj,10,HAPPY,تک تک موارد در صبحانه با کیفیت بودن…اون پنیری که استفاده کردن واقعا خوشمزه یا گردو تازه و روشن هست رنگش کلا همه چیز با کیفیت و خوب استفاده میشه فقط این دفعه نوون یه جوری بود من عکس گرفتم فقط امیدوارم جای گاز نباشه اینا ,634663
pzevzj,10,HAPPY,عالی,953051
pzevzj,2,SAD,غذا خیلی شور، سوخته بی کیفیت … آب میوه ها مزه آب میداد… این کیفیت بد و تکرارش باعث شد دیگه از اینجا خرید نکنم,3361659
pzevzj,10,HAPPY,فقط لطفا کیفیت خوب غذاهاتون رو همینطور خوب نگه دارید....ممنون.,2848606
pzevzj,10,HAPPY,همه چیز عالی با تشکر,6619905
pzevzj,10,HAPPY,کامل و خوشمزه,3975946
pzevzj,8,HAPPY,سفازش بسیار دیر و سرد به دست من رسید. حجم سالاد وسیب زمینی کم بود.,8622310
pzevzj,4,SAD,حمص نداشت.خیلی دیر ارسال شد.مواد تازه استفاده نشده بود,1891194
pzevzj,10,HAPPY,یکم دیر رسید.,3358877
pzevzj,2,SAD,"یک ساعت و نیم طول کشید.
عملا صبونه تبدیل شد به ناهار.",1824098
pzevzj,10,HAPPY,بسيار عالي,1042272
pzevzj,10,HAPPY,بسيار خوب,1042272
pzevzj,6,HAPPY,پاستا طعم معمولی داشت، من طعم مرغ رو خیلی دوست نداشتم. حجم غذا خیلی خوب بود، میزان مرغ و قارچ و سسش خیلی خوب بود.,3373750
pzevzj,8,HAPPY,بسیار خوب بود و مواد تازه به کار رفته بود، بسته بندی هم عالی. فقط فکر میکنم صبحانه به این خوشمزگی رو میشه با مقدار خیلی کمتری روغن هم درست کرد.,2274785
pzevzj,2,SAD,"اصلا املت نداشت به شدت سرد سرد و بد طعم 
پنير گوسفندي بد طعم 
اصلا توصيه نميكنم ",949310
pzevzj,2,SAD,"بیکن به قدری چرب و کلفت بود که از ماهیتش خارج شده بود، سوسیسش انقدر سفت و بدمزه بود که نمیشد گاز زد، سیب زمینی کاملا بدون مزه و بدون نمک یا هر ادویه دیگه ای بود، فقط نیمرو و نون و لوبیا قابل خوردن بود، که اون هم معمولی بود. 
پن کیک بد نبود.
در کل اصلا راضی نبودم از هزینه ای که کردم.",3786451
pzevzj,8,HAPPY,خوب بود,158987
pzevzj,10,HAPPY,شیک نوتلا فوق العاده بود!,1659954
pzevzj,6,HAPPY,خیلی دیر به دستم رسید و کاملا سرد. کیفیت پیتزا معمولی بود,3672347
pzevzj,10,HAPPY,عالی بود ,1060509
pzevzj,10,HAPPY,لازانیا بی نظیر بود ، بعد از کلی سرچ توی اسنپ از اینجا سفارش دادم عالی بود طعم بی نظیری مواد تازه ، سالاد هم برامون گذاشته بودن ،غذا هم گرم و به موقع رسید ممنون,6163291
pzevzj,2,SAD,با اختلاف سردترین و بدترین غذایی بود که از اسنپ فود گرفتم . رستوران کاپیتان چند باری حضوری رفته بودم کیفیت کارشون خوب بود . اما سفارش امشبم افتضاح بود . ,4917031
pzevzj,10,HAPPY,"همه چیز عالی و با کیفیت 
فقط اکثرا افراد وقتی سالاد سفارش میدن که رژیم غذایی دارن 
و متاسفانه این سالاد غرق در سس هست که هیچ اطلاعاتی ازش روی بسته بندی نیست 
پیشنهاد میکنم ریختن سس رو بزارید به اختیار مشتری و اینکه اگه ارزش غذایی سالاد رو محاسبه کنید و اطلاع بدید حرفه ای تره",6258698
pzevzj,10,HAPPY,"تا حالا لازانيا به اين خوشمزگى نخورده بودم 
ممنونم ازتون ",168577
pzevzj,10,HAPPY,برگر بسیار خوشمزه بود، حتما پیشنهاد می‌کنم.,1079939
pzevzj,10,HAPPY,"عالی
طمع مرغ و‌سس واقعا بینظیره",635028
pzevzj,8,HAPPY,خوب بود ،خیلی دیر اومد  و قیمت بالاست,9108965
pzevzj,10,HAPPY,از معدود لازانیا هایی بود که خوشم اومد ممنون,952466
pzevzj,10,HAPPY,خیلی تکریم و مشتری مداری توو این مجموعه رعایت میشه و همیشه لذت میبرم از نوع سرویس دهیشون...مثلا این سری برام سنگک تازه گرفتن و فرستادن و همه چی با کیفیت و تازه بود,634663
pzevzj,10,HAPPY,بسیار عالی بود و لذت بردم,7641344
pzevzj,6,HAPPY,لازانیا بسیار چرب بود، کلی روغن اطراف غذا جمع شده بود، در اثر حرکت پیک توی جعبه هم ریخته بود! ,168235
pzevzj,6,HAPPY,لازانیا کاملا معمولی بود مزه خاصی نداشت ولی به موقع رسید و گرم بود و بسته بندی ام خیلی بهداشتی و خوب بود ,3298489
pzevzj,10,HAPPY,"یه صبحونه‌ی فوق‌العاده است. به‌ویژه با بسته‌بندی مناسب میاد که ظاهر رو درست حفظ می‌کنه و مواد غذایی یا هم قاطی نمی‌شه.
ممنون",5861646
pzevzj,10,HAPPY,کیفیت غذا و دورچین واقعا خوب بود بافت سینه مرغ هم کاملا پخته بود هم خشک نشده بود، خیلی زود هم رسید. عالی,2274785
pzevzj,10,HAPPY,عالی بود ,6748971
pzevzj,2,SAD,سر بی کیفیت و موار روش بی کیفیت,4706997
pzevzj,0,HAPPY,بسیار عالی هم پشتیبانی هم پیک,8937614
pzevzj,6,HAPPY,جزيیات سالاد با اونی که نوشته بودن خیلی مغایرت داشت دوتا تیکه نون داشت سالاد سزارش ما گوجه ایی ندیدیم اصلا سسشم کم بود خلاصه من راضی نبودم ,3625426
pzevzj,10,HAPPY,بسته بندی بسیار تمیز و مرتب و صبحانه خیلی خوشمزه بود,7789526
pzevzj,2,SAD,"واقعا برای ۳تا صبحانه ساده من ۲ساعت معطل شدم به رستوران زنگ زدم‌میگفتند دارن بسته بندی میکنند باز ۳۰دقیقه بعد زنگ‌میزدم میگفتند پیگیری میکنیم.
فرنچ تست و پن کیک مواد داخلش قشنگ خام بود. 
سیمیت هم نونش له شده بود ولی مزه خوب بود.
فرنچ تست و پن کیک درجا انداختم دور.
واقعا بی کیفیت
",794286
