restaurant_code,rating,feeling,commentText,customerId
37jgem,0,HAPPY,اگرباگت در بسته بندی تغییراتی ایجاد کند بهتر است مثل چنگال به صورت باز داخل باکت غذا بود,5623584
37jgem,8,HAPPY,پیتزا استیکش خیلی خوب بود. کمبو معمولی بود و قارچ سوخاریش هم خوش مزه و نرم بود و اصن برشته نبود. با اینکه بارون سیل اسا میبارید ولی نیم ساعته غذامون رسید :),4407340
37jgem,2,SAD,در كل خيلي افتضاح بود و ديگه سفارش نخواهم داد,3162396
37jgem,10,HAPPY,خیلی سریع به دستمون رسید و کیفیت خوبی هم داشت ,2181641
37jgem,2,SAD,متاسفانه اصلا راضی نبودم. کیفیت غذا بشدت پایین بود. مرغ سوخاری سرد و سفت بود. حتا سیب‌زمینی قابل خوردن نبود. ,3826436
37jgem,6,HAPPY,"تعداد سس کم بود.
سیب زمینی ها کاملا سرد بودند.
پیتزا هم نیاز به گرم کردن داشت.",659944
37jgem,10,HAPPY,بسیار عالی مثل همیشه.بسته بندی  حمل خوب,1171579
37jgem,0,HAPPY,خیلی خیلی خیلی عالی بود ممنونم ,5480226
37jgem,0,HAPPY,باگت فوق العادست,1514729
37jgem,10,HAPPY,هر دو خوشمزه بود,3002855
37jgem,8,HAPPY,کیفیت غذا خوب بود اما سفارش سیب زمینی رو توش نزاشته بودن و سفارش ناقص بود حالا کی میخاد دنبال اون باشه,1256533
37jgem,0,HAPPY,مثل همیشه فوق العاده بود. ,3695535
37jgem,10,HAPPY,عالی,208097
37jgem,0,SAD,نظر که مهم نیست وقتی اهمیت داده نمیشه من از کیفیت غذا راضی نبودم مثل همیشه عالی نبود متاسفم که بعضی رستورانا وقتی اسم در میکنن کیفیت میارن پایین یکی نیست بهشون بگه قیمتو ببرید بالا عوضش کیفیت خوب بدید,971316
37jgem,0,HAPPY,"غذا عالی بود 
و همیشه میچسبه این غذا",4907569
37jgem,4,SAD,"سلام

از کیفیت پیتزا مرغ کاری سورپریز شدم ! با چیزی که فکر میکردم فرق داشت

اصلا به قیمت نمی ارزه، قیمتش به مواد استفاده شده در پیتزا بالاست.
",5662378
37jgem,10,HAPPY,مواد سالم و عالی,715544
37jgem,4,SAD,"گوشت قارچ برگر هم خیلی سفت بود و هم بوی گوشت میداد.
پیتزای مرغ کاری هیچ مزه ای نداشت و فکر‌میکنم کمتر از پنجاه گرم مرغ روش ریخته بودن.",561468
37jgem,10,HAPPY,همه چی عالی و به موقع و با کیفیت ,3654860
37jgem,10,HAPPY,باگت عالیه,5382309
37jgem,6,HAPPY,بسته‌بندی ساندویچ فروشی‌های خیابون مولوی از اینجا بهتره بخدا. سس و‌سالاد و دستمال و چنگال رو با هم ریختن تو‌ کیسه و گره زدن بعد کردن تو یه پاکت که مثلاً معلوم نشه. متاسفم,312849
37jgem,2,SAD,Qaza kamelan yakh karde bood ,5217320
37jgem,10,HAPPY,بسیار عالی اصلا فکر نمیکردم,4615790
37jgem,0,HAPPY,همه چیز عالی بود ممنونم از شما,403147
37jgem,8,HAPPY,بال اصلا مزه خوبی نداشت,6697099
37jgem,10,HAPPY,به موقع و گرم رسید و برخورد پیک خیلی خوب بود ، با اینکه چیکن کوردن بلو کلا غذای چربی ولی من خیلی چیکن کوردن بلوهای باگت رو دوست دارم ولی پوره سیب زمینی رو اصلا دوست نداشتم ,5356696
37jgem,10,HAPPY,پوره سیب زمینی مزه عالی داشت قارچ برگ هم خوب بود,3979491
37jgem,10,HAPPY,"بی نظیر 
سریع
تمیز
مثل همیشه",4407445
37jgem,10,HAPPY,بسیار عالی و خوش طعم. و اینکه سریع رسید. فقط ای کاش نون سیر رو جوری بسته بندی کنین که خمیر نشه.,3942720
37jgem,8,HAPPY,سس قارچ برگر هم خیلی کم شده و هم دیگه مثل قبل خوشمزه نیست ,3382033
37jgem,0,HAPPY,خوشمزه و باکیفیت,3695535
37jgem,10,HAPPY,"چند ساله مشتری باگتم و تا حالا نشده از سفارشم ناراضی باشم
انواع سالاد، ساندویچ، برگر، پیتزا، دیپ دیش و پیش غذا رو تست کردم
مواد اولیه‌ی مرغوب، طراحی چشم‌نواز و طعم خوب از ویژگی‌های همیشگی باگت بوده",5452196
37jgem,0,HAPPY,عالی بی نظیر مثل سابق،ممنونم از اسنپ فود,3021041
37jgem,2,SAD,من مشتري دائمي هستم انتظار همچين غذايي رو نداشتن مرغ مونده بود خيلي بوي بدي هم ميداد خيلي هم بدمزه بود,5108443
37jgem,10,HAPPY,خوشمزه ترین ساندویچ جهان,3477321
37jgem,6,HAPPY,سالاد خوب بود ولی مرغ برعکس همیشه مونده بود و طعم روغن مونده میداد اصلا از باگت توقع نداشتم,4016015
37jgem,8,HAPPY,خمیر استفاده شده در این پیتزا عالی بود,4311867
37jgem,0,HAPPY,شاید یکی از معدود رستوران هایی که با خیال راحت بهش سفارش میدم ، همیشه کیفیت عالی ، بسته بندی عالی ، زمان بندی عالی,145889
37jgem,2,SAD,با اینکه من مشتری پر و پا قرص باگت هستم و کیفیت غذاتون همیشه عالیه ولی از کیفیت پیتزای دیشب اصلا راضی نبودم یکی اینکه سبک پیتزا مارگاریتاتون رو عوض کردین اصلا خوب نیس قبلا خیلی بهتر بود و اینکه غذا سرد دست من رسید بقدری خشک شده بود که قابل خوردن نبود لطفا پیگیری کنید این مساله رو،ممنونم,2016835
37jgem,10,HAPPY,پیتزا بوقلمون کیفیت خوبی ندارد و کاملا خشک است,2963398
37jgem,6,HAPPY,پیتزا سیر و استیک مثل همیشه خوش عطر و طعم نبود,152454
37jgem,4,SAD,قیمت این مدل اصلا با کیفیتش سازگاری نداره، فقط ظاهر فریبنده داره، پرش میکنن کالباس و قارچ ,3829874
37jgem,6,HAPPY,"غذا که مثل همیشه عالی بود و نیمه آماده گرفیتیم و در منزل درست کردیم و مثل همیشه شد
اما وقتی پیتزا قرار نیست بپزه چرا باید یک ساعت و بیست دقیقه طول بکشه تا به دستمون برسه؟",3348956
37jgem,10,HAPPY,من پیتزاهای باگت رو خیلی دوس داشتم‌ولی انقدر خورده بودم طعمش تکراری شده بود دیگه زیاد نمیگرفتم ولی این سس هایی که اضافه کردین واقعا عالیه و تنوعه خیلی خوبی توی طعمش هست,1068870
37jgem,2,SAD,من ساعت ۹.۳۰ سفارش دادم ۱۱.۳۰ غذا امد، غذا خیلی سرد شده بود نمی شد خورد و نوشیدنیم گرم,4856207
37jgem,8,HAPPY,سواری نرمال درست سوخاری نشده نبود و نرم و پوسته جدا تحویل شد ,12722637
37jgem,4,SAD,غذا بسیار چرب و روغنی بود,321969
37jgem,0,HAPPY,"پیتزا کمبو و پیتزا پپرونی بسیار خوشمزه.
اما چند تا سس یک نفره و قاشق و چنگال پلاستیکی و دستمال کاغذی رو ریخته بودن توی یه پلاستیک فریز و تحویل من دادن!!! خب این چه وضعیه؟ واقعا در شان هیچ رستورانی نیست.",1285069
37jgem,8,HAPPY,سفارش به موقع و گرم رسید کوردن بلو خوب بود ولی من پیتزای این مدلی دوست ندارم نون و پنیر بود فقط,7179010
37jgem,2,SAD,متاسفم برای انتخابم ,1979416
37jgem,10,HAPPY,ما دفعه اول بود از اینجا خریداری میکردیم و همه خوششون اومد. دیگه مشتری شدیم,3884611
37jgem,6,HAPPY,خیلییییی چرب بود,5017884
37jgem,2,SAD,غذا کاملا سرد بود. سیب زمینی سرد بود و سفت شده بود. کیفیت پیتزا پایین بود. طعم پیتزا خور نبود. مخصوصا اینکه سرد هم شدا بود.کلا راضی نبودم.,1360041
37jgem,10,HAPPY,لایک   برای باگت  ...چه  متعهد  ..حتی دستمال کاغذی هم  تو  کیسه گذاشته  بودن  ..که  به نظرمن برای غذای  ارسالی به خونه  نیازی  نبود ,3742514
37jgem,10,HAPPY,خیلی خوشمزه بود ولی خب داغ نبود متوسط بود و راضی کننده،ممنون از اسنپ فود و باگت,5226298
37jgem,8,HAPPY,قارچ سوخاری و سیب زمینی بخاطر فلزی بودن ظرفاش حالت خمیری پیدا کرده بودن,4011043
37jgem,8,HAPPY,خوب بود,271854
37jgem,6,HAPPY,من فیله با پوره سفارش داده بودم ، به همین دلیل یک سیب زمینی سرخ شده اضافه هم سفارش داده بودم که هم پوره داشته باشم هم سیب زمینی سرخ شده اما متأسفانه برام فیله با سیب زمینی سرخ شده ارسال شده بود . ,327750
37jgem,0,SAD,سفارش هاى من جداگانه امدند,4240291
37jgem,0,HAPPY,بالاخره پیتزا کمبو یک مقدار شبیه گذشته شده بود.,1080259
37jgem,10,HAPPY,خوب بود,7088298
37jgem,10,HAPPY,"بالاخره غذای باکیفیت توی تهرانپارس هم پیدا شد..
بسیار عالی و با کیفیت و البته گرون که می ارزه",1475891
37jgem,8,HAPPY,طعم غذا مثل همیشه عالی بود ولی متاسفانه زمان ارسال خیلی طولانی شد غذا مقداری سرد شده بود. به جز دیر رسیدن‌ ایرادی نمیشه گرفت‌ ممنون.,4316352
37jgem,6,HAPPY,غذا خوب و گرم بود ولی له شده بود دستمون رسید,249126
37jgem,10,HAPPY,مرسی از اسنپ فود وباگت,4559092
37jgem,10,HAPPY,عالی مثل همیشه،ولی روز ب روز داره قیمت بالا تر میره ک,3756836
37jgem,10,HAPPY,"عالی بود
چیکن استریپس
سس مخصوص
سیب زمینی 
همه چی عالی
به کار عالیتان ادامه بدین",5908817
37jgem,10,HAPPY,ما اولین بار بود از این رستوران سفارش می‌دادیم. واقعا طعم پیتزاها خاص بود و بسیار لذیذ بود. فقط یک مقداری چربی غذا زیاد بود که اگر کمتر باشه از لحاظ سلامتی هم بهتر و دلپذیرتره. از لحاظ حجم هم خیلی مناسب بود. از لحاظ قیمت پیتزا سیر و استیک با توجه به حجم گوشت به کاربرده یک مقدار زیاد بود ولی در کل رضایت داشتیم و از لحاظ کیفیت مواد و طعم عالی بود.,3539292
37jgem,10,HAPPY,ليمو و طعم نعنا مقدارى كم بود. ساندويچ ها خوش طعم و خوشمزه بودند، گوشت رست بيف نرم بود اما براى پخت بيشتر كمى جا داشت، داخل بعضى تكه ها صورتى بود. چيكن كرم مثل هميشه عااالى، برخورد پيك هم عالى بود.,1016346
37jgem,0,HAPPY,"تیکه های مرغ زیادی بزرگ بود و خوب پخته نشده بود واسه همین خیلی حیف و میل شد.
بیشتر مرغ پوستش بود که قابل خوردن نبود. 
باتوجه به قیمت غذاهاشون انتظار بیشتری میره. 
از بسته بندی غذاشون خوشم میاد. 
سس ،چنگال و دستمال و تمام چیزایی که در کنار غذا نیازه داخل بسته بندی وجود داره که یه پوئن مثبته.
از پیتزای سبزیجات راضی بودم.",2008552
37jgem,2,SAD,"واقعا از باگت انتظار نداشتم که اینقدر کیفیت رو پایین بیاره
داخل مرغ بوی زهم میداد و روی مرغ خمیر شده بود
کاهو های برگر پلاسیده شده بود
خیلی کیفیت ایندفعه پایین بود
به علاوه خیلی هم تاخیر داشت
من خواااهش میکنم مشتری هارو بی اعتماد نکنید",4796867
37jgem,10,HAPPY,خیلی با کیفیته.... هر چند قیمتش بالاست ولی به راحتی برای 2 نفر کافیه,3113964
37jgem,8,HAPPY,"چیز برگر خوب بود 
فیله اسپایسی خوب بود و البته خیلی  نمکش کم  بود
پیتزا کمبو طعم و ظاهر خوبی داشت و فقط ژامبون استفاده شده در آن کیفیتش خوب نبود و   از باگت انتظار کیفیت بیشتری داشتم
در کل خوب بود
ممنون",475157
37jgem,10,HAPPY,مثل همیشه عالی ,198529
37jgem,8,HAPPY,سالاد اسفناج این رستوران عالی نیست ولی خوبه. مهم ترین نکتش اینه که غذا رو سریع و گرم میرسونن,3264802
37jgem,6,HAPPY,برگر و سیب زمینی که بسته بندی نداشت و توی پاکت ریخته شده بود ، غذا با اینکه زود رسید از طرف پیک بشدت سرد بود ,6900469
37jgem,0,SAD,تاخیر داشتن در اوردن غذا و این که مرغش زیاد پخته شده بود یذره بیش از حد نرم شده بود ,1732000
37jgem,8,HAPPY,خیلی زود سفارش و فرستادن و کیفیت غذا خوب بود فقط کمی سرد شده بود,2008120
37jgem,10,HAPPY,عالی امیدوارم همیشه همینطور بمونه. مخصوصا نان‌هایی که برای پیتزا استفاده میشه,861987
37jgem,10,HAPPY,مثل همیشه عالی...,2065762
37jgem,10,HAPPY,از میزان مواد روی پیتزا کم شده بود نسبت به دفعات قبل. حیفه که باگت کیفیت غذاهاش رو پایین بیاره,3676622
37jgem,0,SAD,سابقا پیتزا کمبو دیش می گرفتیم که خیلی خوب بود اما این دفعه خیلی خیلی بد بود؛ هم از نظر مواد پیتزا و هم از نظر خمیر که مطمینا عمل نیومده بود و بی مزه و بی کیفیت بود. در ضمن سس مخصوص رو هم نفرستاده بودن. اگر برای افطار توی ماه رمضان فرصت کافی برای تهیه سفارش ندارید مطمینا بهتره سفارش نگیرید تا اینکه یه پیتزای بی کیفیت و فاجعه با این قیمت تحویل بدید. ,295580
37jgem,10,HAPPY,واقعا خوش مزه بود,4933457
37jgem,0,SAD,کیفیت غذا خیلی پایین بود,312725
37jgem,0,HAPPY,کیفیت خوب بود ولی نمی دونم چرا نونش انقدر خشک بود!!,160152
37jgem,2,SAD,"متاسفم
با وجود فاصله ده متری با رستوران ولی چندمین باره که غذا سرد به دستم میرسه 
بهترین غذای دنیا رو بخوری وقتی سرد باشه هیچ ارزشی نداره ",6704191
37jgem,8,HAPPY,خوب بود زود رسید. فقط سوخاری  روی قسمت سینه مرغ کم بود.,5671243
37jgem,4,SAD,"غذا بسیار سرد بود. موهیتو ها نصفشون داخل پاکت ریخته شده بودند و سیب زمینی ها هم از دهن افتاده بودند
به نظرم همچین سطح کیفیتی از غذا برای یک جای معمولیه نه باگت",2357151
37jgem,6,HAPPY,سس سالاد خیلی شور بود,3352158
37jgem,0,HAPPY,عالي,4907569
37jgem,6,HAPPY,"سیب زمینی و قارچ خوب بود اما نان سیر بسیار چرب بود و قابل خوردن نبود.
متشکرم ",4098720
37jgem,0,HAPPY,خیلی خوب بود واقعا با این که دور بود ولی داغ و تازه و خوب با چند تا سس خوشمزه و سالاد کلم تازه رسید که خیلی راضی بودم همه چی خوب ,4982586
37jgem,4,SAD,"طعم سس که خودشون درست کرده بودن و فرستاده بودن خیلی بد بود!حجم سیب زمینی سرخ شده کنار غذا هم کم بود،تکه های مرغ دوتاش مغز پخت نشده بود ، از اینکه زود رسوندن و ممنونم اما برام سوال که چطور با اینکه زود رسوندن ولی غذا سرد بود و نوشیدنی گرم!
اول بارم بود از این رستوران غذا سفارش دادم و برای سفارش اول تجربه بدی بود برام",4912106
37jgem,2,SAD,این بار دوم است که کیفیت ساندویچ اینقدر پایین آمده نان درست برش نخورده بود و محتویات ساندویچ تقریبا بیرون و داخل کاغذ بود کیفیت فیله ی داخل ساندویچ بسیار پایین بود و تقریبا نپخته بود قبلا سس سفید دست ساز با ساندویچ می فرستادند که این بار خبری از آن هم نبود متاسفانه نمی دانم چرا وقتی جایی اسم در می کند باید اینقدر کیفیتش پایین بیاید شخصا دیگر از باگت سفارش نمی دهم  ,1004727
37jgem,4,SAD,پیتزا پپرونی جز چند تا سوسیس نازک هیچی نداره... ,6872963
37jgem,4,SAD,پیتزا یخ یخ بود ,3461637
37jgem,6,HAPPY,بنظره من طعم خوبی نداشتاما فک کنم به عنوان مزه چیز خوبیه,3869071
37jgem,0,HAPPY,فقط متاسفانه سرد بود اگر گرمتر باشه دلچسبتره,6388994
37jgem,10,HAPPY,مثل همیشه عالی بود ممنون از اسنپ فود,3748166
37jgem,10,HAPPY,قارچ ها خیلی کوچسک بودن و مقدارشم کم بود! پیتزا بد نبود ولی قیمتش بالاست!!,311788
37jgem,10,HAPPY,عالی,4139230
37jgem,2,SAD,ما قبلا ازین رستوران سفارش میدادیم اینبار حجم غذا خیلی کم شده بود و کیفیت غذا خیلی پایین اومده بود و مرغ ساندویچ چیکن برگر کاملا خام بود,4751705
37jgem,4,SAD,متاسفانه غذا سرد به دستمون رسید و مثل غذای دفعه قبل طعم خوبی نداشت.,4219893
37jgem,8,HAPPY,پیتزا کمبو کاملا سرد تحویل شد!,1546707
37jgem,10,HAPPY,"بسته بندی بسیار خوب، ارسال کاملا بهداشتی (پیک با کیف مخصوص غذا رو آورد و خودش دست نزد به بسته ها)، کیفیت باگت که دیگه قابل وصف نیست. پیتزای فوق العاده خاص...
پیشنهاد: یه مقدار حجم یا ارتفاع پیتزا رو افزایش بدید. سپاس",1612967
37jgem,0,SAD,فقط ميتونم بگم عالي بود ,390928
37jgem,10,HAPPY,همه چیز عالی. ممنون از باگت. ,4896999
37jgem,8,HAPPY,راضی بودم، خوشمزه بود ولی قبلن بهتر بود. پنیرش خییلی زیاد بود ولی در کل خوشمزه بود,278745
37jgem,0,HAPPY,سس قارچتون متاسفانه خوب نبود.,1094437
37jgem,0,SAD,با توجه به مسافت بسیار نزدیک با فست فود متاسفانه هر دو سفارش کاملا سرد بود ,1474937
37jgem,10,HAPPY,به جرات می تونم بگم یکی از خوشمزه ترین پیتزاهایی بود که تو عمرم خوردم. عاااالی بود. کمتر از ۳۰ دقیقه به دستم رسید و اینکه پیک هم کاملن بهداشتی، با دستکش و ماسک غذا رو اورد و من خودم پیتزا رو از کیفش برداشتم و اینکه از خود رستوران هم زنگ زدن تا مطمئن شن همه چیز با رعایت کامل اصول بهداشت تهویل داده شده,278745
37jgem,2,SAD,"اصلا پیشنهاد نمیکنم... تخم مرغ درست میکردیم بهتر بودتا اینقدر هزینه کنیم و درآخر غذای سردو بی کیفیت بخوریم...
۱_تاخیر زیاد
۲_سرد بودن هردوتا پیتزا
۳_سفت بودن نان پیتزا
چنگال یکبار مصرف با پیتزا فرستادن بجای اینکارا رو کیفیت کار کنید لطفا...",3942236
37jgem,10,HAPPY,کلا عالیه همیشه,1116239
37jgem,0,HAPPY,گرم و خوشمزه,201903
37jgem,10,HAPPY,ترد و خوشمزه,734632
37jgem,8,HAPPY, ولی سیب زمینی با سس قارچ بو موندگی میاد.,254709
37jgem,10,HAPPY,خیلی خوشمزه بود ممنونم,4711406
37jgem,10,HAPPY,مثل همیشه خوب بود، من این طعم رو دوست دارم,1061292
37jgem,4,SAD,خیلی‌‌خیلی‌ سر‌د بود,7169077
37jgem,8,HAPPY,غذا خوب بود ولی سرد سرد سرد ,1826309
37jgem,6,HAPPY,"برخورد پیک خوب بود ،غذا گرم رسید دستم 
وووووولی اخه چرا توجه نمیکنید ب توضیحات من میگم فقط ۲تا سس مخصوص سفید بذارید برام ۱دونه میذارید با سس تند و کچاپ 
و سس سفید اتفضاح بود اخه چرا تغییرش میدین 
بعدش مگه شما رستوران ایرانی هستین سس با ماست درست میکنید ؟؟؟
هرچی این نظر و دادن متاسفم ",4518536
37jgem,8,HAPPY,طعم چیکن برگرخوب بودولی بنظرم ازتوی منوبایدسس مخصوص روحذف کنیدچون دراکثرمواقع ارسال نمیکنیدیابرای۲عددبرگریک سس مخصوص میذاریدباوجودی که من درتوضیحات ذکرکرده بودم ارسال سس مخصوص فراموش نشه,5881483
37jgem,2,SAD,پیتزا سرد  نون  یه لایه پنیر چند تکه گوشت  کوچیک شاید بوقلمون در کل خیلی بد، اولين و آخرین سفارش از باگت,7139400
37jgem,0,HAPPY,"غذا که عالی بود
فقط یکم سرد شده بود
سیب زمینیش هم من بود",6151227
37jgem,10,HAPPY,مثل همیشه عالی بود . مرسی باگت,3513540
37jgem,0,SAD,نون کهنه بود.پیاز نداشت.طعم برگر هم مثل همیشه نبود.من مشتری همیشگی هستم.,3663166
37jgem,6,HAPPY,خمیز پیتزل به نسبت دفعه های قبل خوب پخته نشده بود ,738382
37jgem,10,HAPPY,برای پیتزا خانواده سه تا کچاپ گذاشتن که کمه واقعن ,256408
37jgem,10,HAPPY,خیییلی عالی واقعا من خیلی غذاهاتونو دوست داشتم و هر بارم شما رو انتخاب میکنم,7370116
37jgem,10,HAPPY,با کیفیت بود .ممنون,230648
37jgem,10,HAPPY,ممنونم.غذا با کیفیت و گرم و زودتر از زمان اعلامی رسید,973509
37jgem,10,HAPPY,مثل همیشه خوشمزه بود,2145838
37jgem,6,HAPPY,قبلا سفارش سوخاری میدادیم ۳ نوع سس مختلف همراهش بود سری پیش شد ۲ مدل این سری فقط یه مدل سس بود با سیب زمینی خیلی خیلی کم ...  اگر برای کسی که سه تیکه سفارش میده سیب زمینیشو زیادتر نمیکنید حداق کم ترش هم نکنید. ,982014
37jgem,10,HAPPY,عالی و سالم بود ممنونم ,511556
37jgem,4,SAD,غذا سرد بود,5840612
37jgem,0,SAD,غذا به شدت سرد بود و کیفیت تازگی و خوش خوراک بودن رو از دست داده بود.,775882
37jgem,2,SAD,واقعا جای تاسف هست که بعد از ۲ ساعت و نیم  منتظر بودن برای یک غذا در اخر هم یک غذای مونده و یخ زده با سیب زمینی های مونده تحویل بدن ,2202206
37jgem,8,HAPPY,خوب بود ,4801159
37jgem,8,HAPPY,"خمیر پیتزا جالب نبود و خییییلی کم ملات بود شاید ۶۰ گرم مرغ بیشتر نبود با پنیر و گوجه 
غذا تقریبا یخ کرده یود",304301
37jgem,8,HAPPY,پیتزا خوشمزه بود. نسبتا به موقع رسید اما سسی ک قرار بود ویژه باشه با یک نفره جایگزین شده بود.,3017210
37jgem,0,HAPPY,طعم خیلی خوبی داشت یه جوایی طعمش مزه سیر میداد و من ازش لذت بردم,5065298
37jgem,10,HAPPY,غذا عالی ولی برخورد پیکتون افتضاح بود,4423388
37jgem,10,HAPPY,عالی,3416571
37jgem,10,HAPPY,خوب بود فقط توقع داشتم چون اسم سالاد کینوا هست ، کینوای بیشتری داشت ,1420349
37jgem,0,HAPPY,کیفیت غذاها عالی بود. فقط به نظر میاد ظرف قارچ سوخاری مناسب نبود. چون بخارش باعث شده بود کاملا نرم و خمیر بشه. ,246249
